"name","year","abstract","keywords"
"intelligent anomaly detection of trajectories for iot empowered maritime transportation systems","2023","The convergence of Maritime Transportation Systems (MTS) and Internet of Things (IoT) has led to the promising IoT-empowered MTS (IoT-MTS). However, abnormal trajectories of maritime transportation ships can have highly negative impacts on the management of IoT-MTS. Therefore, anomaly detection of trajectories is important for the successful deployment of IoT-MTS. In this paper, we propose a Transfer Learning based Trajectory Anomaly Detection strategy, named TLTAD, for IoT-MTS. Specifically, a variational autoencoder is used to discover the potential connections between each dimension of the normal trajectory, while a graph variational autoencoder is used to explore the spatial similarity between normal trajectories. Based on internal connection of trajectories, a deep reinforcement learning algorithm, Twin Delayed Deep Deterministic policy gradient (TD3), is employed to train the trajectory anomaly detection model. To reduce the model training time, transfer learning is used to migrate the trained anomaly detection model between different regions of an ocean area or between similar ocean areas. Moreover, an efficient data transformation module is designed to improve the efficiency of model transfer. The experiments were conducted on a real-world automatic identification system (AIS) dataset. The results indicate that the proposed TLTAD can provide accurate anomaly detection on shipsâ€™ trajectories in IoT-MTS with reduced model training times.","reduced model training times,Transportation,deep learning (artificial intelligence),Anomaly detection,maritime transportation systems,anomaly detection,Internet of Things,transportation,Marine vehicles,abnormal trajectories,Twin Delayed Deep Deterministic policy gradient,highly negative impacts,model training time,ships,IoT-MTS,trajectory anomaly detection model,deep reinforcement learning algorithm,Data models,normal trajectory,reinforcement learning,maritime transportation ships,Artificial intelligence,real-world automatic identification system dataset,Maritime Transportation Systems,graph variational autoencoder,trained anomaly detection model,Trajectory Anomaly Detection strategy,gradient methods,Deep reinforcement learning,model transfer,Trajectory,promising IoT-empowered MTS,intelligent Anomaly Detection,transfer learning,learning (artificial intelligence),data handling,Analytical models,"
"satellite-based ais receiver for dense maritime zones","2017","A satellite-based Automatic Identification System (S-AIS) receiver has a high probability of message collisions, both in time and in frequency, for a zone densely populated by AIS-enabled ships. Banks of time-and-frequency selective detectors (that use message fields from un-collided messages from the same ship-track together with interference cancellation) decode collided messages. Algorithms are suited for on-board processing, with enhanced message and ship detection probability.","Satellites,Decoding,time-and-frequency selective detectors,ship detection probability,decode collided messages,satellite based automatic identification system,Marine vehicles,satellite,Syndrome decoding,Maritime,interference cancellation,decoding,S-AIS receiver,S-AIS,satellite communication,message collisions,iso-Doppler,AIS,dense maritime zones,Artificial intelligence,probability,AIS receiver,Receivers,Interference,Demodulation,AIS-enabled ships,iso-delay,"
"high resolution isar imaging for maritime targets by encoder-decoder network combined with the time-frequency attention","2021","The Inverse Synthetic Aperture Radar (ISAR) imaging result of a rotating maritime target is usually defoculsing since the complex sea conditions may cause time-varying spin speed of targets. A common solution is to utilize range instantaneous Doppler (RID) algorithm for short time imaging, however, the RID algorithm suffers from the low time-frequency resolution. Therefore, this paper proposes an Encoder-Decoder neural net-work combined with Time-Frequency Attention (TFA) module to enhance instantaneous frequency resolution. The TFA module is utilized to extract the spectral lines of weak scatterers, further, the Encoder-Decoder network is designed to transform the low-resolution time-frequency refined by the TFA module to their high-resolution counterparts. Finally, the performance of the proposed method is evaluated on the simulated and real measured data. Both imaging and numerical results certify the meliority of the proposed method in enhancing frequency resolution and reserving the spectral lines of weak scatterers.","short-time Fourier transform (STFT),spectral lines,low time-frequency resolution,Time-Frequency Attention module,image resolution,instantaneous frequency resolution,Inverse synthetic aperture radar (ISAR),Neural networks,range instantaneous Doppler algorithm,high-resolution counterparts,imaging results,neural nets,RID algorithm suffers,TFA module,Training data,synthetic aperture radar,Maritime targets,maritime targets,Encoder-Decoder network combined,complex sea conditions,high resolution ISAR imaging,radar imaging,rotating maritime target,short time imaging,Encoder-Decoder network,Encoder-Decoder neural net-work,Inverse Synthetic Aperture Radar imaging result,Time-Frequency Attention,Time-frequency analysis,Image resolution,Radar imaging,Deep learning,Imaging,time-frequency analysis,weak scatterers,Signal processing algorithms,low-resolution time-frequency,"
"unsupervised reconstruction of sea surface currents from ais maritime traffic data using learnable variational models","2021","Space oceanography missions, especially altimeter missions, have considerably improved the observation of sea surface dynamics over the last decades. They can however hardly resolve spatial scales below ~ 100km. Meanwhile the AIS (Automatic Identification System) monitoring of the maritime traffic implicitly conveys information on the underlying sea surface currents as the trajectory of ships is affected by the current. Here, we show that an unsupervised variational learning scheme provides new means to elucidate how AIS data streams can be converted into sea surface currents. The proposed scheme relies on a learnable variational framework and relate to variational auto-encoder approach coupled with neural ODE (Ordinary Differential Equation) solving the targeted ill-posed inverse problem. Through numerical experiments on a real AIS dataset, we demonstrate how the proposed scheme could significantly improve the reconstruction of sea surface currents from AIS data compared with state-of-the-art methods, including altimetry-based ones.","AIS maritime traffic data,neural ODE,unsupervised learning,sea surface currents,size 100.0 km,space oceanography missions,AIS dataset,learnable variational models,variational learning,AIS data streams,ocean circulation,unsupervised variational learning scheme,Sea surface,unsupervised reconstruction,Artificial intelligence,Surface reconstruction,Numerical models,targeted ill-posed inverse problem,data assimilation,learnable variational framework,Training,Sea surface currents,Trajectory,sea surface dynamics,variational auto-encoder approach,AIS monitoring,Inverse problems,oceanographic techniques,"
"image-consistent detection of road anomalies as unpredictable patches","2023","We propose a novel method for anomaly detection primarily aiming at autonomous driving. The design of the method, called DaCUP (Detection of anomalies as Consistent Unpredictable Patches), is based on two general properties of anomalous objects: an anomaly is (i) not from a class that could be modelled and (ii) it is not similar (in appearance) to non-anomalous objects in the image. To this end, we propose a novel embedding bottleneck in an auto-encoder like architecture that enables modelling of a diverse, multi-modal known class appearance (e.g. road). Secondly, we introduce novel image-conditioned distance features that allow known class identification in a nearest-neighbour manner on-the-fly, greatly increasing its ability to distinguish true and false positives. Lastly, an inpainting module is utilized to model the uniqueness of detected anomalies and significantly reduce false positives by filtering regions that are similar, thus reconstructable from their neighbourhood. We demonstrate that filtering of regions based on their similarity to neighbour regions, using e.g. an inpainting module, is general and can be used with other methods for reduction of false positives. The proposed method is evaluated on several publicly available datasets for road anomaly detection and on a maritime benchmark for obstacle avoidance. The method achieves state-of-the-art performance in both tasks with the same hyper-parameters with no domain specific design.","Benchmark testing,anomalous objects,road anomaly detection,Feature extraction,detection of anomalies as consistent unpredictable patches,Design methodology,Filtering,nearest-neighbour manner,nonanomalous objects,object detection,feature extraction,multimodal known class appearance,inpainting module,autonomous driving,domain specific design,nearest neighbour methods,Roads,image-consistent detection,mobile robots,image restoration,DaCUP,Task analysis,auto-encoder,Algorithms: Image recognition and understanding (object detection,obstacle avoidance,Computer vision,road vehicles,categorization,image-conditioned distance features,class identification,segmentation),"
"spatial-modulated physical-layer network coding based on block markov superposition transmission for maritime relay communications","2020","As an alternative to satellite communications, multi-hop relay networks can be deployed for maritime long-distance communications. Distinct from terrestrial environment, marine radio signals are affected by many factors, e.g., weather conditions, evaporation ducting, and ship rocking caused by waves. To ensure the data transmission reliability, the block Markov superposition transmission (BMST) codes, which are easily configurable and have predictable performance, are applied in this study. Meanwhile, the physical-layer network coding (PNC) scheme with spatial modulation (SM) is adopted to improve the spectrum utilization. For the BMST-SM-PNC system, we propose an iterative algorithm, which utilizes the channel observations and the a priori information from BMST decoder, to compute the soft information corresponding to the XORed bits constructed by the relay node. The results indicate that the proposed scheme outperforms the convolutional coded SM-PNC over fast-fading Rician channels. Especially, the performance can be easily improved in high spatial correlation maritime channel by increasing the memory m.","Markov processes,channel coding,evaporation ducting,maritime relay communications,physical-layer network coding scheme,physical-layer network coding,BMST decoder,soft information,fast-fading Rician channels,multihop relay networks,decoding,ship rocking,XORed bits,data transmission reliability,ships,Rician fading,error statistics,Rician channels,relay node,Network coding,Relay networks (telecommunications),spectrum utilization,BMST-SM-PNC system,maritime long-distance communications,block Markov superposition transmission codes,network coding,convolutional codes,Spread spectrum communication,relay networks (telecommunication),iterative methods,Satellite broadcasting,convolutional coded SM-PNC,satellite communications,channel capacity,terrestrial environment,marine communication,marine radio signals,weather conditions,block Markov superposition transmission,iterative algorithm,high spatial correlation maritime channel,spatial modulation,"
"multicore computation of tactical integration system in the maritime patrol aircraft using intel threading building block","2014","A Tactical Integration System (TIS) in the Maritime Patrol Aircraft (MPA) is a system that serves to carry out the mission of surveillances, detection, positioning, and identify the objects in the ocean with video streaming. At current computing of video was done sequentially which involves many matrix operations with command repetition (looping) such as: sequential for, assuming that the processor used is one processor. Meanwhile, a multicore computer systems is already in a personal environment. Example: Intel Core 2 Duo (2 cores), i7 (8 core), Haswell. To maximize the performance of computer systems, Intel TBB (Threading Building Blocks) must be used in multicore computing / programming. In this study, has designed and implemented a software for parallel video streaming using Intel TBB framework Programs written in C + + on MS Visual Studio 2010 and run on computers based on Intel Core 2 Duo on MS Windows 7 operating system. System testing is performed sequential and parallel on avi video with compression quality factor (Q = 1, 5, 10). By the Amdahl's law limitation, the average encoder speedup for quality factor Q = 1 is 1.2665, for Q = 5 is 1.2911, and for Q = 10 is 1.3015. Whereas the average decoder speedup for quality factor Q = 1 is 1.3023, for Q = 5 is 1.3558, and for Q = 10 is 1.3776.","aircraft,MS Windows 7 operating system,Handheld computers,TIS,matrix algebra,Informatics,tactical integration system,video compression quality factor,Intel Threading Building Block,MPA,parallel video streaming,multiprocessing systems,Aerospace engineering,Haswell,C++,C++ language,multicore programming,multicore computer systems,i7,Intel Core 2 Duo,matrix operations,video streaming,data compression,Industrial engineering,command repetition,MS Visual Studio 2010,multicore computing,Aerospace industry,Software,Electrical engineering,aerospace computing,Amdahl law limitation,video coding,Intel TBB,maritime patrol aircraft,"
"trajectory prediction for marine vessels using historical ais heatmaps and long short-term memory networks⁎⁎this research is sponsored by the danish innovation fund, the danish maritime fund, orients fund and the lauritzen foundation through the autonomy part of the shippinglab project, grant number 8090-00063b.","2021","Estimating the trajectory of other vessels is essential when navigating a marine vessel, both as a human navigator and as a machine. By estimating the trajectories of other vessels, sub-systems such as collision avoidance algorithms can plan ahead accordingly in order to avoid conflicts. To estimate the trajectories of other vessels, the use of Automatic Identification System (AIS) is a good candidate data-point, as this is becoming increasingly more common, and in some cases even mandated, on-board vessels. This paper presents a data-driven approach that uses the historical AIS data within a selected area in the Danish waters. The historical data is transformed into a probabilistic heat map using Kernel Density Estimation (KDE), and is further encoded using a Convolutional Autoencoder (CAE) before entered into the estimation scheme. The estimation scheme consists of a Long Short-term Memory (LSTM) model, in a Generative Adversarial Network (GAN) configuration, which is sampled multiple times, yielding a single trajectory prediction with uncertainty. The performance of the estimation scheme is demonstrated and compared against two other commonly used methods, showing that the probabilistic heat map provides valuable information, compared to the baseline methods.","Autonomous Navigation,AIS Data,Machine Learning,Autonomous Marine Vessels,Trajectory Prediction,"
"the automatic identification system of maritime accident risk using rule-based reasoning","2012","Current maritime traffic monitoring systems are not sufficiently adapted to the identification of maritime accident risk. It is very difficult for operators responsible for monitoring traffic to identify which vessels are at risk among all the shipping traffic displayed on their screen. They are overwhelmed by huge amount of kinematic ship data to be decoded. To improve this situation, this paper proposes a system for the automatic identification of maritime accident risk. The system consists of two modules. The first automates expert knowledge acquisition through the computerized exploration of historical maritime data, and the second provides a rule-based reasoning mechanism.","marine accidents,data mining,Marine vehicles,Monitoring,rule-based reasoning mechanism,maritime accident risk,automatic identification system,marine engineering,Accidents,Databases,Maritime monitoring systems,expert knowledge acquisition,risk management,automatic rule-based reasoning,maritime accident risk identification,maritime traffic monitoring systems,kinematic ship data,inference mechanisms,computerized historical maritime data exploration,knowledge acquisition,Engines,Cognition,Data mining,"
"maritime radar target detection using convolutional neural networks","2022","Maritime airborne surveillance radars operating at medium to high grazing angles experience significant sea clutter returns with a time and range-varying Doppler spectra, thus making the detection of small targets extremely difficult. This has led to the development of new techniques to better isolate targets from the background sea clutter. In this paper, two convolutional neural network approaches are proposed. They include a method of reconstructing maritime point target signals, while rejecting non-homogeneous clutter and a novel approach that is able to directly locate the target signal peak from sea clutter using a convolutional autoencoder trained in a supervised manner. These two approaches may be considered pre-processing stages in a detection scheme, with a simple threshold detection scheme used to detect targets with a desired false alarm rate.","airborne radar,isolate targets,marine radar,radar detection,target detection,radar clutter,simple threshold detection scheme,neural nets,target tracking,background sea clutter,convolutional autoencoder,nonhomogeneous clutter,Training data,maritime airborne surveillance radars,object detection,target signal peak,search radar,maritime point target signals,convolutional neural network,Radar clutter,radar signal processing,Radar sea clutter,Convolution,convolutional neural networks,clutter,Azimuth,Doppler radar,maritime radar target detection,Object detection,learning (artificial intelligence),high grazing angles,significant sea clutter returns,convolutional neural network approaches,Radar detection,"
"wasrâ€”a water segmentation and refinement maritime obstacle detection network","2022","Obstacle detection using semantic segmentation has become an established approach in autonomous vehicles. However, existing segmentation methods, primarily developed for ground vehicles, are inadequate in an aquatic environment as they produce many false positive (FP) detections in the presence of water reflections and wakes. We propose a novel deep encoderâ€“decoder architecture, a water segmentation and refinement (WaSR) network, specifically designed for the marine environment to address these issues. A deep encoder based on ResNet101 with atrous convolutions enables the extraction of rich visual features, while a novel decoder gradually fuses them with inertial information from the inertial measurement unit (IMU). The inertial information greatly improves the segmentation accuracy of the water component in the presence of visual ambiguities, such as fog on the horizon. Furthermore, a novel loss function for semantic separation is proposed to enforce the separation of different semantic components to increase the robustness of the segmentation. We investigate different loss variants and observe a significant reduction in FPs and an increase in true positives (TPs). Experimental results show that WaSR outperforms the current state of the art by approximately 4% in F1 score on a challenging unmanned surface vehicle dataset. WaSR shows remarkable generalization capabilities and outperforms the state of the art by over 24% in F1 score on a strict domain generalization experiment.","separation loss,Semantic segmentation,Neural Networks,remotely operated vehicles,semantic segmentation,different loss variants,ResNet101,water component,unmanned surface vehicles (USVs),Feature extraction,marine environment,novel decoder,water reflections,Image Processing,WaSR-a water segmentation,novel loss function,atrous convolutions,false positive detections,ground vehicles,inertial measurement unit,computer vision,autonomous vehicles,feature extraction,Computer,challenging unmanned surface vehicle dataset,different semantic components,positives,wakes,obstacle detection,segmentation accuracy,inertial information,Water,Image segmentation,established approach,Autonomous vehicles,mobile robots,Deep learning,aquatic environment,deep encoder-decoder architecture,refinement maritime obstacle detection network,Computer-Assisted,image segmentation,collision avoidance,existing segmentation methods,learning (artificial intelligence),visual ambiguities,refinement network,rich visual features,semantic separation,"
"a deep semantic autoencoder for maritime wireless communications","2023","With the rapid development of maritime transportation, ocean tourism, monitoring, surveillance and aquaculture, the maritime communication industry has encountered new opportunities. Maritime End-to-end (E2E) communication systems based on deep learning (DL) have become diverse, while semantic communication systems have become a critical research point due to their ability to understand and analyze natural language. In this paper, we propose a deep semantic autoencoder (DSA) for maritime wireless communications. The DSA consists of a semantic encoder, channel encoder, channel decoder, and semantic decoder. The DSA employs transformers and convolutional neural networks to extract and restore the meaning of sentences while minimizing semantic errors during transmission. In order to enhance the effectiveness of the DSA in transmitting maritime data, the Rician fading channel is utilized to simulate complex and varied marine environments. Furthermore, the system parameters of the DSA are optimized through training the maritime data and calculating the loss functions. Extensive simulation experiments indicate that compared to the benchmark, the DSA demonstrates superior bilingual evaluation understudy and sentence similarity performance under different signal-to-noise ratio conditions, indicating its ability to effectively extract semantics.","end-to-end,semantic communication systems,Semantics,surveillance,maritime data,Transportation,Benchmark testing,deep learning (artificial intelligence),system parameters,maritime wireless communications,semantic encoder,maritime communication industry,deep semantic autoencoder,natural language processing,semantic errors,Wireless communication,critical research point,deep learning,marine safety,semantics,marine engineering,Maritime wireless communications,Rician channels,maritime transportation,maritime end-to-end communication systems,convolutional neural nets,semantic decoder,Training,ocean tourism,marine communication,Simulation,Surveillance,artificial intelligence,DSA,channel decoder,aquaculture,Rician fading channel,"
"soft decision viterbi decoder for free space optical through maritime atmosphere channel","2018","In this paper, we investigated bit error rate (BER) performance of free space optical (FSO) with On-Off Keying (OOK) modulation through maritime atmosphere channel using convolutional encoder and soft decision Viterbi decoder as channel coding. This study aimed to improve BER performance of FSO communication system using channel coding as error correction. Soft decision Viterbi decoder with constraint length 3 has been applied in this study. The simulation results show that soft decision Viterbi decoder can improve BER performance.","Decoding,Bit error rate,channel coding,Maritime,on-off keying modulation,Atmospheric modeling,free-space optical communication,Viterbi,OOK modulation,error statistics,soft decision Viterbi decoder,BER performance,Viterbi algorithm,free space optical,convolutional encoder,convolutional codes,error correction codes,FSO communication system,error correction,error rate performance,Viterbi decoding,Atmospheric waves,Terrestrial atmosphere,marine communication,maritime atmosphere channel,FSO,"
