"name","year","abstract","keywords"
"green rf/fso communications in cognitive relay-based space information networks for maritime surveillance","2019","In this paper, we provide an overview of a space-based network for the maritime surveillance information sharing and evaluate the coverage, the throughput and the real-time reception capacity of the presented systems. The focus is on the feeder link of a multi-hop geostationary satellite system. We propose a cognitive relay-based architecture for the inter-satellite and satellite-to-ground communication with a multi-band spectrum sensing operating on both free-space optical (FSO) and radio frequency (RF) bands. Furthermore, modeling the spectrum sensing energy as a Gamma distribution we derive the formula of the network energy consumption in presence of multipath fading and considering two different data relay schemes: amplify-and-forward (AF) and decode-and-forward (DF). We prove that the RF/FSO communication in the proposed relay-based architecture enhances the data transmission increasing the throughput and the real-time reception capacity and reducing the network energy consumption. The performance evaluation shows that the DF scheme overcomes the AF one in terms of energy consumption while the AF scheme overcomes the DF one in terms of probability detection, both experience the same throughput. Finally, the proposed novel architecture has been compared with existing ones showing that it enhances the current maritime surveillance systems by jointly optimizing communication functionalities.","inter-satellite communication,surveillance,telecommunication power management,cognitive radio,real-time reception capacity,multi-hop networks,satellite systems,Marine vehicles,radio frequency free-space optical communications,cognitive relay-based networks,radio spectrum management,green RF/FSO communications,free-space optical communication,Satellite communication,detection probability,network energy consumption,marine engineering,optimisation,coverage evaluation,amplify-and-forward,multiband spectrum sensing,feeder link,decode-and-forward,maritime surveillance information sharing,space information networks,multihop geostationary satellite system,Spread spectrum communication,relay networks (telecommunication),decode and forward communication,data relay,satellite links,Maritime surveillance,signal detection,satellite-to-ground communication,Surveillance,throughput,RF/FSO communication,multipath fading,network energy,amplify and forward communication,oceanographic techniques,"
"smart anomaly detection for slocum underwater gliders with a variational autoencoder with long short-term memory networks","2022","Autonomous underwater vehicles (AUVs) are used extensively for monitoring the world’s oceans, taking measurements of oceanographic characteristics along the water column. Presently, there is no holistic anomaly detection system in operation and AUVs require experienced pilots to monitor the progress of missions. This results in a large operational overhead and reduces the number of AUVs that can be deployed simultaneously. This article proposes an online anomaly detection system for underwater gliders based on a data-driven approach. A novel Long Short-Term Memory (LSTM) Variational Autoencoder (VAE) has been developed and trained using field data from four deployments with healthy glider behaviour and then tested against four deployments where faults are present. The system is able to detect wing loss with a high degree of accuracy on gliders unseen during the models training, highlighting the generality of the model to different platforms. Additionally, the VAE method outperforms model-based solution for the detection of biofouling, proving its generality to different types of anomalies. The proposed smart anomaly detection will contribute to increasing the capacity of AUVs and reducing the dependence on support vessels and experienced pilots.","Underwater glider,Variational autoencoder,Marine autonomous system,Anomaly detection,Long short-term memory network,"
"radis: a real-time anomaly detection intelligent system for fault diagnosis of marine machinery","2022","By enhancing data accessibility, the implementation of data-driven models has been made possible to empower strategies in relation to O&M activities. Such models have been extensively applied to perform anomaly detection tasks, with the express purpose of detecting data patterns that deviate significantly from normal operational behaviour. Due to its preeminent importance in the maritime industry to adequately identify the behaviour of marine systems, the Real-time Anomaly Detection Intelligent System (RADIS) framework, constituted by a Long Short-Term Memory-based Variational Autoencoder in tandem with multi-level Otsu’s thresholding, is proposed. RADIS aims to address the current gaps identified within the maritime industry in relation to data-driven model applications for enabling smart maintenance. To assess the performance of such a framework, a case study on a total of 14 parameters obtained from sensors installed on a diesel generator of a tanker ship is introduced to highlight the implementation of RADIS. Results demonstrated the capability of RADIS to be part of a diagnostic analytics tool that will promote the implementation of smart maintenance within the maritime industry, as RADIS detected an average of 92.5% of anomalous instances in the presented case study.","Marine machinery,Deep learning,Intelligent real-time systems,Anomaly detection,Smart maintenance,Ship systems,"
"an ais-based deep learning framework for regional ship behavior prediction","2021","This study presents a deep learning framework to support regional ship behavior prediction using historical AIS data. The framework is meant to aid in proactive collision avoidance, in order to enhance the safety of maritime transportation systems. In this study, it is suggested to decompose the historical ship behavior in a given geographical region into clusters. Each cluster will contain trajectories with similar behavior characteristics. For each unique cluster, the method generates a local model to describe the local behavior in the cluster. In this manner, higher fidelity predictions can be facilitated compared to training a model on all available historical behavior. The study suggests to cluster historical trajectories using a variational recurrent autoencoder and the Hierarchical Density-Based Spatial Clustering of Applications with Noise algorithm. The past behavior of a selected vessel is then classified to the most likely clusters of behavior based on the softmax distribution. Each local model consists of a sequence-to-sequence model with attention. When utilizing the deep learning framework, a user inputs the past trajectory of a selected vessel, and the framework outputs the most likely future trajectories. The model was evaluated using a geographical region as a test case, with successful results.","Collision avoidance,Deep learning,Maritime safety,Trajectory prediction,AIS,Ship navigation,Maritime situation awareness,"
"flexible data integrity checking with original data recovery in iot-enabled maritime transportation systems","2023","Internet of things (IoT) has emerged as a promising technology that can be widely used in various industries to realize real-time information collection, so as to improve production efficiency and reduce running costs. By combining the technology of IoT, maritime transportation systems (MTS) can prevent vessels collision, improve the efficiency of maritime transportation and reduce the loss of revenue for ports and shipbuilders. The large amount of real-time data generated in IoT-enabled MTS can be efficiently utilized to predict the future trajectories and hotspots of vessels on the sea combined with historical data. However, the maritime traffic data in MTS cannot be effectively processed in traditional big data analysis methods, and the integrity of it needs to be checked before being used to achieve the prediction of trajectories and high-density areas of vessels. In this paper, we propose a flexible data integrity checking scheme with original data recovery in IoT-enabled MTS. In the proposed scheme, the data blocks of vessels are encoded based on the technology of erasure coding. To ensure the availability of the historical data, the existence and the integrity of the data elements stored in the cloud can be checked. Moreover, the original data blocks can be recovered efficiently if the encoded data elements have been corrupted or deleted. Security analysis demonstrates that the proposed scheme can be proved to be correct and is secure against malicious attacks. Performance analysis shows that our scheme is more efficient than the previous schemes.","data recovery,encoded data elements,data integrity,maritime traffic data,maritime transportation systems,historical data,Internet of Things,transportation,production efficiency,integrity checking,blockchains,vessels collision,data analysis,original data recovery,future trajectories,marine safety,original data blocks,real-time data,real-time information collection,Data integrity,Real-time systems,Memory,Big Data,IoT-enabled MTS,Trajectory,Cloud computing,flexible data integrity checking scheme,Security,data integration,IoT-enabled maritime transportation systems,traditional big data analysis methods,"
"mvffnet: multi-view feature fusion network for imbalanced ship classification","2021","The accurate classification of moving ships is of fundamental importance to maritime authorities for ensuring the safety and security of shipping operations. With the wide use of automatic identification systems (AISs), which allow ships to receive identification/location information from nearby ships, it is feasible to classify the types of ships by analysing ship behaviour from AIS-based trajectories. However, the imbalanced features of AIS data make it difficult to achieve satisfactory classification results in the presence of several different types of ships. To overcome these potential limitations, we propose a multi-view feature fusion network (MVFFNet) to achieve accurate ship classification with imbalanced data. To guarantee the powerful representation and generalization abilities of MVFFNet, we first extract several multi-view features (i.e., motion features and morphological features) from AIS-based ship trajectories. Several kinematic variables related to ship behaviour are empirically adopted as motion features. The morphological features are automatically extracted via convolutional auto-encoder (CAE) networks. CAE networks are capable of optimally learning the features from informative trajectory images, which are strictly related to the original ship trajectories. The bidirectional gated recurrent unit (BiGRU) network is then proposed to combine multi-view features to generate the ship classification results. In addition, a hybrid loss function is presented to handle the imbalance problem of ship types, potentially leading to enhanced robustness and accuracy of ship classification. Comprehensive experiments on two realistic datasets have demonstrated that our proposed MVFFNet consistently outperforms other competing methods in terms of classification accuracy and robustness.","Ship classification,BiGRU,Imbalanced data,Multi-view feature fusion,CAE,"
"decoding the mechanism of formation in marine ooids: a review","2019","Ooid shoals, sedimentary structures consisting of carbonate grains, are often used as proxies to explore changes in seawater chemistry over Earth history. Despite their importance as contributors to the global carbonate budget and as paleo-environmental indicators for water depth, pH, temperature and water energy, the mechanism of formation of these concentric, sub-spherical concretions of tangentially or radially arranged aragonite or calcite crystals is still the subject of intense debate. Unlike oncoids, whose microbial origins are well acknowledged, ooids are traditionally viewed as abiotic grains, mainly produced in suspension by agitated, warm waters that are supersaturated with respect to CaCO3. Yet, there is considerable evidence, including geochemical bio-signatures and detection of viable microbes capable of mineralization and biofilm production and degradation, to suggest otherwise. The emergence of new and sophisticated technologies reveals that the level of microbial diversity of these sedimentary grains exceeds that of some microbialite systems. These findings have refined our understanding of ooid genesis and ooid accretion processes and argue toward microbial mediation both as a direct result of metabolic activities inducing changes in the environment conducive to precipitation and by a passive mechanism, in which mucilaginous extracellular polymeric substances (EPS) act as a template for mineral nucleation. Furthermore, new developments in the field indicate that carbonate mineralization in marine ooids occurs through sequential precipitations that involve an amorphous calcium carbonate phase (ACC), which some argue are of biotic origins. Herein, we discuss the most relevant theories of ooid formation, including some of the early pioneering studies that laid the groundwork for new theories attempting to decode the origins of these controversial grains.","Organomineralization,Ooids,Amorphous calcium carbonate,Microbial metabolism,EPS,Carbonate precipitation,Microbe-mineral interactions,"
"wavelet-based despeckling for onboard image processing in a small satellite sar maritime surveillance constellation","2012","New developments in small spacecraft capabilities will soon enable formation-flying constellations of small satellites, capable of performing remote sensing missions at low cost. One such mission concept under investigation involves a maritime surveillance microsatellite constellation. Two or more small microsatellites will follow a large synthetic aperture radar (SAR) transmitter, each carrying a SAR receiver antenna and one carrying an automatic identification system (AIS) antenna. Voluntary broadcasts of vessel position and velocity via AIS are received and decoded, and compared with SAR observations to verify the data and identify potentially non-cooperative vessels. Limited transmit power and downlink time will dictate that data be processed onboard the spacecraft. Herein we demonstrate a wavelet-based speckle removal method from the novel perspective of the maritime surveillance microsatellite mission, comparing wavelet thresholding methods and demonstrating that the resulting filter effectively removes speckle for improved target detection, reduces the size of the imagery data, and preserves detail necessary for registration and target evaluation.","Image coding,image denoising,speckle,synthetic aperture radar transmitter,Marine vehicles,onboard image processing,formation-flying constellations,space vehicle electronics,maritime surveillance microsatellite constellation,Synthetic aperture radar,Space vehicles,automatic identification system,wavelet-based despeckling,spacecraft capabilities,synthetic aperture radar,SAR receiver antenna,radar imaging,radar transmitters,Azimuth,Object detection,small satellite SAR maritime surveillance constellation,remote sensing missions,remote sensing by radar,Speckle,"
"an unsupervised learning method with convolutional auto-encoder for vessel trajectory similarity computation","2021","To achieve reliable mining results for massive vessel trajectories, one of the most important challenges is how to efficiently compute the similarities between different vessel trajectories. The computation of vessel trajectory similarity has recently attracted increasing attention in the maritime data mining research community. However, traditional shape- and warping-based methods often suffer from several drawbacks such as high computational cost and sensitivity to unwanted artifacts and non-uniform sampling rates, etc. To eliminate these drawbacks, we propose an unsupervised learning method which automatically extracts low-dimensional features through a convolutional auto-encoder (CAE). In particular, we first generate the informative trajectory images by remapping the raw vessel trajectories into two-dimensional matrices while maintaining the spatio-temporal properties. Based on the massive vessel trajectories collected, the CAE can learn the low-dimensional representations of informative trajectory images in an unsupervised manner. The trajectory similarity is finally equivalent to efficiently computing the similarities between the learned low-dimensional features, which strongly correlate with the raw vessel trajectories. Comprehensive experiments on realistic data sets have demonstrated that the proposed method largely outperforms traditional trajectory similarity computation methods in terms of efficiency and effectiveness. The high-quality trajectory clustering performance could also be guaranteed according to the CAE-based trajectory similarity computation results.","Convolutional neural network (CNN),Convolutional auto-encoder (CAE),Automatic identification system (AIS),Trajectory clustering,Trajectory similarity,"
"design of an end-to-end autoencoder for maritime communication system towards internet of vessels","2021","The Internet of Vessels has drawn more and more attention because the shipping efficiency and shipping safety can be increased, and the development of world transportation can easily be augment. Deep learning (DL) has been recognized as very promising for solving bottlenecks in the evolution of next generation communication systems. To adapt to the particularity of the marine environment, Rician fading channel is selected as the channel model for maritime communication. We propose a Convolutional Neural Network based end-to-end Autoencoder (CNN-AE) for the maritime communication system. A 1-dimensional convolution layers is introduced in AE. We investigate the characteristics of the maritime channel and optimize performance by redesigning the parameters. Compared with the existing schemes, the proposed CNN-AE maritime communication system not only inherits the characteristics of traditional AE system which can optimize all modules jointly, but also has the merits of CNN's local connection which can support more information. Simulation results show that under the same condition of input bit lengths and coding rates, when the values of Ricean K-factor increase, the Block Error Rates (BLER) of the system decrease. When the burst noise is added, the BLER grows as the noise increases. When the Ricean K-factor is the same, the BLER decreases as the coding rate decreases.","Encoding,Transportation,Internet of Vessels,deep learning (artificial intelligence),telecommunication computing,maritime channel mode,block error rates,traditional AE system,deep learning,ships,error statistics,Rician channels,maritime channel,next generation communication systems,communication systems,Convolution,1-dimensional convolution layers,convolutional neural nets,shipping efficiency,maritime communication system,Convolutional neural networks,convolution,marine communication,autoencoder,Deep learning,Simulation,convolutional neural network based end-to-end autoencoder,Internet,shipping safety,Rician fading channel,"
"joint mode selection and beamforming for irs-aided maritime cooperative communication systems","2023","In this paper, we consider an intelligent reflecting surface (IRS) aided maritime cooperative communication system, where multiple relay ships each equipped with an active decode-and-forward relay and a passive IRS assist the downlink transmission between the base station (BS) and the destination ship. Each relay ship operates in either the active mode with both active relaying and IRS reflection or the passive mode with only IRS reflection. We formulate and solve new problems to minimize the total transmit power of the BS and active relay ships, by jointly optimizing the relay mode selection vector, transmit power, as well as active and passive beamforming, subject to the quality of service of the destination ship. The joint optimization problem is solved by alternatively solving two sub-problems, i.e., the joint mode selection and power control sub-problem, and the joint active and passive beamforming sub-problem. Two algorithms based on exhaustive searching and many-to-one matching are respectively proposed for solving the first sub-problem, while a semidefinite programming-based algorithm is proposed for solving the second sub-problem. Numerical results demonstrate the good performance of the proposed joint mode selection and beamforming algorithm and the advantage of the proposed IRS-aided maritime cooperative communication system in power saving.","array signal processing,power control subproblem,IRS-aided maritime cooperative communication system,maritime cooperative communications,Marine vehicles,quality of service,active relay ships,joint active beamforming,joint mode selection,passive mode,IRS reflection,Cooperative communication,Array signal processing,passive IRS,relay mode selection vector,Intelligent reflecting surface,ships,Relays,Maritime communications,joint active and passive beamforming,semidefinite programming,optimisation,Power control,passive beamforming,relay networks (telecommunication),intelligent reflecting surface,active mode,multiple relay ships,decode and forward communication,downlink transmission,cooperative communication,marine communication,destination ship,Downlink,joint optimization problem,decode and forward relay,BS,"
"two-stage networks with adversarial clutter suppression for maritime radar target detection","2022","Maritime radar target detection is often affected by sea clutter, and the detection performance in the case of low signal-to-clutter ratio (SCR) is usually poor. In this paper, we propose a two-stage deep learning method for sea clutter suppression and point target detection. Take the cluttered Range-Doppler (RD) spectra as input, at the first stage, reconstructed RD spectra are obtained as clutter suppression results through Attention Denoising Adversarial-Autoencoders (Atten-DAAE). At the second stage, detection results are obtained through the traditional one-stage detection network YOLOv5s. The proposed method has been verified on two datasets with simulated and measured clutter data respectively and compared with the traditional method and other networks, which shows better detection performance.","cluttered range-Doppler spectra,marine radar,deep learning (artificial intelligence),radar detection,radar clutter,one-stage detection network YOLOv5,clutter suppression,Sea measurements,reconstructed RD spectra,Adversarial clutter suppression,attention denoising adversarial-autoencoders,deep learning,radar target detection,radar computing,radar target recognition,Signal processing,sea clutter suppression,Radar clutter,maritime radar target detection,point target detection,two-stage deep learning method,Deep learning,Object detection,low signal-to-clutter ratio,simulated measured clutter data,Time measurement,Radar detection,"
"bidirectional data-driven trajectory prediction for intelligent maritime traffic","2023","Intelligent maritime transportation is one of the most promising enabling technologies for promoting trade efficiency and releasing the physical labor force. The trajectory prediction method is the foundation to guarantee collision avoidance and route optimization for ship transportation. This article proposes a bidirectional data-driven trajectory prediction method based on Automatic Identification System (AIS) spatio-temporal data to improve the accuracy of ship trajectory prediction and reduce the risk of accidents. Our study constructs an encoder-decoder network driven by a forward and reverse comprehensive historical trajectory and then fuses the characteristics of the sub-network to predict the ship trajectory. The AIS historical trajectory data of US West Coast ships are employed to investigate the feasibility of the proposed method. Compared with the current methods, the proposed approach lessens the prediction error by studying the comprehensive historical trajectory, and 60.28% has reduced the average prediction error. The ocean and port trajectory data are analyzed in maritime transportation before and after COVID-19. The prediction error in the port area is reduced by 95.17% than the data before the epidemic. Our work helps the prediction of maritime ship trajectory, provides valuable services for maritime safety, and performs detailed insights for the analysis of trade conditions in different sea areas before and after the epidemic.","epidemics,Transportation,Automatic Identification System spatio-temporal data,port trajectory data,Hidden Markov models,ship transportation,average prediction error,transportation,Marine vehicles,intelligent maritime transportation,comprehensive historical trajectory,Predictive models,bidirectional data-driven trajectory prediction method,West Coast ships,bidirectional data-driven,Maritime transportation,maritime ship trajectory,ships,marine safety,marine engineering,Data models,ship trajectory prediction,promising enabling technologies,Artificial intelligence,intelligent maritime traffic,physical labor force,Trajectory,trajectory prediction,route optimization,diseases,collision avoidance,automatic identification system (AIS) data,encoder-decoder network,maritime safety,AIS historical trajectory data,"
