"name","year","abstract","keywords"
"a densenet-based learning framework toward maritime end-to-end autoencoder communication systems","2023","With the prosperous development of the shipping industry, a variety of emerging maritime services are continuously emerging, highlighting the increased importance and necessity for high-reliability maritime communication. Building upon existing research on end-to-end autoencoder communication systems, this paper proposes a densely connected convolutional networks (DenseNet)-based maritime autoencoder communication system (DenseNet-MAE). Specifically, the DenseNet module is employed to take advantage of its cross-layer connectivity and feature reuse for the extraction of deeper features of the transmitted signal. Furthermore, In order to improve the systemâ€™s reliability in low signal noise ratio (SNR) environments, the convolutional code (CC) concept is introduced into the DenseNet-MAE using recurrent neural network (RNN). The DenseNet-MAE utilizes the long short term memory (LSTM) to extract the spatio-temporal correlation of data and solve the 'long-term dependency' problem. The maritime channel model is simulated utilizing the Rician fading channel. In order to demonstrate the superiority of the DenseNet-MAE, we utilize a large amount of data to train the network and optimize network parameters. Simulation results show that the proposed DenseNet-MAE exhibits excellent error performance and superior generalizability across varying Rician K factors, channel time slots, and coding rates, compared to the benchmark.","end-to-end,telecommunication network reliability,recurrent neural nets,densely connected convolutional networks-based maritime autoencoder communication system,DenseNet-based learning framework,channel time slots,telecommunication computing,Recurrent neural networks,low signal noise ratio environments,Feature extraction,maritime end-to-end autoencoder communication systems,recurrent neural network,maritime channel model,Rician K factors,Rician channels,coding rates,feature extraction,Convolutional codes,Correlation,convolutional codes,cross-layer connectivity,feature reuse,high-reliability maritime communication,DenseNet-MAE,Robustness,convolutional neural nets,maritime services,RNN,error performance,marine communication,Densely connected convolutional network,autoencoder,Simulation,convolutional code concept,spatio-temporal correlation,learning (artificial intelligence),maritime communications,"
"from unsupervised to semi-supervised anomaly detection methods for hrrp targets","2020","Responding to the challenge of detecting unusual radar targets in a well identified environment, innovative anomaly and novelty detection methods keep emerging in the literature. This work aims at presenting a benchmark gathering common and recently introduced unsupervised anomaly detection (AD) methods, the results being generated using high-resolution range profiles. A semi-supervised AD (SAD) is considered to demonstrate the added value of having a few labeled anomalies to improve performances. Experiments were conducted with and without pollution of the training set with anomalous samples in order to be as close as possible to real operational contexts. The common AD methods composing our baseline will be One-Class Support Vector Machines (OC-SVM), Isolation Forest (IF), Local Outlier Factor (LOF) and a Convolutional Autoencoder (CAE). The more innovative AD methods put forward by this work are Deep Support Vector Data Description (Deep SVDD) and Random Projection Depth (RPD), belonging respectively to deep and shallow AD. The semi-supervised adaptation of Deep SVDD constitutes our SAD method. HRRP data was generated by a coastal surveillance radar, our results thus suggest that AD can contribute to enhance maritime and coastal situation awareness.","semisupervised anomaly detection methods,Pollution,unusual radar targets,benchmark gathering,Support vector machines,Anomaly detection,radar detection,HRRP targets,anomaly detection,unsupervised learning,high-resolution range profiles,Neural networks,semisupervised adaptation,novelty detection methods,radar target detection,radar computing,innovative anomaly,support vector machines,SAD method,machine learning,object detection,radar target recognition,innovative AD methods,search radar,identified environment,Deep SVDD,high-resolution range profile,Radar,common AD methods,convolutional neural nets,labeled anomalies,Training,One-Class Support Vector Machines,neural network,semisupervised AD,Radar detection,"
"fault detection with lstm-based variational autoencoder for maritime components","2021","Maintenance routines on ships today follow either a reactive maintenance (RM) or preventive maintenance (PvM) approach. RM can be regarded as post-failure repair, which might create large costs. PvM uses predetermined maintenance intervals, which often involves unnecessary maintenance. Recently, prognostics and health management (PHM) has emerged as a potential way to develop an ideal maintenance policy. PHM aims to provide optimal maintenance schedule through the use of sensor measurement for fault detection and fault prognostics, among which fault detection is the first and fundamental action. In this paper, a long-short term memory based variational autoencoder (LSTM-VAE) is proposed for fault detection of maritime components onboard. It is a semi-supervised approach that requires only fault-free data for training. Therefore, it is widely applicable in the maritime industry since operational data in normal conditions already exists. Real-world operation data collected from a diesel engine on the research vessel (RV) Gunnerus is used to validate the method. Results show that the LSTM-VAE can detect the fault accurately.","Decoding,unnecessary maintenance,maritime components,fault-free data,optimal maintenance schedule,preventive maintenance,prognostic and health management,Anomaly detection,anomaly detection,Recurrent neural networks,maintenance engineering,fault detection,ship autonomy,fault prognostics,maintenance routines,ships,PvM,Prognostics and health management,LSTM-VAE,maintenance intervals,railway safety,PHM,Fault detection,condition monitoring,Training,post-failure repair,ideal maintenance policy,LSTM-based variational autoencoder,Sensors,RM,fault diagnosis,"
"man overboard: fall detection using spatiotemporal convolutional autoencoders in maritime environments","2021","",""
"improved denoising autoencoder for maritime image denoising and semantic segmentation of usv","2020","Unmanned surface vehicle (USV) is currently a hot research topic in maritime communication network (MCN), where de-noising and semantic segmentation of maritime images taken by USV have been rarely studied. The former has recently researched on autoencoder model used for image denoising, but the existed models are too complicated to be suitable for real-time detection of USV. In this paper, we proposed a lightweight autoencoder combined with inception module for maritime image denoising in different noisy environments and explore the effect of different inception modules on the denoising performance. Furthermore, we completed the semantic segmentation task for maritime images taken by USV utilizing the pretrained U-Net model with tuning, and compared them with original U-Net model based on different backbone. Subsequently, we compared the semantic segmentation of noised and denoised maritime images respectively to explore the effect of image noise on semantic segmentation performance. Case studies are provided to prove the feasibility of our proposed denoising and segmentation method. Finally, a simple integrated communication system combining image denoising and segmentation for USV is shown.","Semantics,improved denoising autoencoder,semantic segmentation task,image denoising,semantic segmentation,U-Net model,marine robots,Feature extraction,MCN,Noise measurement,maritime image denoising,neural nets,image noise,Noise reduction,object detection,Image denoising,Image segmentation,maritime communication network,Training,marine communication,autoencoder,U-Net,unmanned surface vehicle,image segmentation,USV,denoising,"
"a dual linear autoencoder approach for vessel trajectory prediction using historical ais data","2020","Advances in artificial intelligence are driving the development of intelligent transportation systems, with the purpose of enhancing the safety and efficiency of such systems. One of the most important aspects of maritime safety is effective collision avoidance. In this study, a novel dual linear autoencoder approach is suggested to predict the future trajectory of a selected vessel. Such predictions can serve as a decision support tool to evaluate the future risk of ship collisions. Inspired by generative models, the method suggests to predict the future trajectory of a vessel based on historical AIS data. Using unsupervised learning to facilitate trajectory clustering and classification, the method utilizes a cluster of historical AIS trajectories to predict the trajectory of a selected vessel. Similar methods predict future states iteratively, where states are dependent upon the prior predictions. The method in this study, however, suggests predicting an entire trajectory, where all states are predicted jointly. Further, the method estimates a latent distribution of the possible future trajectories of the selected vessel. By sampling from this distribution, multiple trajectories are predicted. The uncertainties of the predicted vessel positions are also quantified in this study.","Collision avoidance,Autoencoder,Trajectory prediction,AIS,Machine learning,Maritime situation awareness,"
"use of noma for maritime communication networks with p-df relaying channel","2020","In this paper, a partial de-code-and-forward (P-DF) cooperative relaying network (CRN) with non-orthogonal multiple access (P-DF-CRN-NOMA) for maritime space communications is proposed. Without loss of generality, three kinds of relay forwarding protocols are studied to characterize the superiority of the proposed P-DF-CRN-NOMA scheme, where, after receptions from the coastal base station (BS), the island relay forwards the successful decoded symbols to the ship user to avoid the performance loss provided by the high decoding requirement in decode-and-forward (DF). To further improve the system performance, as well as for a fairness comparison, the maximum ratio combining (MRC) is utilized at the ship user. Specifically, to present the impact of the channel qualities, the scenarios of the weak and strong links that from the source to destination (S-D) are both considered. The closed-form expressions for the outage probability of the P-DF-CRN-NOMA are derived considering the three proposed forwarding cases. Qualitative numerical results corroborating our theoretical analysis, especially for the high signal-to-noise ratio (SNR), show that the proposed P-DF-CRN-NOMA scheme significantly improves the outage probability performance in comparison to the conventional CRN-NOMA schemes. Furthermore, for an increased S-D link, the corresponding outage probability performance will be also better for all the cases.","Decoding,telecommunication network reliability,cooperative relaying networks (CRN),nonorthogonal multiple access,Marine vehicles,non-orthogonal multiple access (NOMA),maritime space communications,outage probability,decoding,Power system reliability,NOMA,Communication networks,Relays,error statistics,power allocation,P-DF relaying channel,maximum ratio combining,cooperative relaying network,protocols,relay networks (telecommunication),diversity reception,partial decode and forward network,coastal base station,decode and forward communication,cooperative communication,probability,relay forwarding protocols,marine communication,outage probability performance,Probability,maritime communication networks,multi-access systems,island relay,partial decode-and-for-ward (P-DF),P-DF-CRN-NOMA scheme,"
"fall detection using multi-property spatiotemporal autoencoders in maritime environments","2022","",""
"placement optimization of caching uav-assisted mobile relay maritime communication","2020","Recently, due to the deployment flexibility of unmanned aerial vehicles (UAVs), UAV-assisted mobile relay communication system has been widely used in the maritime communication. However, the performance of UAV-assisted mobile relay communication system is limited by the capacity of wireless backhaul link between base station and UAV In this paper, we consider a caching UAV-assisted decode-and-forward relay communication system in a downlink maritime communication. For the general case with multiple users, the optimal placement of UAV is obtained by solving the average achievable rate maximization problem through the one-dimensional linear search. For a special case with single user, we derive a semi closed-form expression of the optimal placement of UAV. Simulation results confirm the accuracy of analytical results and show that the optimal placement of UAV and the average achievable rate significantly depend on the cache capacity at UAV We also show the difference between the performances of the air-to-ground model and the air-to-sea model.","radio links,caching UAV-assisted decode-and-forward relay communication system,UAV-assisted mobile relay communication system,placement optimization,Wireless communication,air-to-sea model,achievable rate,Atmospheric modeling,caching UAV-assisted mobile relay maritime communication,Relays,mobile radio,maritime communication,relay networks (telecommunication),autonomous aerial vehicles,Optimization,Unmanned aerial vehicles,caching,air-to-ground model,Signal to noise ratio,Downlink,telecommunication control,UAV,"
