"name","year","abstract","keywords"
"research on detection mechanism of vessel abnormal behavior based on immune genetic spectral clustering algorithm","2022","Maritime transport accounts for over 90% of global trade, and maritime safety has been confirmed as a vital issue of maritime transport. Accordingly, vessel traffic service system (VTS) is capable of assisting the maritime department to complete real-time supervision of a certain water area and increasing the efficiency of water supervision. However, the VTS system has low effectiveness in vessel anomaly detection and supervision, thus resulting in regulatory blind spot in the VTS system. In this study, a vessel trajectory anomaly detection mechanism is developed using the immune genetic spectral clustering method. Moreover, the contour coefficient of scatter clustering is accurately analyzed, and the clustering center is optimized using the adopted method. On that basis, different abnormal features can be detected, and abnormal detection accuracy can be increased. In this study, the vessel trajectory anomaly detection model is built in accordance with the set sliding window and abnormal threshold parameters of vessel trajectory characteristics. The AIS data of Lianyungang to Qingdao port from March 2021 are selected for experimental analysis. The results suggest that the proposed method outperforms the conventional method in the detection accuracy and the false alarm rate, it facilitates the intelligent and automatic management of vessels by the VTS system.","Immune genetic,Abnormal behavior detection,Automatic identification system (AIS),Spectral clustering,Duplicato-degree measurement,Intelligent vessel supervision,"
"vessel track information mining using ais data","2014","In recent years, vessel traffic and maritime situation awareness become more and more important for countries across the world. AIS data contains much information about vessel motion and reflects traffic characteristics. In this paper, data mining is introduced to discover motion patterns of vessel movements. Firstly, we do statistical analysis for large scale of AIS data. Secondly, we use association rules to analyze the frequent moving status of vessels. We extend the dimensions of data features, improve the algorithm in efficiency and import the concept of time scale in the algorithm based on the previous relative work. Thirdly, we introduce Markov model to make supplement for the association rules. The prediction results in the Markov process are further used to do the anomaly detection. The method in this paper provides novel idea for the research in AIS data and the management of maritime traffic.","Markov processes,data mining,Clustering algorithms,Association rules,vessel movements,Hidden Markov models,anomaly detection,Marine vehicles,Markov model,vessel traffic,maritime traffic management,statistical analysis,motion patterns,association rules,Data models,Markov,traffic information systems,vessel track information mining,traffic characteristics,maritime situation awareness,frequent moving status,vessel motion,marine vehicles,AIS data,"
"risky maritime encounter patterns via clustering","2023","",""
"unsupervised anomaly detection based on clustering methods and sensor data on a marine diesel engine","2021","",""
"a novel model for ship trajectory anomaly detection based on gaussian mixture variational autoencoder","2023","The use of traditional methods in anomaly detection of multi-class ship trajectories showed some limitations in terms of robustness and learning ability of trajectory features. In view of this, an anomaly detection model for ship trajectory data based on Gaussian Mixture Variational Autoencoder (GMVAE) is proposed in this study using an unsupervised classification method. The proposed model modifies Variational Autoencoder (VAE) by changing the inferential distribution of prior distribution and approximate posterior to the Gaussian mixture model. A high-dimensional hidden space is constructed to learn the features of multi-class trajectory data, and the Dynamic Time Warping (DTW) method is applied to measure the error between the reconstructed trajectory and the original trajectory in order to judge whether the ship trajectory is abnormal. The Automatic Identification System (AIS) data from the US coastal areas are used to verify the proposed model, and the results are compared with other commonly used models in a manually labeled dataset. The research results indicate that the detection rate of the proposed model is 91.26%, and the false alarm rate is 0.68%, which performs the best. Using the Gaussian mixture model to describe the distribution of hidden space can improve the learning ability of multi-class trajectories of VAE, thus increasing the robustness of the model. This research can provide technical support for ship trajectory data analysis and risk management of maritime transportation.","Trajectory,anomaly detection of ship trajectory,Clustering algorithms,Classification algorithms,Mathematical models,gaussian mixture variational autoencoder (gmvae),unsupervised learning,Gaussian distribution,Marine vehicles,Artificial neural networks,intelligent transportation,AIS,"
"unsupervised learning of maritime traffic patterns for anomaly detection","2012","Maritime anomaly detection requires an efficient representation and consistent knowledge of vessel behaviour. Automatic Identification System (AIS) data provides ships state vector and identity information that is here used to automatically derive knowledge of maritime traffic in an unsupervised way. The proposed approach only utilises AIS data, historical or real-time, and is aimed at incrementally learning motion patterns without any specific a priori contextual description. This can be applied to a single AIS terrestrial receiver, to regional networks or to global scale tracking. The maritime traffic representation underpins low- likelihood behaviour detection and supports enhanced Maritime Situational Awareness by providing a characterisation of vessels traffic.","vessel behaviour,Incremental Learning,ships state vector,maritime situational awareness,pattern clustering,identity information,single AIS terrestrial receiver,regional networks,automatic identification system data,marine systems,unsupervised learning,ships,anomaly detection,low-likelihood behaviour detection,Maritime Situational Awareness,Automatic Identification System,maritime traffic patterns,"
"cluster based anomaly detection with applications in the maritime industry","2017","In this paper we propose a cluster based version of the anomaly detection methodology based on signal reconstruction, using Auto Associative Kernel Regression (AAKR), combined with residuals analysis, using Sequential Probability Ratio Test (SPRT). We demonstrate how the proposed cluster based methodology can be successfully applied for anomaly detection on a marine diesel engine in operation. Furthermore, we demonstrate the vast reduction in computation time compared to the original framework, and discuss other possible advantages and disadvantages of the proposed methodology.","Sequential probability ratio test,Auto Associative Kernel Regression,Kernel,Anomaly detection,Sequential Probability Ratio Test,residuals analysis,regression analysis,Condition monitoring,Sensor system,Cluster based anomaly detection,Standards,Training data,signal reconstruction,Cluster based kernel regression,pattern clustering,AAKR,Bandwidth,mechanical engineering computing,diesel engines,Training,probability,marine diesel engine,maritime industry,Fault and anomaly detection,Temperature sensors,fault diagnosis,"
"graph representation learning with encoding edges","2019","Network embedding aims at learning the low dimensional representation of nodes. These representations can be widely used for network mining tasks, such as link prediction, anomaly detection, and classification. Recently, a great deal of meaningful research work has been carried out on this emerging network analysis paradigm. The real-world network contains different size clusters because of the edges with different relationship types. These clusters also reflect some features of nodes, which can contribute to the optimization of the feature representation of nodes. However, existing network embedding methods do not distinguish these relationship types. In this paper, we propose an unsupervised network representation learning model that can encode edge relationship information. Firstly, an objective function is defined, which can learn the edge vectors by implicit clustering. Then, a biased random walk is designed to generate a series of node sequences, which are put into Skip-Gram to learn the low dimensional node representations. Extensive experiments are conducted on several network datasets. Compared with the state-of-art baselines, the proposed method is able to achieve favorable and stable results in multi-label classification and link prediction tasks.","Edge representation,Feature learning,Network mining,Network embedding,"
"fast and parameter-light rare behavior detection in maritime trajectories","2020","Rare behaviors indicate important events and situations in maritime surveillance applications. State-of-the-art methods provide many effective solutions to detect anomalous behaviors. Meanwhile, most solutions are parameter-laden and too costly to identify useful rare behaviors with human knowledge in a visual analytics manner. This paper is concerned with a scheme cross trajectories, vessel attributes and the movement context for detecting rare behaviors through preprocessing, kNN-based clustering, and verification. Although the scheme involves several parameters, we demonstrate that they are able to be tackled in thresholds. As a result, a rare behavior factor is the single parameter that affect the detecting results. The proposed scheme is evaluated via a simulated data set for performance and a real life AIS data for effectiveness. Results show that high accuracy to labelled anomalies and useful rare behaviors can be achieved.","Rare behaviour detection,Trajectory,Visual analytics,"
"adaptive mining algorithm of ship typical trajectory based on improved spectral clustering","2022","",""
"unsupervised maritime traffic graph learning with mean-reverting stochastic processes","2018","Inspired by the fair regularity of the motion of ships, we present a method to derive a representation of the commercial maritime traffic in the form of a graph, whose nodes represent way-point areas, or regions of likely direction changes, and whose edges represent navigational legs with constant cruise velocity. The proposed method is based on the representation of a ship's velocity with an Ornstein-Uhlenbeck process and on the detection of changes of its long-run mean to identify navigational way-points. In order to assess the graph representativeness of the traffic, two performance metrics are introduced, leading to distinct graph construction criteria. Finally, the proposed method is validated against real-world Automatic Identification System data collected in a large area.","real-world data,Clustering algorithms,Anomaly detection,unsupervised learning,graph construction criteria,Marine vehicles,mean-reverting stochastic processes,unsupervised maritime traffic graph learning,Stochastic processes,maritime situational awareness,DBSCAN,Ornstein-Uhlenbeck process,change detection,ships,automatic identification system,stochastic processes,motion control,AIS,navigational legs,maritime traffic graph,Artificial intelligence,velocity control,graph theory,constant cruise velocity,Legged locomotion,clustering,graph representativeness,Navigation,navigation,graph learning,navigational way-points,ship velocity,"
"ship movement anomaly detection using specialized distance measures","2015","This paper provides a solution for anomaly detection in maritime traffic domain based on the clustering results presented in a previous work. That work created clusters for vessels moving close to shores by associating vessel movements with International Maritime Organization Rules (especially Traffic Separation Scheme Boundaries). In this paper, we show how three division distances with the clusters can detect anomalous navigational behaviors. The proposed method decides for each trajectory point if the vessel is anomalous, considering longitude, latitude, speed and direction. Although the approach is point-based, which is applicable for real-time AIS surveillance, it is also flexible enough for analysts to set their own threshold for labeling whole trajectories.","naval engineering computing,navigational behaviors,Clustering algorithms,vessel movements,distance measurement,anomaly detection,Marine vehicles,specialized distance measures,traffic separation scheme boundaries,Gravity,ship movement anomaly detection,ships,automatic identification system,real-time systems,maritime surveillance,Data models,international maritime organization rules,pattern clustering,trajectory mining,vessels,Trajectory,clustering,Labeling,real-time AIS surveillance,Data mining,maritime traffic domain,"
"intelligent deep fusion network for anomaly identification in maritime transportation systems","2023","This paper introduces a novel deep learning architecture for identifying outliers in the context of intelligent transportation systems. The use of a convolutional neural network with decomposition is explored to find abnormal behavior in maritime data. The set of maritime data is first decomposed into similar clusters containing homogeneous data, and then a convolutional neural network is used for each data cluster. Different models are trained (one per cluster), and each model is learned from highly correlated data. Finally, the results of the models are merged using a simple but efficient fusion strategy. To verify the performance of the proposed framework, intensive experiments were conducted on marine data. The results show the superiority of the proposed framework compared to the baseline solutions in terms of several accuracy metrics.","maritime data,Transportation,Urban areas,homogeneous data,deep learning (artificial intelligence),highly correlated data,Anomaly detection,maritime transportation systems,transportation,smart and secure transportation systems,intelligent transportation systems,similar clusters,anomaly identification,simple but efficient fusion strategy,Data models,marine data,pattern clustering,convolutional neural network,convolutional neural nets,intelligent deep fusion network,Training,Convolutional neural networks,decomposition,Deep learning,data cluster,learning (artificial intelligence),deep learning architecture,Convolution neural network,"
"improving sar wind retrieval through automatic anomalous pixel detection","2023","Satellite observations are increasingly in demand and valuable for monitoring the ocean and coastal winds in near-real-time and analyzing the data historically. However, soared up human activities, man-made constructions, and marine traffics negatively interfere and affect the reliability of observations and raise concerns about the trustworthiness of using satellite winds for many applications, such as offshore wind energy, even though Sentinel synthetic aperture radar (SAR) data is freely and easily accessible. In this paper, we presented a novel methodological framework for localization and suppression of anomalous pixels (APs), which deteriorate the confidence and accuracy of the retrieved SAR wind speeds. The backbone of the implementation relied on the constant false alarm rate (CFAR) algorithm, one of the automatic target recognition algorithms. We used a large dataset of SAR subscenes to model different sea clutter conditions after removing the potential targets. We selected the suitable distribution model that maintains a constant probability of false alarm (pfa) for the entire SAR scene. The proper pfa was optimized in various SAR scenes ranging from scenes with a considerable number of APs, such as ships and wind park clusters, to scenes with no visible APs under different wind speed conditions. The pfa optimization process prevented real wind pixels from being misidentified as APs. Applying CFAR to the logarithmic scale of raw digital numbers (log-DNs) domain with a pfa of about 3.17 × 10-5, we extracted SAR wind speeds around each ocean buoy before and after CFAR process, comparing them with their corresponding in situ wind measurements. This led to significant improvement in the quality and accuracy of SAR wind data retrieval, especially in regions with numerous man-made constructions and high marine traffics. We tested and validated our approach in the North Sea and two regions along the eastern coast of the U.S. The enclosed region, serving as a marine route for harbors in Delaware Bay, showed a substantial improvement in RMSE and BIAS after applying our approach, reducing RMSE from 2.4 m/s to 1.6 m/s and the BIAS from −1.5 m/s to −0.3 m/s. The open ocean region demonstrated stable RMSE and BIAS, indicating preservation of real wind data, as only APs affecting SAR wind speed were considered during the process.","Offshore wind farm,SAR,Sentinel-1,CFAR,Anomalous pixel,Coastal environment,"
"clustering of maritime trajectories with ais features for context learning","2021","This paper presents an analysis on Automatic Identification System (AIS) real world ship data to build a system with the capability to extract useful information for an anomaly detection problem. The study focuses on the adjustment of a clustering technique to trajectory data, specifically using a DBSCAN algorithm that is adapted by means of two approaches. On the one hand, the DTW trajectory similarity metric is used to obtain a distance between two trajectories. On the other hand, an extraction of features of interest from each trajectory allowing a summary of the trajectory in a single multidimensional instance. The results show that both approaches are feasible, although not very scalable to larger problems due to the computational complexity of the used algorithms. In addition, the study analyses possible uses of these approaches to existing data mining problems.","data mining,Clustering algorithms,anomaly detection problem,trajectory data,Marine vehicles,Conferences,Feature extraction,information retrieval,AIS feature extraction,information extraction,AIS real world ship data,single multidimensional instance,DTW trajectory similarity metric,pattern clustering,Artificial intelligence,Measurement,marine engineering computing,automatic identification system real world ship data,Context learning,DBSCAN algorithm,Trajectory,computational complexity,maritime trajectory clustering,context learning,Data mining,learning (artificial intelligence),AIS data,Trajectory clustering,"
"evaluation and comparison of anomaly detection algorithms in annotated datasets from the maritime domain","2015","Anomaly detection supports human decision makers in their surveillance tasks to ensure security. To gain the trust of the operator, it is important to develop a robust system, which gives the operator enough insight to take a rational choice about future steps. In this work, the maritime domain is investigated. Here, anomalies occur in trajectory data. Hence, a normal model for the trajectories has to be estimated. Despite the goal of anomaly detection in real life operations, until today, mostly simulated anomalies have been evaluated to measure the performance of different algorithms. Therefore, an annotation tool is developed to provide a ground truth on a non-simulative dataset. The annotated data is used to compare different algorithms with each other. For the given dataset, first experiments are conducted with the Gaussian Mixture Model (GMM) and the Kernel Density Estimator (KDE). For the evaluation of the algorithms, precision, recall, and f1-score are compared.","surveillance,GMM,Clustering algorithms,Hidden Markov models,Intelligent systems,Anomaly detection,Gaussian Mixture Model,trajectory data,annotation tool,human decision making,operator trust,Sea measurements,nonsimulative dataset,mixture models,kernel density estimator,marine engineering,Gaussian processes,recall value,ground truth,maritime domain,robust system,Maritime domain,f1-score value,Kernel Density Estimation,Gaussian mixture model,annotated datasets,Trajectory,surveillance tasks,anomaly detection algorithms,Surveillance,normal model,precision value,KDE,"
"modeling vessel behaviours by clustering ais data using optimized dbscan","2021","",""
"maritime group motion analysis: representation, learning, recognition, and deviation detection","2015","This paper introduces new concepts and methods in the analysis of group motions over extended periods of time, and applies it to an example from the maritime domain. Group motion analysis includes these challenges: (1) represent complex motion patterns of multiple entities as they execute group maneuvers and behavior patterns; (2) learn these group motion patterns in a qualitative fashion, invariant to the number of entities participating; (3) recognize such learned maneuvers and behaviors as they unfold in future group tracking data; and (4) detect in real-time deviations of an entity from a recognized group maneuver or behavior, as such motion anomalies may indicate a vessel emerging from a group. The approach adopts a linear field theory to represent the relative motions of objects, in combination with learning & recognition methods that self-organize three evolving field parameters into 3D clusters that represent maneuver categories, and categories sequences that represent behaviors.","Pattern recognition,motion analysis,image motion analysis,complex motion pattern representation,behavior pattern,learning methods,maritime group motion analysis,group tracking data,object tracking,marine engineering,object detection,group maneuvers,Tensile stress,Real-time systems,Indexes,Tracking,deviation detection,Trajectory,linear field theory,Sensors,maneuver behavior patterns,real-time deviations,learning (artificial intelligence),Group tracks,motion anomalies,"
"detection and geovisualization of abnormal vessel behavior from video","2021","Intelligent maritime situational awareness pursues an effective understanding of the majority of the activities related to the maritime domain (impacting the safety, security, economy, or environment), with the aid of artificial intelligence systems. Such an understanding requires the development of automated processes capable of not only detecting abnormal behavior but also of visually-representing and interpreting it. Although much progress has been made in anomaly detection and visualization using vessel self-reporting positioning data, there have been no corresponding advances using video data, despite the increasing use of cameras for maritime surveillance. In this work, we introduce a framework which goes beyond vessel tracking for anomaly detection in video, and is therefore applicable to scenes with a high density of vessels. The proposed framework detects abnormal behavior using a Generative Adversarial Network (GAN) and interprets this knowledge using metrics derived from clustering the positions and courses provided by an independent vessel/motion detector. These detections are geovisualized using an advanced displaying tool where detected abnormal behavior may be localized on the globe, providing an infrastructure for intelligent maritime situational awareness.","generative adversarial network,surveillance,Safety,anomaly detection,Generative adversarial networks,data visualisation,Knowledge engineering,security of data,geovisualization,intelligent maritime situational awareness,marine engineering,abnormal vessel behavior,maritime surveillance,vessel self-reporting positioning data,object detection,maritime domain,Measurement,Real-time systems,video signal processing,artificial intelligence systems,Tools,artificial intelligence,Detectors,"
