"name","year","abstract","keywords"
"anomaly detection in maritime data based on geometrical analysis of trajectories","2015","Anomaly detection is an important use of the Automatic Identification Systems (AIS), because it offers support to users to evaluate if a vessel is in trouble or causing trouble. For instance, it can be used to detect if a ship is doing something that may cause an accident or if it has changed its route to avoid bad weather condition. In this work, a new method for finding anomalies in the ships' movements is proposed. The method analyzes the trajectory of ships from a geometrical perspective. The trajectory of the ship is compared with a near-optimal path that is generated by a graph search algorithm. The proposed method extracts some scale-invariant features from the real trajectory and also from the optimal movement pattern, and it compares the two sets of features to generate an abnormality score. The method is unsupervised and it does not require training. Instead of labeling the trajectories as normal/abnormal it calculates a score value that denotes the extent of abnormality. The scoring scheme provides a ranking system in which the user can sort the trajectories based on their abnormality score. This is useful when dealing with large number of trajectories and the user wants to picks the most abnormal cases. For the evaluation, the method was run on three months data of North Pacific Ocean and score values were generated. Among the entire dataset, 100 randomly chosen trajectories were labeled by an expert. After applying a threshold on the score value, the proposed method had 94% accuracy.","maritime data,Clustering algorithms,randomly chosen trajectories,optimal movement pattern,anomaly detection,North Pacific Ocean,Marine vehicles,abnormality score,Mathematical model,Feature extraction,geometrical trajectories analysis,scale-invariant features,ships,marine engineering,bad weather condition,AIS,Oceans,near-optimal path,ship trajectory,ship movements,graph theory,graph search algorithm,Joining processes,score values,search problems,Trajectory,automatic identification systems,"
"a hybrid-clustering model of ship trajectories for maritime traffic patterns analysis in port area","2022","",""
"unsupervised maritime traffic pattern extraction from spatio-temporal data","2015","Maritime traffic pattern extraction is a fundamental and crucial factor for maritime surveillance and anomaly detection. Emerging technologies like Automatic Identification System (AIS) provides multi-dimensional data which is used to construct a maritime traffic model. In this paper, we propose a framework of maritime traffic pattern extraction from vessel AIS information, which learns a traffic pattern using an unsupervised technique, and can be applied on historical Automatic Identification System data. AIS data is a kind of spatio-temporal data that contains information of location data, as well as time stamps. In this way, traffic pattern is described by AIS data. Furthermore, we conduct a simulation experiment that extracts traffic pattern from the AIS data through the unsupervised technique. The proposed framework takes advantage of AIS data, which is a type of the spatiotemporal data that consists of vessel motion information, to perform the experiment. The result shows that the unsupervised framework converts useful information from raw AIS data to effective traffic pattern. The proposed method strongly supports the further research on maritime traffic pattern extraction of AIS data. Besides, an overview of the framework and the unsupervised technique for high-level maritime situation awareness is presented.","Traffic control,Clustering algorithms,unsupervised learning,anomaly detection,Marine vehicles,vessel AIS information,spatiotemporal data,data analysis,ships,automatic identification system,marine engineering,Automatic Identification System,maritime traffic pattern,AIS,maritime surveillance,Data models,feature extraction,Classification algorithms,identification,Trajectory,maritime situation awareness,maritime traffic pattern extraction,density-based clustering,Data mining,"
"dbscan optimization for improving marine trajectory clustering and anomaly detection","2020","",""
"a distributed spatial method for modeling maritime routes","2020","In this work we propose a novel spatial knowledge discovery pipeline capable of automatically unravelling the â€œroads of the seaâ€ and maritime traffic patterns by analysing voluminous vessel tracking data, as collected through the Automatic Identification System (AIS). We present a computationally efficient and highly accurate solution, based on a MapReduce approach and unsupervised learning methods, capable of identifying the spatiotemporal dynamics of ship routes and most crucially their characteristics, thus deriving maritime â€œpatterns of lifeâ€ at a global scale, without the reliance on any additional information sources or a priori expert knowledge. Experimental results confirm high accuracy of results and superior performance in comparison to other methods, with the entire processing duration completing in less than 3 hours for more than a terabyte of non-uniform spatial data. Finally, to clearly demonstrate the applicability and impact of our proposed method, we evaluate its ability to detect real world â€œanomaliesâ€, such as maritime incidents reported in the European Marine Casualty Information Platform. Numerical results show the advantages of our scheme in terms of accuracy, with an achieved anomaly detection accuracy of higher than 93%, by detecting 313 out of 335 relevant maritime incidents.","data mining,Anomaly detection,anomaly detection,unsupervised learning,Marine vehicles,data driven maritime traffic,maritime traffic patterns,computationally efficient solution,patterns of life,routes,spatial knowledge discovery pipeline,MapReduce approach,ships,automatic identification system,marine safety,marine engineering,voluminous vessel tracking data,a priori expert knowledge,relevant maritime incidents,AIS,nonuniform spatial data,anomaly detection accuracy,ship routes,time 3.0 hour,highly accurate solution,pattern clustering,Artificial intelligence,information sources,Big Data,unsupervised learning methods,Roads,distributed spatial method,maritime modeling,Trajectory,entire processing duration,Surveillance,spatiotemporal dynamics,European Marine Casualty Information Platform,data handling,"
"a novel metric for detecting anomalous ship behavior using a variation of the dbscan clustering algorithm","2021","",""
"context learning from a ship trajectory cluster for anomaly detection","2023","This paper presents a context information extraction process over Automatic Identification System (AIS) real-world ship data, building a system with the capability to extract representative points of a trajectory cluster. With the trajectory cluster, the study proposes the use of trajectory segmentation algorithms to extract representative points of each trajectory and then use the k-means algorithm to obtain a series of centroids over all the representative points. These centroids, combined, form a new representative trajectory of the cluster. This new representative trajectory of the input cluster represents new contextual information extracted from the original set of trajectories, being possible to apply anomaly detection approaches over the new obtained context. The results show a suitable approach with several compression algorithms that are compared with a metric based on the Perpendicular Euclidean Distance.","Trajectory compression,Data mining,AIS data,Trajectory clustering,Context learning,"
"assessing compression algorithms to improve the efficiency of clustering analysis on ais vessel trajectories","2023","",""
"well water trace element reconnaissance, eastern maritime canada","1976","A geochemical survey involving the collection and analysis of about 2000 well water samples from an area of roughly 25,000 km2 was carried out during the 1975 field season over parts of the Carboniferous basin of eastern Canada. This report describes the results of 1721 regional well sites. Three samples of water were collected from each site and analyzed in four different laboratories for twenty constituents. The distribution and relationships of U, Rn, He F, CH4, Zn, Cu, Pb, Mn, Fe, pH, suspended matter, depth of well, conductivity and alkalinity are described. The elements U, Rn, He, F, along with conductivity and alkalinity, show systematic regional patterns indicating broad regional belts of element enrichment which are being leached by circulating groundwaters. The close spatial association of these elements over many tens of miles suggests chemical reaction cells or fronts similar to those observed in the uranium mining districts of Colorado and Wyoming in the United States and elsewhere. Their relatively weak character suggests an intermediate cycle in the cyclic enrichment hypothesis believed to be responsible for the formation of epigenetic uranium ore deposits. The heavy elements Zn, Cu, Pb, Mn, and Fe show positive correlation with each other but their spatial distribution is more spotty than that of the uranium elements. Broadly speaking the anomalies of these elements cluster mainly on the southern border of the survey area. Most of the anomalies can be explained in terms of known mineral occurrences The most prominent CH4 anomaly is located south of Moncton and is believed to be due to the old St. Josephs gas and oil field. Several weaker CH4 anomalies are probably generated by swamps and peat bogs.",""
"efficient on-line anomaly detection for ship systems in operation","2019","We propose novel modifications to an anomaly detection methodology based on multivariate signal reconstruction followed by residuals analysis. The reconstructions are made using Auto Associative Kernel Regression (AAKR), where the query observations are compared to historical observations called memory vectors, representing normal operation. When the data set with historical observations grows large, the naive approach where all observations are used as memory vectors will lead to unacceptable large computational loads, hence a reduced set of memory vectors should be intelligently selected. The residuals between the observed and the reconstructed signals are analysed using standard Sequential Probability Ratio Tests (SPRT), where appropriate alarms are raised based on the sequential behaviour of the residuals. The modifications we introduce include: a novel cluster based method to select memory vectors to be considered by the AAKR, which gives an extensive reduction in computation time; a generalization of the distance measure, which makes it possible to distinguish between explanatory and response variables; and a regional credibility estimation used in the residuals analysis, to let the time used to identify if a sequence of query vectors represents an anomalous state or not, depend on the amount of data situated close to or surrounding the query vector. We demonstrate how the anomaly detection method and the proposed modifications can be successfully applied for anomaly detection on a set of imbalanced benchmark data sets, as well as on recent data from a marine diesel engine in operation.","Cluster based AAKR,Maritime industry,Sequential Probability Ratio Test (SPRT),Anomaly detection,Auto Associative Kernel Regression (AAKR),Condition monitoring,"
"data-driven prognostics using a combination of constrained k-means clustering, fuzzy modeling and lof-based score","2017","Today, failure modes characterization and early detection is a key issue in complex assets. This is due to the negative impact of corrective operations and the conservative strategies usually put in practice, focused on preventive maintenance. In this paper anomaly detection issue is addressed in new monitoring sensor data by characterizing and modeling operational behaviors. The learning framework is performed on the basis of a machine learning approach that combines constrained K-means clustering for outlier detection and fuzzy modeling of distances to normality. A final score is also calculated over time, considering the membership degree to resulting fuzzy sets and a local outlier factor. Proposed solution is deployed in a CBM+ platform for online monitoring of the assets. In order to show the validity of the approach, experiments have been conducted on real operational faults in an auxiliary marine diesel engine. Experimental results show a fully comprehensive yet accurate prognostics approach, improving detection capabilities and knowledge management. The performance achieved is quite high (precision, sensitivity and specificity above 93% and κ=0.93), even more so given that a very small percentage of real faults are present in data.","Local outlier factor,Constrained k-means clustering,Behavior characterization,Machine learning,Fuzzy modeling,Condition monitoring,"
"contextual verification for false alarm reduction in maritime anomaly detection","2015","Automated vessel anomaly detection is immensely important for preventing and reducing illegal activities (e.g., drug dealing, human trafficking, etc.) and for effective emergency response and rescue in a country's territorial waters. A major limitation of previously proposed vessel anomaly detection techniques is the high rate of false alarms as these methods mainly consider vessel kinematic information which is generally obtained from AIS data. In many cases, an anomalous vessel in terms of kinematic data can be completely normal and legitimate if the 'context' at the location and time (e.g., weather and sea conditions) of the vessel is factored in. In this paper, we propose a novel anomalous vessel detection framework that utilizes such contextual information to reduce false alarms through 'contextual verification'. We evaluate our proposed framework for vessel anomaly detection using massive amount of real-life AIS data sets obtained from U.S. Coast Guard. Though our study and developed prototype is based on the maritime domain the basic idea of using contextual information through 'contextual verification' to filter false alarms can be applied to other domains as well.","Kinematics,AIS Data,emergency management,vessel kinematic information,Contextual Verification,Trajectory Clustering,Anomaly Detection,contextual verification,US coast guard,Meteorology,False Alarm Reduction,illegal activities,marine engineering,automated vessel anomaly detection,false alarms,Big data,contextual information,Context,false alarm reduction,maritime anomaly detection,Real-time systems,emergency response,Tracking,Trajectory,territorial waters,AIS data,"
"maritime vessel route extraction and automatic information system (ais) spoofing detection","2021","Automated Identification System (AIS) comprises of a global real-time network of maritime vessels, transmitters, and satellite or ground-station receivers, which are used to track and record time-stamped static (vessel-id, type, etc.) and dynamic (location, course, speed, etc.) information of all maritime vessels. Traditionally, this data feed has been used by vessel traffic services to avoid vessel collisions, however increasingly, marine researchers and data scientists have shown interest in developing algorithms on historical AIS data-dumps with diverse objectives such as estimating trends in global ocean-currents, maritime logistical planning, fishing fleet monitoring and enhancing maritime security. This paper aims to propose a novel shipping-route extraction algorithm to process historical AIS data (running into tens of gigabytes of daily data, from more than a hundred thousand maritime vessels), to effectively characterize global shipping route behaviour and capture its seasonal trends. This is done by formulating a sigmoid based turning waypoint identification, which does not solely depend on the change in the course of a vessel, derived from AIS message. The AIS data is further processed to excerpt the vesselâ€™s distance from the nearest port and nearest shore with resolution of about 1 km, which forms a handy metric for the identification of suspicious ports. Several other use cases are also explored, which include detecting various anomalies in individual vessel behaviour such as intentional or unintentional switching off AIS transmission, shipping-lane deviations, spoofing transmission messages. To tackle spoofing anomaly, various spoofing identification methods are discussed. A region-based spoofing identification algorithm is developed to identify spoofing points under multiple categories using a clustering algorithm. All the results are visualized through an open-source map overlay. The results contribute to a growing body of fast shipping route analysis algorithms.","Pattern recognition,fleet monitoring,Clustering algorithms,size 1.0 km,Folium,AIS transmission,ground-station receivers,historical AIS data-dumps,maritime vessels,Switches,security of data,maritime security,vessel behaviour,maritime logistical planning,Transmitters,global shipping route behaviour,Turning,logistics,ships,marine safety,Route Extraction,marine engineering,nearest port,Automatic Identification system,Port catalogue,vessel traffic services,automatic information system spoofing detection,Data Mining,shipping-route extraction algorithm,vessel collisions,Artificial intelligence,AIS message,maritime vessel route extraction,time-stamped static,data scientists,spoofing identification methods,AIS spoofing detection,Market research,DBSCAN Clustering Algorithm,fast shipping route analysis algorithms,Data mining,global ocean-currents,Python,nearest shore,marine researchers,"
"multi-label classification for ais data anomaly detection using wavelet transform","2022","Thanks to the Automatic Identification System (AIS), ships and other maritime equipment are able to communicate with each other, for example, by sending information about their position. This solution allows for early collision detection when two or more ships are on a collision course. In the newer version of AIS, a satellite infrastructure is used to extend the communication range. Unfortunately, satellite AIS deals with so-called packet collision effect: since there is a problem with synchronizing AIS data coming from multiple terrestrial areas, a single satellite may receive several AIS messages at the same time and be unable to correctly process them, causing the data to get lost or garbled. In this article, a machine learning based framework for detecting the incorrect AIS data is presented. In this approach, after the first stage (clustering), a dedicated anomaly detection algorithm searches for damaged AIS messages and conducts multi-label classification (with Random Forest and wavelet transform) to decide which fields of such message requires further correction. The results of measuring the effectiveness of the proposed approach using real AIS data are presented.","telecommunication security,Clustering algorithms,incorrect AIS data,single satellite,Anomaly detection,Wavelet transforms,anomaly detection,random forests,collision course,Marine vehicles,Machine learning,damaged AIS messages,Data analysis,dedicated anomaly detection algorithm searches,satellite communication,ships,wavelet transform,pattern classification,random forest,Classification algorithms,multiple terrestrial areas,pattern clustering,machine learning based framework,Artificial intelligence,multi-label classification,multilabel classification,wavelet transforms,satellite infrastructure,AIS data anomaly detection,maritime equipment,communication range,Trajectory,marine communication,Labeling,early collision detection,AIS data analysis,packet collision effect,satellite AIS deals,"
"automatic identification system-based trajectory clustering framework to identify vessel movement pattern","2023","",""
"synthetic trajectory extraction for maritime anomaly detection","2018","In the maritime domain, the main goal for large vessels is to drive as fast and efficiently as possible from one harbour to the next. This results in vessels following quite distinct routes. Deviations from these routes can be seen as indicators for illegal or at least suspicious behaviour. In order to extract these routes, clustering algorithms can be used, that will store the traffic patterns as synthetic trajectories. A vessel can be assigned to a specific route or a deviation from the routes can be detected by evaluating these route models. A challenge in designing the synthetic trajectories lies in the faithful representation, sparsity of data, treatment of outliers and split-up of routes. Here, a novel approach to model the uncertainty of the vessels movements while following a route is introduced: A cluster is now represented by a trajectory consisting of segments. Due to obstacles like shallow waters, a route might split up which will generate sub-segments. Instead of storing all cluster points, the position, speed, and course of the vessels are attached to each segment in form of normal distributions. Using these attributes, the probability of a deviation from the given trajectory can be estimated.","Clustering algorithms,Kernel,vessels movements,Anomaly detection,anomaly detection,traffic patterns,security of data,trajectory representation,ships,clustering algorithms,marine engineering,maritime domain,Heating systems,route models,pattern clustering,Artificial intelligence,maritime anomaly detection,synthetic trajectory extraction,Trajectory,data sparsity,probability,Gaussian distribution,data handling,"
"data mining approach to shipping route characterization and anomaly detection based on ais data","2020","A data mining approach is presented for probabilistic characterization of maritime traffic and anomaly detection. The approach automatically groups historical traffic data provided by the Automatic Identification System in terms of ship types, sizes, final destinations and other characteristics that influence the maritime traffic patterns off the continental coast of Portugal. The approach consists of identifying relevant waypoints along a route where significant changes in the ships’ navigational behaviour are observed, such as changes in heading, using trajectory compression and clustering algorithms. This provides a vector-based representation of the ship routes consisting of straight legs and connecting turning sections that facilitates route probabilistic characterization and anomaly detection. The maritime traffic is characterized probabilistically at the identified route legs and waypoints in terms of lateral distribution of the trajectories and speed profile, which allows the characterization of the typical behaviour of a group of similar ships along a particular route. In the proposed approach heading changes are automatically detected using the Douglas and Peucker algorithm and clustered by the density-based spatial clustering of applications with noise algorithm. The proposed method is applied to the characterization of southbound maritime traffic from the traffic separation scheme off Cape Roca to the ports of Lisbon, Setúbal and Sines. Finally, an example of ship trajectory anomaly detection based on the developed maritime traffic probabilistic models is provided.","Traffic characterization,Maritime traffic,Anomaly detection,Data mining,AIS data,"
"on the interest of data mining for an integrity assessment of ais messages","2016","Put in place by the International Maritime Organization, the Automatic Identification System is a worldwide maritime electronic system that sends radio broadcasted messages at a high rate between the stations, either on board the vessels or on shores. However, some misuses of the system such as identity theft, localization spoofing or disappearances have been demonstrated. The high rate of transmission implies a considerable amount of data to process in order to point out those irregularities. This paper proposes a method based on data mining and clustering methods combined to an integrity assessment of AIS messages for anomaly detection, with a proposition of software architecture for a data processing done both on-the-fly and with archived data. The computation of confidence coefficients and the use of data mining techniques will lead to behaviour characterization with the purpose of enhance the maritime situational awareness.","data mining,Safety,AIS message integrity assessment,anomaly detection,Marine vehicles,integrity assessment,security of data,clustering methods,Radio navigation,Object recognition,maritime situational awareness,automatic identification system,marine engineering,Automatic Identification System,International Maritime Organization,software architecture,data falsification,pattern clustering,Artificial intelligence,data processing,maritime electronic system,Clustering methods,Data mining,"
