"name","year","abstract","keywords"
"fusing uncertain knowledge and evidence for maritime situational awareness via markov logic networks","2015","The concepts of event and anomaly are important building blocks for developing a situational picture of the observed environment. We here relate these concepts to the JDL fusion model and demonstrate the power of Markov Logic Networks (MLNs) for encoding uncertain knowledge and compute inferences according to observed evidence. MLNs combine the expressive power of first-order logic and the probabilistic uncertainty management of Markov networks. Within this framework, different types of knowledge (e.g. a priori, contextual) with associated uncertainty can be fused together for situation assessment by expressing unobservable complex events as a logical combination of simpler evidences. We also develop a mechanism to evaluate the level of completion of complex events and show how, along with event probability, it could provide additional useful information to the operator. Examples are demonstrated on two maritime scenarios of rules for event and anomaly detection.","Uncertainty management,Situational awareness,Markov Logic Networks,Context-based fusion,"
"an unsupervised reconstruction-based fault detection algorithm for maritime components","2019","In recent years, the reliability and safety requirements of ship systems have increased drastically. This has prompted a paradigm shift toward the development of prognostics and health management (PHM) approaches for these systems' critical maritime components. In light of harsh environmental conditions with varying operational loads, and a lack of fault labels in the maritime industry generally, any PHM solution for maritime components should include independent and intelligent fault detection algorithms that can report faults automatically. In this paper, we propose an unsupervised reconstruction-based fault detection algorithm for maritime components. The advantages of the proposed algorithm are verified on five different data sets of real operational run-to-failure data provided by a highly regarded industrial company. Each data set is subject to a fault at an unknown time step. In addition, different magnitudes of random white Gaussian noise are applied to each data set in order to create several real-life situations. The results suggest that the algorithm is highly suitable to be included as part of a pure data-driven diagnostics approach in future end-to-end PHM system solutions.","maritime components,ship systems,Prediction algorithms,unsupervised learning,reliability,Maintenance engineering,deep learning,ships,Prognostics and health management,random white Gaussian noise,Gaussian noise,Fault detection,Machine learning algorithms,Degradation,condition monitoring,maritime industry,Automatic fault detection,Signal processing algorithms,remaining life assessment,intelligent fault detection algorithm,unsupervised reconstruction-based fault detection algorithm,prognostics and health management,fault diagnosis,"
"wave height prediction suitable for maritime transportation based on green ocean of things","2023","Nowadays, the application fields of the Internet of Things (IoT) involve all aspects. This article combines ocean research with the IoT, in order to investigate the wave height prediction to assist ships to improve the economy and safety of maritime transportation and proposes an ocean IoT Green Ocean of Things (GOoT) with a green and low-carbon concept. In the wave height prediction, we apply a hybrid model (EMD-TCN) combining the temporal convolutional network (TCN) and the empirical mode decomposition (EMD) to the buoy observation data. We then compare it with TCN, long short-term memory (LSTM), and hybrid model EMD-LSTM. By testing the data of eight selected NDBC buoys distributed in different sea areas, the effectiveness of the EMD-TCN hybrid model in wave height prediction is verified. The hysteresis problem in previous wave height prediction research is eliminated, while improving the accuracy of the wave height prediction. In the 24 h, 36 h, and 48 h wave height prediction, the minimum mean absolute errors are 0.1265, 0.1689, and 0.1963, respectively; the maximum coefficient of determination are 0.9388, 0.9019, and 0.8712, respectively. In addition, in the short-term prediction, the EMD-TCN hybrid model also performs well, and has strong versatility.","time 36.0 hour,recurrent neural nets,Transportation,hybrid model EMD-LSTM,Safety,deep learning (artificial intelligence),wave height prediction suitable,Internet of Things (IoT),Internet of Things,transportation,Marine vehicles,EMD-TCN hybrid model,wave height prediction,Predictive models,ocean waves,temporal convolutional network (TCN),Hilbert transforms,ships,maritime transportation,time 48.0 hour,Oceans,Time series analysis,Empirical mode decomposition (EMD),Convolution,convolutional neural nets,time series,time 24.0 hour,ocean IoT Green Ocean,previous wave height prediction research,oceanographic techniques,"
"dltif: deep learning-driven cyber threat intelligence modeling and identification framework in iot-enabled maritime transportation systems","2023","The recent burgeoning of Internet of Things (IoT) technologies in the maritime industry is successfully digitalizing Maritime Transportation Systems (MTS). In IoT-enabled MTS, the smart maritime objects, infrastructure associated with ship or port communicate wirelessly using an open channel Internet. The intercommunication and incorporation of heterogeneous technologies in IoT-enabled MTS brings opportunities not only for the industries that embrace it, but also for cyber-criminals. Cyber Threat Intelligence (CTI) is an effective security strategy that uses artificial intelligence models to understand cyber-attacks and can protect data of IoT-enabled MTS proficiently. Unsurprisingly, most of the existing CTI-based solutions uses manual analysis to extract relevant threat information, and has low detection and high false alarm rate. Therefore, to tackle aforementioned challenges, an automated framework called DLTIF is developed for modeling cyber threat intelligence and identifying threat types. The proposed DLTIF is based on three schemes: a deep feature extractor (DFE), CTI-driven detection (CTIDD) and CTI-attack type identification (CTIATI). The DFE scheme automatically extracts the hidden patterns of IoT-enabled MTS network and its output is used by CTIDD scheme for threat detection. The CTIATI scheme is designed to identify the exact threat types and to assist security analysts in giving early warning and adopt defensive strategies. The proposed framework has obtained upto 99% accuracy, and outperforms some traditional and recent state-of-the-art approaches.","cyber-attacks,deep feature extractor,Cyber-attack,cyber threat intelligence,computer network security,threat type identification,identification framework,Hidden Markov models,deep learning (artificial intelligence),maritime transportation systems (MTS),computer crime,Internet of Things,transportation,CTI-driven detection,ship,cyber-physical systems,Feature extraction,the Internet of Things (IoT),blockchains,CTI-attack type identification,DLTIF,deep learning,heterogeneous technologies,ships,deep learning-driven cyber threat intelligence modeling,Data models,cyber-criminals,feature extraction,IoT-enabled MTS network,artificial intelligence models,Logic gates,CTI-attack,defensive strategies,marine engineering computing,exact threat types,smart maritime objects,maritime industry,open channel Internet,Internet,artificial intelligence,Data mining,IoT-enabled maritime transportation systems,threat detection,Analytical models,"
"water segmentation with superior guidance and aligned fusion strategy for unmanned surface vehicles in maritime environment","2022","As a mid-level vision task, water segmentation is essential for unmanned surface systems such as to get the sailing area and avoid the floating objects to ensure vehicles safety in maritime environment. However, existing deep learning method of water segmentation has a little weakness on maintaining origin-scale fineness. At the same time, our intuition is that ground truth is a powerful tool for optimizing the global network. In this paper, we give solutions through these two aspects using superior guidance and aligned fusion strategy. Aligned fusion provides symmetric and fine-grained fusion strategy when using encoder-decoder structured network, and superior guidance enforce the segmentation network grasp the discrimination criterion much earlier before output part of the network. Both of them show benefits for water segmentation of unmanned surface system's image data. The experimental results on Marine Semantic Segmentation Training dataset show its effectiveness and efficiency.","Semantic segmentation,superior guidance,Safety,deep learning (artificial intelligence),robot vision,aligned fusion,vehicles safety,unmanned surface systems,fine-grained fusion strategy,mid-level vision task,marine semantic segmentation training dataset,aligned fusion strategy,water segmentation,Training,maritime environment,Autonomous vehicles,unmanned surface vehicles,mobile robots,Deep learning,segmentation network,Task analysis,image segmentation,unmanned surface system,"
"maritime target detection method based on deep learning","2018","For the problem of low recognition rate of traditional digital image processing in actual maritime target detection, an improved maritime target detection method based on deep convolution neural network is proposed. The maritime targets (mainly including fixed-wing aircraft, surface ships and helicopters under the background of sea and sky) are marked to establish the target datasets. The detection framework of maritime target based on Faster RCNN is given and improved by using the Resnet to extract the feature of target, and using the batch normalization layer to optimize the Faster RCNN network, using online hard-examples-mining algorithm to improve the training process. The training and test experiments of the improved target detection method were completed. The experimental results show that improved method can identify the common maritime target effectively and has better detection accuracy and robustness compared with Faster RCNN.","recurrent neural nets,data mining,Faster RCNN,training process,detection framework,maritime target detection,improved maritime target detection method,surface ships,Feature extraction,Neural networks,target datasets,online hard-examples-mining algorithm,Target recognition,deep learning,fixed-wing aircraft,Image recognition,online hard-examples mining,object detection,optimisation,digital image processing,feature extraction,low recognition rate,Convolution,batch normalization layer,Resnet,Training,helicopters,Object detection,learning (artificial intelligence),deep convolution neural network,Faster RCNN network,"
"anomaly detection with unknown anomalies: application to maritime machinery","2021","We present a framework for deriving anomaly detection algorithms on timeseries data when the time and expression of anomalous behaviour is unknown. The framework is suited for problems in which individual machine learning paradigms cannot be directly implemented: supervised learning is not applicable due to the lack of labelled data, unsupervised learning is not effective since the normal operations are insufficiently defined and take complex and diverse forms, and deep learning risks confusing problematic behaviours for expected ones due to the possible repetitiveness of similar anomalies. The proposed approach is comprised of two phases: unsupervised discovery of anomalies, and semi-supervised construction and tuning of the anomaly detection algorithm. By leveraging data exploration methods and expert knowledge, the resulting algorithms are interpretable and detect a wide range of anomalous behaviours. The approach is applied to the early detection of wear and tear of maritime propulsion and manoeuvring machinery. We show that the final algorithm is able to detect different types of anomalies, including an actual internal leakage in a thruster which is otherwise overlooked by the present rule-based alarm system.","diagnosis,predictive maintenance,condition-based monitoring,machine learning,anomaly detection,grey-box modelling,fault detection,"
"mkcl: medical knowledge with contrastive learning model for radiology report generation","2023","Automatic radiology report generation has the potential to alert inexperienced radiologists to misdiagnoses or missed diagnoses and improve healthcare delivery efficiency by reducing the documentation workload of radiologists. Motivated by the continuous development of automatic image captioning, more and more deep learning methods have been proposed for automatic radiology report generation. However, the visual and textual data bias problem still face many challenges in the medical domain. Additionally, do not integrate medical knowledge, ignoring the mutual influences between medical findings, and abundant unlabeled medical images influence the accuracy of generating report. In this paper, we propose a Medical Knowledge with Contrastive Learning model (MKCL) to enhance radiology report generation. The proposed model MKCL uses IU Medical Knowledge Graph (IU-MKG) to mine the relationship among medical findings and improve the accuracy of identifying positive diseases findings from radiologic medical images. In particular, we design Knowledge Enhanced Attention (KEA), which integrates the IU-MKG and the extracted chest radiological visual features to alleviate textual data bias. Meanwhile, this paper leverages supervised contrastive learning to relieve radiographic medical images which have not been labeled, and identify abnormalities from images. Experimental results on the public dataset IU X-ray show that our proposed model MKCL outperforms other state-of-the-art report generation methods. Ablation studies also demonstrate that IU medical knowledge graph module and supervised contrastive learning module enhance the ability of the model to detect the abnormal parts and accurately describe the abnormal findings. The source code is available at: https://github.com/Eleanorhxd/MKCL.","Supervised contrastive learning,Radiology report generation,Medical knowledge graph,"
"watercraft-net: a deep inference vision approach of watercraft detection for maritime surveillance system using optical aerial images","2020","The ocean and any form of bodies of water must be protected and secure from any intruders and to monitor our ocean, technology must be used and integrated for more efficient monitoring. Automatic boat detection plays an important role in maritime surveillance. However, the maritime environment represents lots of challenges such as the wave of water, boat movements, and weather condition. This paper presents a method for detecting moving boats from a sequence of images using a deep learning approach. In this study, the researchers proposed a detection system for the boats in the ocean using optical aerial images. The researchers conducted testing and the results were favorable. Upon testing the researchers obtained a 90% accuracy of detection of the ship in the ocean using the single images, video feeds, and live feeds. The experiments show promising results.","Optical imaging,detection system,deep learning approach,maritime surveillance system,optical aerial images,automatic boat detection,watercraft-net,mean average precision,deep inference vision approach,deep learning,ships,Integrated optics,marine engineering,boats,Oceans,object detection,computer vision,moving boats,boat movements,machine vision,boat detection,weather condition,maritime environment,image sequences,Marine technology,Boats,Deep learning,image sensors,Surveillance,image processing,video surveillance,learning (artificial intelligence),watercraft detection,"
"a contextual hybrid model for vessel movement prediction","2021","Predicting the movement of the vessels can significantly improve the management of safety. While the movement can be a function of geographic contexts, the current systems and methods rarely incorporate contextual information into the analysis. This paper initially proposes a novel context-aware trajectoriesâ€™ simplification method to embed the effects of geographic context which guarantees the logical consistency of the compressed trajectories, and further suggests a hybrid method that is built upon a curvilinear model and deep neural networks. The proposed method employs contextual information to check the logical consistency of the curvilinear method and then, constructs a Context-aware Long Short-Term Memory (CLSTM) network that can take into account contextual variables, such as the vessel types. The proposed method can enhance the prediction accuracy while maintaining the logical consistency, through a recursive feedback loop. The implementations of the proposed approach on the Automatic Identification System (AIS) dataset, from the eastern coast of the United States of America which was collected, from November to December 2017, demonstrates the effectiveness and better compression, i.e. 80% compression ratio while maintaining the logical consistency. The estimated compressed trajectories are 23% more similar to their original trajectories compared to currently used simplification methods. Furthermore, the overall accuracy of the implemented hybrid method is 15.68% higher than the ordinary Long Short-Term Memory (LSTM) network which is currently used by various maritime systems and applications, including collision avoidance, vessel route planning, and anomaly detection systems.","recurrent neural nets,Safety,deep learning (artificial intelligence),Mathematical model,safety management,movement prediction,AIS dataset,Predictive models,curvilinear method,ubiquitous computing,deep neural networks,CLSTM network,ship behavior,deep learning,ships,automatic identification system dataset,marine safety,marine engineering,Data models,contextual hybrid model,contextual information,vessel movement prediction,United States of America,geographic context,data compression,Automatic identification system,vessel types,Trajectory,compressed trajectory estimation,context-aware LSTM network,vessel route planning,Deep learning,Context modeling,context-aware long short-term memory network,logical consistency,context-aware trajectories simplification,"
"maritime ship detection using convolutional neural networks from satellite images","2021","The significance of efficient monitoring and control of marine traffic for the purpose of safety and security of the ships cannot be overemphasized in the current scenario where global trade and commerce is at its pinnacle. Various stakeholders are concerned with serious maritime issues related to hijacking of ships, illegal fishing, encroachments of sea borders, and illicit exchange of sea cargo, accidents, and military attacks. This requires an automated, accurate, fast, and robust sea monitoring system which can avoid or mitigate the negative effects of such issues. This paper proposes, implements, and evaluates a CNN based deep learning model which can accurately identify ships from the images captured from satellite images. Two models CNN Model 1 and CNN Model 2 having different architectures are trained, validated, and tested on the Airbus satellite images dataset. Both classification accuracy and loss functions are measured by varying the number of the epochs. Also, the complexity comparison of the two models is performed by measuring the training time. The paper concludes that the proposed models are automatic, fast and accurate in terms of their performance on the Airbus dataset by achieving a maximum accuracy of 89.7%.","Satellites,sea borders,CNN based deep learning model,maritime ship detection,deep learning (artificial intelligence),sea cargo,efficient monitoring,Sea measurements,geophysical image processing,safety,robust sea monitoring system,global trade,Atmospheric modeling,illegal fishing,military attacks,ships,Sea Surveillance,object detection,airbus satellite images dataset,image classification,serious maritime issues,illicit exchange,Computer architecture,Maritime Ship Detection,commerce,marine traffic,Deep CNN,convolutional neural nets,convolutional neural networks,Loss measurement,Deep learning,Computational modeling,deep learning model,Deep Learning,security,Convolutional Neural Networks,"
"maritime incident information extraction using machine and deep learning techniques","2021","In this paper, we present several Natural Language Processing (NLP) techniques for extracting information about piracy from unstructured maritime news articles. The first technique is a document segmentation algorithm, which, given an article that may discuss several unrelated topics, separates the document into a list of maritime incidents. This technique takes advantage of the notion that maritime articles tend to include many precise dates and achieves an F1-score of 0.82 on a dataset of 52 articles. The second technique extracts the names and types of ships involved in a maritime incident using a combination of Named Entity Recognition (NER) and database lookups; an F1-score of 0.89 is achieved. The third and final technique determines the incident type, the severity of the incident, the response taken by the victim, and the eventual impact of this response. To determine these details, five binary classification models were trained and tested. The overall best algorithm was gradient boosting via the CatBoost library, which achieved an average accuracy of 91%.","Natural Language Processing techniques,maritime incident information extraction,Information retrieval,final technique,natural language processing,incident type,Libraries,third technique,document segmentation algorithm,Databases,database lookups,pattern classification,maritime articles,unrelated topics,Classification algorithms,unstructured maritime news articles,Deep learning,Natural language processing,Computational modeling,text analysis,deep learning techniques,image segmentation,learning (artificial intelligence),"
"intelligent deep fusion network for anomaly identification in maritime transportation systems","2023","This paper introduces a novel deep learning architecture for identifying outliers in the context of intelligent transportation systems. The use of a convolutional neural network with decomposition is explored to find abnormal behavior in maritime data. The set of maritime data is first decomposed into similar clusters containing homogeneous data, and then a convolutional neural network is used for each data cluster. Different models are trained (one per cluster), and each model is learned from highly correlated data. Finally, the results of the models are merged using a simple but efficient fusion strategy. To verify the performance of the proposed framework, intensive experiments were conducted on marine data. The results show the superiority of the proposed framework compared to the baseline solutions in terms of several accuracy metrics.","maritime data,Transportation,Urban areas,homogeneous data,deep learning (artificial intelligence),highly correlated data,Anomaly detection,maritime transportation systems,transportation,smart and secure transportation systems,intelligent transportation systems,similar clusters,anomaly identification,simple but efficient fusion strategy,Data models,marine data,pattern clustering,convolutional neural network,convolutional neural nets,intelligent deep fusion network,Training,Convolutional neural networks,decomposition,Deep learning,data cluster,learning (artificial intelligence),deep learning architecture,Convolution neural network,"
