"name","year","abstract","keywords"
"an adaptive ionosphere clutter suppression and target detection method for hfswr maritime surveillance","2023","High-frequency surface wave radar (HFSWR) as a maritime surveillance facility faces the tough challenges. One of them is that various unwanted echo components constantly destroy the detection performance of HFSWR, especially the dynamically changing ionosphere clutter. This article proposes an adaptive ionosphere clutter suppression and target detection algorithm (AICSTD) based on improved higher order singular value decomposition (HOSVD) and deep learning network. First, we analyze the multiple-dimensional characteristics of different types of ionosphere clutter echo data. Then, refer to the multichannel HFSWR echo data structure, we apply simplified HOSVD and orthogonal subspace projection to eliminate the unwanted echo component and, meanwhile, preserve the target echo. The key parameter of simplified HOSVD is determined by the mean structural similarity (MSSIM) index, which contributes to reduce the computation complexity of the proposed method. Finally, we improved the deep learning network to detect the targets in various behaviors after the clutter suppression. In order to address the issue of limited clutter data, transfer learning based on historical radar echo data is applied. A thorough experimental analysis on various real clutter data shows that the proposed method performs competitively. Our method shows a superior performance over many state-of-the-art clutter suppression methods, with a covered target detection accuracy of 92.4% under strong spread clutter background.","Ionosphere,structural similarity (SSIM) index,higher order singular value decomposition (HOSVD),ionosphere clutter suppression,Tensors,Clutter,Deep learning,Object detection,Doppler effect,target detection,high-frequency surface wave radar (HFSWR),Reflection,"
"data-driven methods for detection of abnormal ship behavior: progress and trends","2023","Maritime traffic safety influences the development of world economies. A major aspect to enhance maritime traffic safety is the effective detection of abnormal ship behavior (DASB) which recently have been widely made based on data-driven methods using multisource heterogeneous data. In order to provide an overview of the state-of-the-art of research, this study presents a review of DASB. First, the categories of abnormal ship behavior and data sources of DASB are concretely introduced, and the process of data-driven DASB combined with expert knowledge are described. Second, we conduct systematic disciplinary knowledge maps in the field of DASB, which identify evolution, hotspots and emerging trends. In this manner, data-driven methods for DASB were categorized into six types, including multisource data fusion approaches, statistical analysis approaches, traditional intelligent algorithmic approaches, deep learning approaches, knowledge-based and data-driven integrating approaches and computing power, and provide an overview of them. Then, we propose an integrated framework for DASB. Finally, we discuss the challenges in terms of three technical aspects (data, algorithm, and computing power) and outline possible paths of investigation for DASB to improve intelligent maritime surveillance.","Anomaly detection,Maritime traffic,Data-driven,Ship behavior,"
"two-stage networks with adversarial clutter suppression for maritime radar target detection","2022","Maritime radar target detection is often affected by sea clutter, and the detection performance in the case of low signal-to-clutter ratio (SCR) is usually poor. In this paper, we propose a two-stage deep learning method for sea clutter suppression and point target detection. Take the cluttered Range-Doppler (RD) spectra as input, at the first stage, reconstructed RD spectra are obtained as clutter suppression results through Attention Denoising Adversarial-Autoencoders (Atten-DAAE). At the second stage, detection results are obtained through the traditional one-stage detection network YOLOv5s. The proposed method has been verified on two datasets with simulated and measured clutter data respectively and compared with the traditional method and other networks, which shows better detection performance.","cluttered range-Doppler spectra,marine radar,deep learning (artificial intelligence),radar detection,radar clutter,one-stage detection network YOLOv5,clutter suppression,Sea measurements,reconstructed RD spectra,Adversarial clutter suppression,attention denoising adversarial-autoencoders,deep learning,radar target detection,radar computing,radar target recognition,Signal processing,sea clutter suppression,Radar clutter,maritime radar target detection,point target detection,two-stage deep learning method,Deep learning,Object detection,low signal-to-clutter ratio,simulated measured clutter data,Time measurement,Radar detection,"
"comparing cnn-based object detectors on two novel maritime datasets","2020","Vessel detection studies conducted on inshore and offshore maritime images are scarce, due to a limited availability of domain-specific datasets. We addressed this need collecting two datasets in the Finnish Archipelago. They consist of images of maritime vessels engaged in various operating scenarios, climatic conditions and lighting environments. Vessel instances were precisely annotated in both datasets. We evaluated the out-of-the-box performance of three state-of-the-art CNN-based object detection algorithms (Faster R-CNN [1], R-FCN [2] and SSD [3]) on these datasets and compared them in terms of accuracy and run-time. The algorithms were previously trained on the COCO dataset [4]. We explore their performance based on different feature extractors. Furthermore, we investigate the effect of the object size on the algorithm performance. For this purpose, we group all objects in each image into three categories (small, medium and large) according to the number of occupied pixels in the annotated bounding box. Experiments show that Faster R-CNN with ResNet101 as feature extractor outperforms the other algorithms.","autonomous marine navigation,Lighting,CNN-based object detectors,maritime vessels,Feature extraction,climatic conditions,lighting environments,Transfer learning,domain-specific datasets,deep learning,faster R-CNN,bounding box annotation,marine engineering,object detection,feature extraction,offshore maritime images,Finnish Archipelago,Radar tracking,vessel detection,convolutional neural network,inshore maritime images,convolutional neural nets,maritime vessel dataset,Object detection,learning (artificial intelligence),COCO dataset,Detectors,Radar detection,"
"a maritime target detector based on cnn and embedded device for gf-3 images","2019","Recently, with the development of deep learning and the springing up of synthetic aperture radar (SAR) images, SAR maritime target detection based on convolutional neural network (CNN) has become a hot issue. However, most related work is realized on general purpose hardware like CPU or GPU, which is energy consuming, non-real-time and unable to be deployed on embedded devices. Aiming at this problem, this paper proposes a method to deploy a model of SAR maritime target detection network on an embedded device which employs custom artificial intelligence streaming architecture (CAISA). Moreover, the model is trained and tested on the Gaofen-3 (GF-3) spaceborne SAR images, which include six different kinds of maritime targets. Experiments based on the GF-3 dataset show the method is practicable and extensible.","convolutional neural network (CNN),maritime target detection,GF-3 dataset,Gaofen-3 spaceborne SAR images,CAISA,geophysical image processing,deep learning,CNN,object detection,synthetic aperture radar,synthetic aperture radar (SAR),SAR maritime target detection network,radar imaging,maritime target detector,convolutional neural network,synthetic aperture radar images,embedded device,convolutional neural nets,custom artificial intelligence streaming architecture,learning (artificial intelligence),remote sensing by radar,GF-3 Images,"
"deep learning-powered vessel trajectory prediction for improving smart traffic services in maritime internet of things","2022","The maritime Internet of Things (IoT) has recently emerged as a revolutionary communication paradigm where a large number of moving vessels are closely interconnected in intelligent maritime networks. However, the tremendous growth of vessel trajectories, collected from the combined satellite-terrestrial AIS (automatic identification system) base stations, could lead to unsatisfactory maritime safety and efficacy. To promote smart traffic services in maritime IoT, it is necessary to accurately and robustly predict the spatiotemporal vessel trajectories. It is beneficial for collision avoidance, maritime surveillance, and abnormal behavior detection, etc. Motivated by the strong learning capacity of deep neural networks, this work proposes an AIS data-driven trajectory prediction framework, whose main component is a long short term memory (LSTM) network. In particular, the vessel traffic conflict situation modeling, generated using the dynamic AIS data and social force concept, is embedded into the LSTM network to guarantee high-accuracy vessel trajectory prediction. In addition, a mixed loss function is reconstructed to make our prediction results more reliable and robust in different navigation environments. Several quantitative and qualitative experiments have been implemented on realistic AIS-based vessel trajectories. Our results have demonstrated that the proposed method could achieve satisfactory prediction performance in terms of accuracy and robustness.","surveillance,dynamic AIS data,LSTM network,Hidden Markov models,deep learning (artificial intelligence),Internet of Things,smart traffic service improvement,abnormal behavior detection,high-accuracy vessel trajectory prediction,intelligent maritime networks,Predictive models,deep learning-powered vessel trajectory prediction,maritime IoT,deep neural networks,Maritime Internt of Things,deep learning,moving vessels,ships,automatic identification system,marine safety,marine engineering,maritime surveillance,vessel traffic services,AIS data-driven trajectory prediction framework,vessel traffic conflict situation modeling,6G mobile communication,maritime Internet of Things,Artificial intelligence,spatiotemporal vessel trajectories,revolutionary communication paradigm,long-short-term memory network,Trajectory,trajectory prediction,Navigation,combined satellite-terrestrial AIS,marine vehicles,realistic AIS-based vessel trajectories,unsatisfactory maritime safety,satisfactory prediction performance,"
"navigation support for an autonomous ferry using deep reinforcement learning in simulated maritime environments","2022","The development of shipping is witnessing increasing automation - from existing assistance systems to fully autonomous behaviour. In this article, we present a building block on the way to a fully autonomous passenger ferry for the Kiel Fjord in Germany by presenting a simulation-based approach to situation modelling of maritime environments and the behaviour therein. We show how this can be used for a posteriori analysis of the possible behaviour of the ship. This analysis then in turn flows into the decision-making process. We also use this environment to investigate the application of Deep Reinforcement Learning techniques to optimize navigation tasks and identify challenges and limitations.","ship,Conferences,Reinforcement learning,fully autonomous behaviour,maritime simulation,Decision making,simulation-based approach,navigation tasks,posteriori analysis,deep reinforcement learning,simulated maritime environments,ships,marine safety,increasing automation,ferry,navigation support,situation modelling,assistance systems,Deep Reinforcement Learning,autonomous ship,decision making,autonomous ferry,Kiel Fjord,fully autonomous passenger ferry,Automation,decision-making process,Computational modeling,Navigation,Task analysis,learning (artificial intelligence),possible behaviour,"
"maritime environment perception based on deep learning","2022","Environment perception is an essential aspect of automated maritime vehicles, especially in high-traffic areas. In recent years, deep-learning-based object detection using LiDAR has been well developed in the automotive sector but has not yet seen a similar level of sophisticated development in maritime applications. In these applications, LiDAR detection should be fused with other maritime navigation systems such as the automatic identification system (AIS) to expand the detection range. To address this, we propose a novel deep-learning-based concept for maritime environment perception by using LiDAR as a primary sensor and AIS as an assisting information source. This approach consists of three functional modules: object detection, multi-object tracking, and static environment mapping. For object detection, we apply a convolutional neural network (CNN) to detect floating objects represented as oriented bounding boxes. To train the CNN, we propose a method that generates simulated labeled datasets. The detected objects from CNN are tracked with Kalman Filter banks. The remaining LiDAR data points are treated as static environments and represented by polygons. We evaluated the approach by using simulative and real-world datasets. In the simulation, the average precision of the CNN object detector reaches 60.8%, with a data processing rate of 40 Hz in GPU. Our real-world evaluations show that this approach can track 83% of the vessels in a crowded harbor, with the overall intersection over union reaching 64%. Our proposed approach represents the first application of CNN for LiDAR-based maritime environment perception, demonstrating its high potential for future online and real-world applications.","high-traffic areas,real-world applications,static environment mapping,Kalman filters,CNN object detector,automated maritime vehicles,deep-learning-based concept,static environments,Laser radar,neural nets,frequency 40.0 Hz,deep learning,object tracking,automatic identification system,LiDAR detection,Intelligent vessels,supervised learning,maritime navigation,AIS,object detection,sophisticated development,image classification,Radar tracking,Artificial intelligence,convolutional neural network,optical radar,Point cloud compression,Radar,maritime applications,maritime navigation systems,detection range,LiDAR-based maritime environment perception,multi-object tracking,Object detection,deep-learning-based object detection,multiobject tracking,learning (artificial intelligence),remaining LiDAR data points,Detectors,"
"path planning for a maritime suface ship based on deep reinforcement learning and weather data","2021","Information analysis related to a ship and its environment is required in order to make the appropriate decisions during naval missions. However, human capabilities are no longer sufficient to reliably and rapidly process the massive amount of heterogeneous data collected by a huge lot of different sensors. That is the reason why Artificial Intelligence (AI) algorithms as decision support could help operators to choose the appropriate decisions during naval missions.This article offers a decision support model able to assist operators in predicting the path of a Maritime Surface Ship (MSS) in a dynamic environment by Deep Reinforcement Learning (DRL). Path planning of MSS in a dynamic environment is still challenging. Ocean disturbances are difficult to model thinly but collisions must be avoided. Thus, we suggest considering weather data and simplified mobile and static obstacles.","decision support systems,Path planning,weather data,Weather Data,MSS,Prediction algorithms,dynamic environment,Marine vehicles,naval missions,Reinforcement learning,Reliability,Predictive models,ships,decision support model,Ship,appropriate decisions,Maritime Surface Ship,Deep Reinforcement Learning,Sea surface,path planning,human capabilities,mobile robots,maritime suface ship,reason why Artificial Intelligence algorithms,collision avoidance,artificial intelligence,information analysis,learning (artificial intelligence),heterogeneous data,"
"a deep semantic autoencoder for maritime wireless communications","2023","With the rapid development of maritime transportation, ocean tourism, monitoring, surveillance and aquaculture, the maritime communication industry has encountered new opportunities. Maritime End-to-end (E2E) communication systems based on deep learning (DL) have become diverse, while semantic communication systems have become a critical research point due to their ability to understand and analyze natural language. In this paper, we propose a deep semantic autoencoder (DSA) for maritime wireless communications. The DSA consists of a semantic encoder, channel encoder, channel decoder, and semantic decoder. The DSA employs transformers and convolutional neural networks to extract and restore the meaning of sentences while minimizing semantic errors during transmission. In order to enhance the effectiveness of the DSA in transmitting maritime data, the Rician fading channel is utilized to simulate complex and varied marine environments. Furthermore, the system parameters of the DSA are optimized through training the maritime data and calculating the loss functions. Extensive simulation experiments indicate that compared to the benchmark, the DSA demonstrates superior bilingual evaluation understudy and sentence similarity performance under different signal-to-noise ratio conditions, indicating its ability to effectively extract semantics.","end-to-end,semantic communication systems,Semantics,surveillance,maritime data,Transportation,Benchmark testing,deep learning (artificial intelligence),system parameters,maritime wireless communications,semantic encoder,maritime communication industry,deep semantic autoencoder,natural language processing,semantic errors,Wireless communication,critical research point,deep learning,marine safety,semantics,marine engineering,Maritime wireless communications,Rician channels,maritime transportation,maritime end-to-end communication systems,convolutional neural nets,semantic decoder,Training,ocean tourism,marine communication,Simulation,Surveillance,artificial intelligence,DSA,channel decoder,aquaculture,Rician fading channel,"
"adaptive detection tracking system for autonomous uav maritime patrolling","2020","Nowadays, Unmanned Aerial Vehicles (UAVs) are considered reliable systems, suitable for several autonomous applications, especially for target detection and tracking. Although significant developments were achieved in object detection systems over the last decades using the deep learning technique known as Convolutional Neural Networks (CNN), there are still research gaps in this area. In this paper, we present a new object detection-tracking algorithm that can be used on low power consuming processing boards. In particular, we analysed a specific application scenario in which a UAV patrols coastlines and autonomously classifies different kind of marine objects. Current state of the art solutions propose centralised architectures or flying systems with human in the loop, making the whole system poorly efficient and not scalable. On the contrary, applying a Deep Learning detection system that runs on commercial Graphics Processing Units (GPUs) makes UAVs potentially more efficient than humans (especially for dull tasks like coastline patrolling) and the whole system becomes easily scalable because each UAV can fly independently and the Ground Control Station does not represent a bottleneck. To deal with this task, a database consisting of more than 115000 images was created to train and test several CNN architectures. Furthermore, an adaptive detection-tracking algorithm was introduced to make the whole system faster by optimizing the balancing between detecting new objects and tracking existing targets. The proposed solution is based on the measure of the tracking confidence and the frame similarity, by means of the Structural SIMilarity (SSIM) index, computed both globally and locally. Finally, the developed algorithms were tested on a realistic scenario by means of a UAV test-bed.","unmanned aerial vehicles,coastline patrolling,target detection,robot vision,adaptive detection tracking,Machine learning,Feature extraction,target tracking,service robots,object detection tracking,CNN,deep learning detection system,graphics processing units,Target tracking,object detection,pinhole camera model,image classification,autonomous UAV maritime patrolling,neural net architecture,convolutional neural nets,autonomous aerial vehicles,convolutional neural networks,Training,Convolutional neural networks,Unmanned aerial vehicles,CNN architectures,Detection-Tracking System,structural similarity index,autonomous classification,learning (artificial intelligence),Detectors,UAV,"
"deep reinforcement learning based uav-assisted maritime network computation offloading strategy","2022","As maritime activities become more frequent, many computationally intensive applications have emerged. Unmanned aerial vehicles (UAVs) can be utilized to provide computing services for maritime networks. In this paper, a multi-UAV assisted mobile edge computing (MEC) network is designed. Each UAV is configured with a nano-server to provide computational offloading services for maritime users (MVs). The goal is to minimize the maximum processing delay of the multi-VAV assisted MEC network. We present an optimization problem for joint task offloading, resource allocation, and flight trajectory of UAVs. The above problem is an mixed non-integer linear programming problem (MINLP), which is transformed into a Markov decision process (MDP). A computational offload algorithm based on deep deterministic policy gradient (DDPG) is proposed to solve this problem. Simulation results reveal that the DDPG algorithm can achieve fast convergence and minimize processing delay compared with baseline algorithms.","maritime network,Satellites,Markov processes,unmanned aerial vehicles,computation offloading,remotely operated vehicles,deep reinforcement,multiUAV assisted mobile edge computing network,computational offload algorithm,Delays,Reinforcement learning,integer programming,Resource management,computing services,noninteger linear programming problem,computational offloading services,deep reinforcement learning,UAV communication,maritime networks,cloud computing,mobile computing,MEC network,power aware computing,autonomous aerial vehicles,computationally intensive applications,nonlinear programming,linear programming,maritime users,Trajectory,joint task offloading,UAV-assisted maritime network computation offloading strategy,Simulation,Task analysis,learning (artificial intelligence),maritime activities,resource allocation,"
"a multi-task learning-based framework for global maritime trajectory and destination prediction with ais data","2022","Automatic Identification System (AIS) was initially developed for tracking ships and avoiding collisions. As numerous small satellites were launched in recent years, millions of AIS messages are captured by these satellite AIS providers every day. The massive amount of data allow shipping firms and port operators to better predict vessels’ movement. In this study, a computational framework is developed to predict future trajectories and destinations of vessels by applying deep learning to the satellite AIS messages containing self-reporting positioning data. We employed deep learning approaches for large-scale maritime prediction and identifies the most suitable deep neural networks for this specific application. Three prediction models, Convolutional Neural Networks (CNN), Dense Neural Networks (DNN), and Long Short-Term Memory (LSTM) have been tested in the framework. A multi-task learning architecture is implemented based on test results. Through sharing parameters while training, this architecture enables long-term destination predictions by balancing short-term trajectory predictions. The framework is validated globally with the experiments covering five large-scale sea areas. The experimental results demonstrate that the LSTM model with an average accuracy percentage of 85.1% outperforms the CNN and DNN with accuracy percentages of 68.3% and 78.2% respectively. The LSTM model with multi-task architecture can achieve an accuracy of 87.0%. With the proposed computational framework, AIS data can be utilized for maritime predictions, supporting more complex marine applications and covering more expansive geographic areas.","Vessel trajectory prediction,Automatic Identification System,Vessel origin–destination analysis,Vessel destination prediction,"
