"name","year","abstract","keywords"
"random finite set tracking for anomaly detection in the presence of clutter","2020","In this paper, a sequential Bayesian framework is proposed to address the task of joint anomaly detection and tracking for surveillance applications in the presence of clutter. This is achieved by modeling the anomaly as a switching unknown control input which goes into action by modifying the expected dynamics of a target and ceases its activity (becomes nonexistent) under nominal behavior. Random Finite Sets (RFS) make it possible to represent the switching nature of the object anomalous behavior and derive a hybrid Bernoulli filter (HBF) that sequentially updates the joint posterior density of a Bernoulli RFS for the unknown velocity input and the object kinematic state. In addition, the proposed HBF has been customized for maritime anomaly detection by using a piecewise Ornstein-Uhlenbeck (OU) stochastic process as dynamic model of vessels. We illustrate the effectiveness of the proposed filter, implemented in Gaussian-mixture form, and compare its performance in a maritime surveillance example with the Interacting Multiple Model Probabilistic Data Association Filter (IMM - PDAF) for different levels of clutter.","surveillance,sensor fusion,Anomaly detection,Bayes methods,Mathematical model,Switches,switching nature,switching unknown control input,Interacting Multiple Model Probabilistic Data Association Filter,Radio frequency,target tracking,unknown velocity input,sequential Bayesian framework,object tracking,Random Finite Sets,nominal behavior,surveillance applications,filtering theory,hybrid Bernoulli filter,Gaussian processes,Bernoulli RFS,Radar tracking,maritime anomaly detection,random Finite set tracking,clutter,joint anomaly detection,HBF,probability,Clutter,joint posterior density,object anomalous behavior,object kinematic state,Gaussian-mixture form,piecewise Ornstein-Uhlenbeck stochastic process,maritime surveillance example,"
"object detection in a maritime environment: performance evaluation of background subtraction methods","2019","This paper provides a benchmark of the performance of 23 classical and state-of-the-art background subtraction (BS) algorithms on visible range and near infrared range videos in the Singapore Maritime dataset. Importantly, our study indicates the limitations of the conventional performance evaluation criteria for maritime vision and proposes new performance evaluation criteria that is better suited to this problem. This paper provides insight into the specific challenges of BS in maritime vision. We identify four open challenges that plague BS methods in maritime scenario. These include spurious dynamics of water, wakes, ghost effect, and multiple detections. Poor recall and extremely poor precision of all the 23 methods, which have been otherwise successful for other challenging BS situations, allude to the need for new BS methods custom designed for maritime vision.","Vehicle dynamics,Benchmark testing,infrared range videos,background subtraction methods,Cameras,Singapore maritime dataset,Videos,performance evaluation criteria,marine engineering,maritime vision,computer vision,object detection,autonomous automobiles,Maritime vehicles,Adaptation models,maritime environment,Object detection,background subtraction,Gaussian distribution,"
"antenna beampattern matched optimum coherent detection in high-resolution mechanically scanning maritime surveillance radars","2023","Mechanically scanning radars are still widely used in ocean guard and surveillance areas nowadays, owing to simple structure, light weight and low cost. The antenna rotation causes amplitude modulation of target returns along pulses by the antenna azimuth beampattern. The traditional coherent detection that ignores this modulation suffers from some performance loss. In this article, an antenna beampattern matched optimum coherent detector and a dual-threshold detection scheme are proposed for high-resolution mechanically scanning maritime surveillance radars. First, it is shown that the modulation of target returns is determined by the antenna azimuth beampattern, scan rate, and pulse repetition interval and the antenna scanning also affect the temporal correlation of sea clutter. Second, the antenna beampattern matched optimum coherent detector is given in compound-Gaussian sea clutter with inverse Gamma distributed texture and the pulse scanning mode is used to deal with unknown target azimuth angle in the matched filter. Third, to mitigate the high computational cost of the pulse scanning mode, a dual-threshold scheme is given, which searches all pulse-range cells by short-time integration and further confirms suspected cells whose test statistics are between the two lower and higher thresholds in the search by long-time integration. Moreover, two fast recursive clutter covariance matrix inversion algorithms along pulses and range cells are presented, which bring a great reduction in computational complexity. Finally, real measured radar data is used to verify the proposed detector and scheme and the experimental results show that it behaves better in detection of small targets than the traditional detectors.","Antennas,covariance matrices,maritime surveillance radars,Radar antennas,mechanically scanning maritime surveillance radars,radar detection,radar clutter,high-resolution mechanically scanning maritime surveillance,compound-Gaussian sea clutter,sea clutter,amplitude modulation,target returns,dual-threshold detection scheme,matched filter,optimum coherent detector,scan rate,surveillance areas,ocean guard,gamma distribution,traditional coherent detection,dual-threshold scheme,Antenna beampattern matched optimum coherent detection,Gaussian processes,matrix inversion,search radar,measured radar data,unknown target,Radar,radar signal processing,antenna azimuth beampattern,antenna beampattern matched optimum coherent detection,high computational cost,azimuth beampattern modulation,Doppler radar,computational complexity,Clutter,scanning radars,fast recursive clutter covariance matrix inversion algorithms,pulse scanning mode,antenna rotation,Surveillance,pulse-range cells,antenna scanning,pulse repetition interval,Radar detection,"
"hybrid bernoulli filtering for detection and tracking of anomalous path deviations","2018","This paper presents a solution to the problem of sequential joint anomaly detection and tracking of a target subject to switching unknown path deviations. Based on a dynamic model described by Ornstein-Uhlenbeck (OU) stochastic processes, the anomaly is represented by a target (e.g., a marine vessel) that deviates from a preset route by changing its nominal mean velocity. The Random Finite Set (RFS) framework is used to represent the switching nature of target's anomalous behavior in the presence of spurious measurements and detection uncertainty. Combining these two ingredients, the problem of jointly detecting target's path deviations and estimating its kinematic state can be formulated within the Bayesian framework, and analytically solved by means of a hybrid Bernoulli filter that sequentially updates the joint posterior density of the unknown OU velocity input (a Bernoulli RFS) and of the target's state random vector. We illustrate the effectiveness of the proposed filter, implemented in Gaussian-mixture form, in a simulated scenario of vessel tracking for maritime traffic monitoring.","Anomaly detection,switching nature,state random vector,Sea measurements,Stochastic processes,Radio frequency,vessel tracking,hybrid Bernoulli filtering,target tracking,Random Finite Set framework,stochastic processes,filtering theory,hybrid Bernoulli filter,Target tracking,object detection,Gaussian processes,Bayesian framework,Artificial intelligence,anomalous path deviations,unknown OU velocity input,nominal mean velocity,Surveillance,marine vessel,joint posterior density,sequential joint anomaly detection,"
"context-aware dynamic asset allocation for maritime interdiction operations","2020","This paper validates two approximate dynamic programming approaches on a maritime interdiction problem involving the allocation of multiple heterogeneous assets over a large area of responsibility to interdict multiple drug smugglers using heterogeneous types of transportation on the sea with varying contraband weights. The asset allocation is based on a probability of activity surface, which represents spatio-temporal target activity obtained by integrating intelligence data on drug smuggler whereabouts/waypoints for contraband transportation, behavior models, and meteorological and oceanographic information. We validate the proposed architectural and algorithmic concepts via several realistic mission scenarios. We conduct sensitivity analyses to quantify the robustness and proactivity of our approach, as well as to measure the value of information used in the allocation process. The contributions of this paper have been transitioned to and are currently being tested by Joint Interagency Task Force-South, an organization tasked with providing the initial line of defense against drug trafficking in the East Pacific and Caribbean Oceans.","algorithmic concepts,surveillance,allocation process,resource management problem,context-aware dynamic asset allocation,Transportation,oceanographic information,multiple heterogeneous assets,Planning,Resource management,Dynamic programming,drug trafficking,Stochastic processes,GaussÃ¢â‚¬â€œSeidel iteration,spatio-temporal target activity,contraband weights,architectural concepts,ubiquitous computing,intelligence data integration,marine systems,military computing,rollout,sensitivity analysis,Approximate dynamic programming,drugs,realistic mission scenarios,maritime interdiction problem,dynamic programming,behavior models,maritime interdiction operations,mission planning,value of information (VOI),probability,national security,Algorithm design and analysis,activity surface,contraband transportation,multiple drug smugglers,meteorological information,Drugs,approximate dynamic programming approaches,"
"target detection using gaussian mixture models and fourier transforms for uav maritime search and rescue","2017","In the event of a maritime disaster, casualties need to be found and rescued promptly. Image processing methods could help to perform automated detection from a UAV. The main current approaches make use of multispectral and thermal cameras, which can deal with lightning difficulties but are expensive and could suffer from high noise problems. This paper presents a method combining both color analysis and frequency patterns identification using an inexpensive vision camera (EO camera), and implements it through an adaptive algorithm to deal with a dynamically changing background. The method is tested successfully in different environments.","Fourier transforms,maritime disaster,emergency management,Clustering algorithms,EO camera,target detection,Cameras,Image color analysis,automated detection,vision camera,mixture models,thermal cameras,object detection,Gaussian processes,Statistics,rescue robots,multispectral cameras,autonomous aerial vehicles,Harmonic analysis,Training,UAV maritime search and rescue,Gaussian mixture models,image processing,"
"multichannel target detection for maritime radar","2019","Coherent target detection in a multichannel maritime radar is a challenging problem due to the dynamic nature of sea clutter. Traditional detectors, such as the adaptive matched filter, which are designed for homogeneous data exhibit significant performance degradation due to the non-Gaussianity and inhomogeneity of the sea clutter returns. To tackle this problem, we make use of the multichannel coherent single data set algorithm which removes the need for any training data, thus alleviating the problem of clutter heterogeneity. The algorithm performance is compared with traditional adaptive matched filter approaches using a Monte Carlo simulation with synthetic targets injected into a real multichannel data set.","Monte Carlo methods,detection,marine radar,homogeneous data,radar detection,multichannel maritime radar,radar clutter,Monte Carlo simulation,adaptive matched filter,sea clutter,Covariance matrices,coherent,matched filters,Training data,coherent target detection,object detection,Sea clutter,Doppler effect,multichannel data,synthetic targets,Radar,single snapshot,multichannel coherent single data set algorithm,multichannel target detection,Clutter,clutter heterogeneity,Object detection,Detectors,"
"self-adaption vessel traffic behaviour recognition algorithm based on multi-attribute trajectory characteristics","2020","Clustering analysis is commonly used for vessel traffic behaviour recognition. The clustering results reflect the characteristics of different vessel traffic behaviours, which can assist authorities in transportation management. However, there are two drawbacks to traditional clustering analysis. First, the similarity measures among different trajectories in a clustering analysis mainly focus on spatial differentiation and frequently do not consider motion features, such as speed and course. Second, the density-based spatial clustering of applications with noise (DBSCAN) algorithm, a famous clustering analysis method, is characterized by poor self-adaption, which means that it cannot autonomously determine the best parameters based on different sample sets. These issues limit the efficiency of clustering analysis. To address these problems, a new similarity measure using statistical methods and based on multi-attribute trajectory characteristics is proposed to reflect the similarity among different trajectories. The proposed measure considers the spatial and motion features of trajectories. Furthermore, the Parzen window (a non-parametric estimation method) and the multivariate Gaussian distribution are employed to generate self-adaptive strategies to determine the optimal parameters of the DBSCAN algorithm for a given sample set. Finally, numerical experiments are conducted to verify the effectiveness of the proposed similarity measure and improved DBSCAN algorithm. The clustering analysis results obtained with the proposed method could provide insights towards better monitoring and navigation advice to help improve marine managerial effectiveness and avoid maritime accidents.","Vessel behaviour recognition,Self-adaption,Multi-attribute trajectory characteristics,DBSCAN,"
"data fusion analysis for maritime automatic target recognition with designation confidence metrics","2015","This research encompasses robust data fusion methodology for maritime target feature extraction and combinatorial classifiers (Vector Quantizer, Neural Networks based on both Gaussian Mixture Models and Radial Basis Function), which also includes confidence metrics for designations. Feature extraction techniques act on 2-d Inverse Synthetic Aperture Radar (ISAR) images and novel 1-d range profiles. Designations are made with an ISAR database of over 2500 images and 8 basic classes. The Fusion classifier confusion-matrix results indicate the correct classification probability of 80.1% and perfect joint-classification designation in the rarer instances where 2 similar classes are too hard to distinguish from.","ISAR image,radial basis function,2D inverse synthetic aperture radar image,maritime target feature extraction,neural networks,Feature extraction,vector quantizer,maritime automatic target recognition,mixture models,Databases,synthetic aperture radar,feature extraction,image classification,Graphical user interfaces,Gaussian processes,radar imaging,data fusion analysis,Training,Engines,Radar imaging,designation confidence metrics,Gaussian mixture models,combinatorial classifiers,object recognition,"
"synthetic trajectory extraction for maritime anomaly detection","2018","In the maritime domain, the main goal for large vessels is to drive as fast and efficiently as possible from one harbour to the next. This results in vessels following quite distinct routes. Deviations from these routes can be seen as indicators for illegal or at least suspicious behaviour. In order to extract these routes, clustering algorithms can be used, that will store the traffic patterns as synthetic trajectories. A vessel can be assigned to a specific route or a deviation from the routes can be detected by evaluating these route models. A challenge in designing the synthetic trajectories lies in the faithful representation, sparsity of data, treatment of outliers and split-up of routes. Here, a novel approach to model the uncertainty of the vessels movements while following a route is introduced: A cluster is now represented by a trajectory consisting of segments. Due to obstacles like shallow waters, a route might split up which will generate sub-segments. Instead of storing all cluster points, the position, speed, and course of the vessels are attached to each segment in form of normal distributions. Using these attributes, the probability of a deviation from the given trajectory can be estimated.","Clustering algorithms,Kernel,vessels movements,Anomaly detection,anomaly detection,traffic patterns,security of data,trajectory representation,ships,clustering algorithms,marine engineering,maritime domain,Heating systems,route models,pattern clustering,Artificial intelligence,maritime anomaly detection,synthetic trajectory extraction,Trajectory,data sparsity,probability,Gaussian distribution,data handling,"
"ais data-driven ship trajectory prediction modelling and analysis based on machine learning and deep learning methods","2023","Maritime transport faces new safety challenges in an increasingly complex traffic environment caused by large-scale and high-speed ships, particularly with the introduction of intelligent and autonomous ships. It is evident that Automatic Identification System (AIS) data-driven ship trajectory prediction can effectively aid in identifying abnormal ship behaviours and reducing maritime risks such as collision, stranding, and contact. Furthermore, trajectory prediction is widely recognised as one of the critical technologies for realising safe autonomous navigation. The prediction methods and their performance are the key factors for future safe and automatic shipping. Currently, ship trajectory prediction lacks the real performance measurement and analysis of different algorithms, including classical machine learning and emerging deep learning methods. This paper aims to systematically analyse the performance of ship trajectory prediction methods and pioneer experimental tests to reveal their advantages and disadvantages as well as fitness in different scenarios involving complicated systems. To do so, five machine learning methods (i.e., Kalman Filter (KF), Support Vector Progression (SVR), Back Propagation network (BP), Gaussian Process Regression (GPR), and Random Forest (RF)) and seven deep learning methods (i.e., Recurrent Neural Network (RNN), Long Short-Term Memory (LSTM), Gate Recurrent Unit (GRU), Bi-directional Long Short-Term Memory (Bi-LSTM), Sequence to Sequence (Seq2seq), Bi-directional Gate Recurrent Unit (Bi-GRU), and Transformer) are first extracted from the state-of-the-art literature review and then employed to implement the trajectory prediction and compare their prediction performance in the real world. Three AIS datasets are collected from the waters of representative traffic features, including a normal channel (i.e., the Chengshan Jiao Promontory), complex traffic (i.e., the Zhoushan Archipelago), and a port area (i.e., Caofeidian port). They are selected to test and analyse the performance of all twelve methods based on six evaluation indexes and explore the characteristics and effectiveness of the twelve trajectory prediction methods in detail. The experimental results provide a novel perspective, comparison, and benchmark for ship trajectory prediction research, which not only demonstrates the fitness of each method in different maritime traffic scenarios, but also makes significant contributions to maritime safety and autonomous shipping development.","Deep learning,Maritime safety,Trajectory prediction,AIS data,Machine learning,"
"track-before-detect using an airborne multichannel radar in the maritime domain","2023","This article explores methods for the detection and tracking of maritime targets using an airborne scanning multichannel radar, operating at high altitudes. The main technical difficulties include 1) the nonstationary and non-Gaussian nature of sea clutter when using a high-resolution airborne radar and 2) low-target signal-to-interference ratios due to higher grazing angles. It is proposed to carry out processing in two stages. First, space-time adaptive processing (STAP) is applied to exploit the spatial and temporal degrees of freedom available in the multichannel radar. Subsequently, target detection and tracking is performed using the track-before-detect method, applied to the STAP output. For the sake of comparison, a more traditional tracking method is also developed, where a detection threshold is applied to the STAP output, to obtain point measurements, subsequently processed via an extended target tracking methodology. The error performance of the proposed methodology is presented, using high-fidelity radar data generation","airborne radar,spatiotemporal adaptive processing,extended target tracking methodology,radar detection,target detection,radar clutter,Airborne scanning radar,high-resolution airborne radar,sea clutter,airborne scanning multichannel radar,STAP output,target tracking,maritime surveillance,Target tracking,object detection,extended target tracking,maritime targets,track-before-detect method,main technical difficulties,maritime domain,Radar tracking,airborne multichannel radar,Radar,radar signal processing,detection threshold,space-time adaptive processing,track-before-detect (TBD),low-target signal-to-interference ratios,Airborne radar,high altitudes,Azimuth,higher grazing angles,Clutter,traditional tracking method,high-fidelity radar data generation,Radar detection,"
"three adaptive sub-histograms equalization algorithm for maritime image enhancement","2020","According to maritime image histogramsÃ¢â‚¬â„¢ statistic and analysis, the histogram of pure maritime image obeys Gaussian distribution approximately, thus Three Adaptive Sub-histograms Equalization (TASHE) algorithm for maritime image enhancement is proposed in this paper. First, the characteristics of pure maritime imageÃ¢â‚¬â„¢s histogram are studied, then the adaptive thresholdÃ¢â‚¬â„¢s optimal selection strategy for the histogramÃ¢â‚¬â„¢s division is discussed, finally the implement of three sub-histograms is described. This paper employs visible gray maritime image, visible color maritime image and infrared maritime image to verify the enhancement algorithmÃ¢â‚¬â„¢s effectiveness and robustness, the experimental results show that TASHE algorithm can not only keep the maritime imageÃ¢â‚¬â„¢s mean brightness and naturalness, but also improve the maritime imageÃ¢â‚¬â„¢s contrast without the noise and artifacts. The objective image quality assessment also indicates that TASHE algorithm can improve the original maritime imageÃ¢â‚¬â„¢s Enhancement Measure by Entropy (EME) value, furthermore, when a maritime image is pre-processed by TASHE algorithm, the maritime targetÃ¢â‚¬â„¢s Detection Rate (DR) can be improved.","pure maritime image,Image enhancement,image denoising,entropy,adaptive threshold,enhancement algorithm,image enhancement,Image color analysis,image colour analysis,adaptive sub-histograms equalization algorithm,marine engineering,sub-histogram equalization,object detection,Adaptive equalizers,objective image quality assessment,Brightness,maritime image histograms,wavelet transforms,correlation methods,Histograms,infrared imaging,maritime image,visible color maritime image,Fitting,original maritime image,Gaussian distribution,visible gray maritime image,histogram,TASHE algorithm,maritime target,maritime image enhancement,"
