"name","year","abstract","keywords"
"ais data-based for statistics and analysis of maritime traffic dangerous features: a case study of san diego costal water","2020","For analyzing the distribution characteristics of maritime traffic dangers and ensure the safety of ships navigating at sea, plotting the ship's trajectory and making statistic based on the relevant dynamic data that can be extracted and analyzed from the Automatic Indentification System (AIS) information, the Distance to Closet Point of Approach (DCPA) between any two ships have been computed and applied. Through constructing the innovative three-dimensional bubbles chart to reflect the spatial characteristics from the DCPA matrix. Utilizing the Kernel Density Estimation (KDE) method, draws the heat map in the vicinity of San Diego sea area, measures the traffic danger characteristics of the costal sea area, and compares the analysis results with ArcGIS Pro 2.3. It reflects that the analysis results are consistent with the actual situation. The heat map has the powerful scientificity and practicability, can accurately measure the traffic distribution in the sea area, and provides auxiliary references for the planning and design of the ship's routing system and maritime traffic safety management.","DCPA matrix,Automatic Indentification System information,Safety,Marine vehicles,ship routing system,traffic distribution,Sea measurements,maritime traffic dangers,ArcGIS Pro 2.3,heat map,ships,marine safety,Ship Automatic Identification System,Kernel Density Estimation method,Maritime Navigational Safety,Artificial intelligence,geographic information systems,San Diego costal water,Distance to Closet Point of Approach,traffic danger characteristics,Kernel Density Estimation,relevant dynamic data,Trajectory,San Diego sea area,maritime traffic dangerous features,costal sea area,Navigation,three-dimensional bubbles,Data mining,maritime traffic safety management,AIS data,oceanographic techniques,"
"maritime traffic probabilistic forecasting based on vessels’ waterway patterns and motion behaviors","2017","Maritime traffic prediction is critical for ocean transportation safety management. In this paper, we propose a novel knowledge assisted methodology for maritime traffic forecasting based on a vessel's waterway pattern and motion behavior. The vessel's waterway pattern is extracted through a proposed lattice-based DBSCAN algorithm that significantly reduces the problem scale, and its motion behavior is quantitatively modeled for the first time using kernel density estimation. The proposed methodology facilitates the knowledge extraction, storage, and retrieval, allowing for seamless knowledge transfer to support maritime traffic forecasting. By incorporating both the vessel's waterway pattern and motion behavior knowledge, our solution suggests a set of probable coordinates with the corresponding probability as the forecasting output. The proposed forecasting algorithm is capable of accurately predicting maritime traffic 5, 30, and 60 min ahead, while its computation can be efficiently completed in milliseconds for single vessel prediction. Owing to such a high computational efficiency, an extensive predictive analysis of hundreds of vessels has been reported for the first time in this paper. A web-based prototype platform is implemented for Singapore waters to demonstrate the solution's feasibility in a real-world maritime operation system. The proposed approaches can be generalized for other marine waters around the world.","vessel waterway patterns,data mining,Transportation,maritime traffic,maritime operation system,Prediction algorithms,marine transportation,single vessel prediction,transportation,knowledge transfer,Planning,forecasting theory,Stability analysis,ocean transportation safety management,lattice-based DBSCAN algorithm,vessel motion behaviors,knowledge engineering,forecasting algorithm,kernel density estimation,marine engineering,pattern clustering,Artificial intelligence,Forecasting,maritime traffic probabilistic forecasting,motion behavior knowledge,knowledge extraction,probability,knowledge acquisition,traffic engineering computing,maritime traffic prediction,Data mining,knowledge discovery,knowledge assisted methodology,"
"mapping dark shipping zones using multi-temporal sar and ais data for maritime domain awareness","2022","The monitoring of ships which do not report their Au-tomatic Identification System (AIS) information is important for Maritime Domain Awareness (MDA). In this paper, an improved maritime picture is generated by presenting a new methodology to map these so-called ‘dark’ ships over time. Firstly, a robust and accurate data association between Syn-thetic Aperture Radar (SAR) ship detections and AIS data is carried out on multi-temporal SAR imagery and AIS data. Subsequently, Kernel Density Estimation (KDE) is applied to unassigned SAR ship detections to reveal the spatial distri-bution of ‘dark’ zones (i.e. areas where repeated unassign-ments occur). This analysis helps identify areas where ships frequently do not report, which can help guide authorities in the best way to respond. The methodology is validated using Sentinel-l Interferometric Wide (IW) swath mode products and AIS data acquired from the English Channel, UK.","Automatic Identification System information,remote sensing by radar,ship detection,Marine vehicles,dark zones,dark ships,Maritime Domain Awareness (MDA),Sea measurements,Rocks,ships,Maritime Domain Awareness,AIS,dark shipping zones mapping,synthetic aperture radar,radar imaging,Artificial intelligence,Radar polarimetry,oceanographic regions,Syn-thetic Aperture Radar ship detections,GIS,multi-temporal SAR,data association,Radar imaging,unassigned SAR ship detections,multitemporal SAR imagery,AIS data,Radar detection,"
"vessel sailing route extraction and analysis from satellite-based ais data using density clustering and probability algorithms","2023","The vessel Automatic Identification System (AIS) data collected by satellites have the features of large coverage area and large data volume, and they are instantaneous discrete data rather than time-continuous data, so the data has large dispersion with many noise points. This poses a challenge for vessel sailing route extraction. This paper proposes a vessel sailing route extraction method which consists of the fast Density-Based Spatial Clustering of Applications with Noise (DBSCAN) algorithm and the Kernel Density Estimation-based Outlier Factor (KDE-based OF) noise reduction algorithm. The method in this paper firstly improves the clustering discrimination method in the DBSCAN algorithm to separate trajectories in different directions. Secondly, this paper extracts a fast clustering algorithm based on the density clustering algorithm to reduce its computing time overhead with satellite big data. Finally, this paper proposes the KDE-based OF processing algorithm, which calculates the outlier probability distribution value of the trajectory points through the algorithm to eliminate the edge trajectory points with low probability distribution. Based on the actual satellite vessel AIS data, this paper conducts multi-method comparisons and performance analysis experiments. Experiments show that the proposed method has the best stability and advancement.","Vessel sailing route extraction,Kernel Density Estimation-based Outlier Factor (KDE-based OF),Density-Based Spatial Clustering of Applications with Noise (DBSCAN),Automatic Identification System (AIS),"
"fitting empirical distributions for vessels behavioural analysis and maritime anomaly detection","2023","Naval behaviour characterization and maritime anomaly detection represents two active area of research. Although multiple probabilistic approaches have been implemented for explaining different parametric maritime phenomena, most of them are focused only on the analysis of primary kinematic data, such as position, speed, course of vessels, or lateral displacement relative to an obstacle. This article presents an analysis on multiple complex maritime activities (e.g., fishing, drifting, hidden activities) that were derived by processing AIS messages collected in the Black Sea region. Quantitative histograms were made for each type of activity while probability and cumulative distribution functions were plotted using kernel density estimation applications. After that, multiple evaluation metrics analysed the possibilities of representing these distributions in the form of known parametric distributions (e.g., Gaussian, Gamma, Rayleigh, Log-normal). Finally, there were extracted the parameters that best fitted these distributions. Also, a universal parametric distribution was searched to best fit all observed maritime activities.","statistical distributions,universal parametric distribution,kernel density estimation applications,Safety,primary kinematic data,AIS messages,vessel behavioural analysis,Sea measurements,cumulative distribution functions,parametric maritime phenomena,probabilistic approaches,quantitative histograms,marine engineering,hidden activities,AIS,vessels behaviour,Probabilistic logic,Probability distribution,probability distribution fitting,Measurement,maritime anomaly detection,Statistical analysis,empirical distributions,naval behaviour characterization,Fitting,Black Sea region,empirical data,data handling,multiple complex maritime activities,"
"anomaly detection of trajectories with kernel density estimation by conformal prediction","2014","",""
"evaluation and comparison of anomaly detection algorithms in annotated datasets from the maritime domain","2015","Anomaly detection supports human decision makers in their surveillance tasks to ensure security. To gain the trust of the operator, it is important to develop a robust system, which gives the operator enough insight to take a rational choice about future steps. In this work, the maritime domain is investigated. Here, anomalies occur in trajectory data. Hence, a normal model for the trajectories has to be estimated. Despite the goal of anomaly detection in real life operations, until today, mostly simulated anomalies have been evaluated to measure the performance of different algorithms. Therefore, an annotation tool is developed to provide a ground truth on a non-simulative dataset. The annotated data is used to compare different algorithms with each other. For the given dataset, first experiments are conducted with the Gaussian Mixture Model (GMM) and the Kernel Density Estimator (KDE). For the evaluation of the algorithms, precision, recall, and f1-score are compared.","surveillance,GMM,Clustering algorithms,Hidden Markov models,Intelligent systems,Anomaly detection,Gaussian Mixture Model,trajectory data,annotation tool,human decision making,operator trust,Sea measurements,nonsimulative dataset,mixture models,kernel density estimator,marine engineering,Gaussian processes,recall value,ground truth,maritime domain,robust system,Maritime domain,f1-score value,Kernel Density Estimation,Gaussian mixture model,annotated datasets,Trajectory,surveillance tasks,anomaly detection algorithms,Surveillance,normal model,precision value,KDE,"
"maritime traffic route detection framework based on statistical density analysis from ais data using a clustering algorithm","2022","Maritime traffic routes by ships navigation vary according to country and geographic characteristics, and they differ according to the characteristics of the ships. In ocean areas adjacent to coasts, regulated routes are present, e.g., traffic separation scheme for ships entering and leaving; however, most ocean areas do not have such routes. Maritime traffic route research has been conducted based on computer engineering to create routes; however, ship characteristics were not considered. Thus, this article proposes a framework to generate maritime traffic routes using statistical density analysis. Here, automatic identification system (AIS) data are used to derive quantitative traffic routes. Preprocessing is applied to the AIS data, and a similar ship trajectory pattern is decomposed into a matrix based on the Hausdorff–distance algorithm and then stored in a database. A similar pattern makes the AIS trajectory simple using the Douglas–Peucker algorithm. In addition, density-based spatial clustering of applications with noise (DBSCAN) is performed to identify the waypoints of vessels then create routes by connecting waypoints. The width of maritime routes created based on a similar ship trajectory is subjected to kernel density estimation analysis (KDE). Then, waypoints evaluation of the main route is performed from the results of KDE 75% and 90% considering the statistical in the total maritime traffic, and the results applied to the targeted ocean area are compared. Finally, the result of KDE 90% of maritime traffic with framework analyzed the safety route, which can be a basis for developing routes for maritime autonomous surface ships.","traffic separation scheme,ocean areas,marine accidents,Clustering algorithms,Safety,targeted ocean area,Douglas-Peucker algorithm,automatic identification system data,vehicle routing,total maritime traffic,Marine vehicles,maritime autonomous surface ships,quantitative traffic routes,geographic characteristics,DBSCAN,statistical analysis,ships,marine safety,kernel density estimation,AIS trajectory simple,maritime traffic route detection framework,kernel density estimation analysis,Oceans,Hausdorff-distance algorithm,ship trajectory pattern,framework,pattern clustering,Artificial intelligence,statistical density analysis,marine engineering computing,Trajectory,ship characteristics,maritime traffic route research,Navigation,safety route,density-based spatial clustering of applications with noise,clustering algorithm,AIS data,maritime traffic route,"
