"name","year","abstract","keywords"
"maritime anomaly detection in ferry tracks","2017","This paper proposes a methodology for the automatic detection of anomalous shipping tracks traced by ferries. The approach comprises a set of models as a basis for outlier detection: A Gaussian process (GP) model regresses displacement information collected over time, and a Markov chain based detector makes use of the direction (heading) information. GP regression is performed together with Median Absolute Deviation to account for contaminated training data. The methodology utilizes the coordinates of a given ferry recorded on a second by second basis via Automatic Identification System. Its effectiveness is demonstrated on a dataset collected in the Solent area.","Markov processes,automatic anomalous shipping track detection,Hidden Markov models,unsupervised learning,Marine vehicles,Anomaly Detection,ferry tracks,Markov chain based detector,marine navigation,Gaussian Processes,heading information,displacement information regression,regression analysis,outlier detection,data analysis,Median Absolute Deviation,object tracking,ships,ferry coordinates,automatic identification system,direction information,Training data,Gaussian processes,traffic information systems,Artificial intelligence,median absolute deviation,maritime anomaly detection,Solent area,Maritime Traffic,Gaussian process model,Detectors,"
"learning motion patterns in ais data and detecting anomalous vessel behavior","2021","A new approach to anomaly detection in maritime traffic based on Automatic Identification System (AIS) data is proposed. The method recursively learns a model of the nominal vessel routes from AIS data and simultaneously estimates the current state of the vessels. A distinction between anomalies and measurement outliers is made and a method to detect and distinguish between the two is proposed. The anomaly and outlier detection is based on statistical testing relative to the current motion model. The proposed method is evaluated on historical AIS data from a coastal area in Sweden and is shown to detect previously unseen motions.","Outlier Detection,maritime traffic,Anomaly detection,automatic identification system data,Anomaly Detection,Conferences,Sea measurements,outlier detection,ships,statistical testing,Marine Safety,current motion model,Data models,traffic information systems,Artificial intelligence,Sweden,Statistical analysis,marine engineering computing,anomalous vessel behavior detection,Current measurement,learning (artificial intelligence),motion pattern learning,historical AIS data,data handling,"
"unsupervised learning of maritime traffic patterns for anomaly detection","2012","Maritime anomaly detection requires an efficient representation and consistent knowledge of vessel behaviour. Automatic Identification System (AIS) data provides ships state vector and identity information that is here used to automatically derive knowledge of maritime traffic in an unsupervised way. The proposed approach only utilises AIS data, historical or real-time, and is aimed at incrementally learning motion patterns without any specific a priori contextual description. This can be applied to a single AIS terrestrial receiver, to regional networks or to global scale tracking. The maritime traffic representation underpins low- likelihood behaviour detection and supports enhanced Maritime Situational Awareness by providing a characterisation of vessels traffic.","vessel behaviour,Incremental Learning,ships state vector,maritime situational awareness,pattern clustering,identity information,single AIS terrestrial receiver,regional networks,automatic identification system data,marine systems,unsupervised learning,ships,anomaly detection,low-likelihood behaviour detection,Maritime Situational Awareness,Automatic Identification System,maritime traffic patterns,"
"contrastive learning for graph-based vessel trajectory similarity computation","2023","",""
"radis: a real-time anomaly detection intelligent system for fault diagnosis of marine machinery","2022","By enhancing data accessibility, the implementation of data-driven models has been made possible to empower strategies in relation to O&M activities. Such models have been extensively applied to perform anomaly detection tasks, with the express purpose of detecting data patterns that deviate significantly from normal operational behaviour. Due to its preeminent importance in the maritime industry to adequately identify the behaviour of marine systems, the Real-time Anomaly Detection Intelligent System (RADIS) framework, constituted by a Long Short-Term Memory-based Variational Autoencoder in tandem with multi-level Otsu’s thresholding, is proposed. RADIS aims to address the current gaps identified within the maritime industry in relation to data-driven model applications for enabling smart maintenance. To assess the performance of such a framework, a case study on a total of 14 parameters obtained from sensors installed on a diesel generator of a tanker ship is introduced to highlight the implementation of RADIS. Results demonstrated the capability of RADIS to be part of a diagnostic analytics tool that will promote the implementation of smart maintenance within the maritime industry, as RADIS detected an average of 92.5% of anomalous instances in the presented case study.","Marine machinery,Deep learning,Intelligent real-time systems,Anomaly detection,Smart maintenance,Ship systems,"
"detecting anomalies from a multitarget tracking output","2014","Surveillance systems typically incorporate multitarget tracking algorithms for sequential estimation of kinematic states (e.g. positions, velocities) of moving objects in the surveillance domain of interest. This letter proposes an algorithm for online detection of anomalies in the motion and the count of objects, using the output of a multiobject tracking algorithm. The surveillance area is partitioned by a square grid and the kinematic states that fall inside each cell of the grid are modelled by a Poisson point process. During the unsupervised learning phase, the parameters of the Poisson point process are estimated for each cell. The testing phase is performed sequentially by threshold detection at a specified level of significance. The performance of the algorithm is illustrated using the Automatic Identification System (AIS) dataset in the context of maritime surveillance.","Kinematics,Kernel,multiobject tracking algorithm,Vectors,Poisson point process,sequential estimation,target tracking,unsupervised learning phase,multitarget tracking algorithms,Testing,object tracking,automatic identification system dataset,maritime surveillance,Partitioning algorithms,Tracking,online anomaly detection,Surveillance,kinematic states,video surveillance,"
"trajectory pattern extraction and anomaly detection for maritime vessels","2021","Trajectory analysis and extraction of trajectory patterns are crucial to enhance marine safety and marine status awareness. The major data source for such analysis is Automatic Identification System (AIS), which publishes data related to movement of the ship while cruising. AIS broadcasts information including type of ship, identity number, state, destination, estimated time of arrival (ETA), location, speed, direction, and cargo. In this paper, we focus on extracting a variety of trajectory patterns for maritime vessels. The first group of analysis we focus on is arrival port, arrival time, and next position prediction on AIS messages, which are useful to aid maritime operators. We propose three different approaches for the prediction of marine vessel movement. As the second type of analysis, anomaly detection on marine vessel trajectory is studied. For vessel movement prediction, the experiments show that the proposed solutions brought improvement against conventional supervised learning approaches. The proposed anomaly detection technique is demonstrated on a case study.","Trajectory,Maritime,LSTM,Next position prediction,Anomaly detection,Arrival port prediction,Arrival time prediction,Supervised learning,AIS,"
"outlier detection approach for discovering anomalous maritime profiles","2023","Maritime authorities play a key role in ensuring the safety and security of shipping lanes and ports. The port state control mechanism enables these authorities to physically verify suspect vessels (e.g., involved in smuggling or piracy events), but choosing the most relevant vessels to be inspected represents a challenging task. This decision can be enhanced by AI-powered systems that analyse large amounts of data, identify patterns and report all observed discrepancies. This paper presents a statistical analysis on the temporal durations of four types of naval statuses: sailing, docked in port, waiting at anchor and not transmitting AIS data. These durations were extracted from the historical activity of different classes of vessels that passed the Black Sea region (Romanian Exclusive Economic Zone) in 2022. Probability density functions were built for these vessels and all statuses' durations were fitted into known parametric distributions. Finally, the paper shows the results of multiple outlier detection algorithms that searched for anomalous data in a multivariate manner.","shipping lanes,probability density functions,Electric potential,Safety,unsupervised learning,naval statuses,public administration,Black Sea region,maritime authorities,outlier detection,Probability density function,temporal durations,port state control,statistical analysis,ships,port state control mechanism,marine safety,marine engineering,observed discrepancies,anomalous maritime profiles,AIS,Seaports,historical activity,Artificial intelligence,sea ports,maritime anomaly detection,Statistical analysis,anomalous data,smuggling,AIS data,Romanian exclusive economic zone,outlier detection approach,probability,AI-powered systems,Security,production engineering computing,data handling,suspect vessels,"
"markov logic networks for context integration and situation assessment in maritime domain","2012","The detection of anomalies has a critical role in situational assessment. In this paper, we break down the concept of anomaly in the maritime domain into different levels and relate them to the JDL fusion model. We also show how uncertain context knowledge can be encoded through Markov Logic Networks (MLNs) which offer a convenient framework leveraging both the expressive power of first order logic and the probabilistic uncertainty management of Markov networks. Every formula in the knowledge base is assigned a weight indicating its confidence. Different types of knowledge with associated uncertainty can therefore be fused together within MLNs and on-line inference can be performed as input data is processed by the system, and the formulas are grounded in the knowledge base. Promising examples are demonstrated on a sample set of rules for maritime event and anomaly detection.","Markov processes,context integration,sensor fusion,probabilistic uncertainty management,anomaly detection,Marine vehicles,Grounding,situation assessment,security of data,Markov logic networks,Knowledge based systems,threat assessment,Markov random fields,marine engineering,maritime event recognition,maritime domain,probabilistic logic,Context,situational awareness,uncertainty handling,inference mechanisms,Uncertainty,online inference,first order logic,JDL fusion model,knowledge base,"
"data-driven detection and context-based classification of maritime anomalies","2015","Discovering anomalies at sea is one of the critical tasks of Maritime Situational Awareness (MSA) activities and an important enabler for maritime security operations. This paper proposes a data-driven approach to anomaly detection, highlighting challenges specific to the maritime domain. This work builds on unsupervised learning techniques which provide models for normal traffic behaviour. A methodology to associate tracks to the derived traffic model is then presented. This is done by the pre-extraction of contextual information as the baseline patterns of life (i.e., routes) in the area under investigation. In addition to a brief description of the approach to derive the routes, their characterization and representation is presented in support of exploitable knowledge to classify anomalies. A hierarchical reasoning is proposed where new tracks are first associated to existing routes based on their positional information only and â€œoff-routeâ€ vesselsâ€ are detected. Then, for on-route vessels further anomalies are detected such as â€œspeed anomalyâ€ or â€œheading anomalyâ€. The algorithm is illustrated and assessed on a real-world dataset supplemented with synthetic abnormal tracks.","normal traffic behaviour,context-based classification,synthetic abnormal track,unsupervised learning,anomaly detection,hierarchical reasoning,Feature extraction,information retrieval,security of data,Sea measurements,maritime security operation,maritime situational awareness,marine engineering,pattern classification,off route vessel,traffic model,Radar tracking,data driven detection approach,Tracking,Trajectory,unsupervised learning technique,traffic engineering computing,contextual information pre-extraction,on route vessel,Data mining,Detectors,"
"data-driven methods for detection of abnormal ship behavior: progress and trends","2023","Maritime traffic safety influences the development of world economies. A major aspect to enhance maritime traffic safety is the effective detection of abnormal ship behavior (DASB) which recently have been widely made based on data-driven methods using multisource heterogeneous data. In order to provide an overview of the state-of-the-art of research, this study presents a review of DASB. First, the categories of abnormal ship behavior and data sources of DASB are concretely introduced, and the process of data-driven DASB combined with expert knowledge are described. Second, we conduct systematic disciplinary knowledge maps in the field of DASB, which identify evolution, hotspots and emerging trends. In this manner, data-driven methods for DASB were categorized into six types, including multisource data fusion approaches, statistical analysis approaches, traditional intelligent algorithmic approaches, deep learning approaches, knowledge-based and data-driven integrating approaches and computing power, and provide an overview of them. Then, we propose an integrated framework for DASB. Finally, we discuss the challenges in terms of three technical aspects (data, algorithm, and computing power) and outline possible paths of investigation for DASB to improve intelligent maritime surveillance.","Anomaly detection,Maritime traffic,Data-driven,Ship behavior,"
"associative learning of vessel motion patterns for maritime situation awareness","2006","Neurobiologically inspired algorithms have been developed to continuously learn behavioral patterns at a variety of conceptual, spatial, and temporal levels. In this paper, we outline our use of these algorithms for situation awareness in the maritime domain. Our algorithms take real-time tracking information and learn motion pattern models on-the-fly, enabling the models to adapt well to evolving situations while maintaining high levels of performance. The constantly refined models, resulting from concurrent incremental learning, are used to evaluate the behavior patterns of vessels based on their present motion states. At the event level, learning provides the capability to detect (and alert) upon anomalous behavior. At a higher (inter-event) level, learning enables predictions, over pre-defined time horizons, to be made about future vessel location. Predictions can also be used to alert on anomalous behavior. Learning is context-specific and occurs at multiple levels: for example, for individual vessels as well as classes of vessels. Features and performance of our learning system using recorded data are described","maritime,Fuzzy neural networks,anomalous behavior,neural networks,Neural networks,Situation awareness,Learning systems,real-time tracking information,associative learning,vessel motion pattern,marine engineering,learning,Weather forecasting,Information technology,Tracking,prediction,maritime situation awareness,Algorithm design and analysis,Adaptive systems,Context modeling,concurrent incremental learning,neural network,learning (artificial intelligence),Event detection,tracking,"
"overview of the security architecture of the comprehensive maritime awareness system","2009","The Comprehensive Maritime Awareness (CMA) system tries to identify anomalous behavior and potential threats associated with the global maritime domain that could impact the United States and coalition partners' security. It analyzes data from multiple sources that impose different data handling requirements, to discover potential threats. Security architecture and mechanisms are essential enablers for data sharing. More data stewards will share their data when they feel secure with the data protection mechanism of the system that will host their data. Critical technologies for data protection and access mediation for CMA are Oracle label security (OLS) and attribute-based access control (ABAC) based on federated identity management. Federated identity providers use security assertion markup language (SAML) 2.0 as a protocol to exchange user identity and attributes. This paper provides a high-level overview of the CMA security architecture. It explains how different security mechanisms seamlessly work together to protect data and mediate access.","Access protocols,Mediation,anomalous behavior,federated identity management,Data handling,security architecture,Data analysis,Technology management,data protection mechanism,attribute-based access control,marine engineering,potential threats,Oracle label security,Protection,security assertion markup language,Access control,Identity management systems,Comprehensive Maritime Awareness system,Markup languages,authorisation,Data security,"
"db-drift: concept drift aware density-based anomaly detection for maritime trajectories","2023","Anomalies in maritime surveillance operations are often high-risk, and need to be detected quickly from real-world, incoming data sources. Hence it is critical that we develop unsupervised anomaly detection algorithms that both operate on a data stream and adapt to it. Real-world maritime data streams involve multiple, intersecting forms of concept drift, meaning that the underlying data distribution changes over time. We introduce DB-Drift, a novel algorithm for adapting existing density-based unsupervised anomaly detection pipelines to handle gradual and seasonal drift simultaneously.","Pipelines,surveillance,DB-Drift,Anomaly detection,anomaly detection,unsupervised learning,Concept drift,data distribution,maritime trajectories,density-based unsupervised anomaly detection,Signal processing,concept drift aware density-based anomaly detection,Soft sensors,marine engineering computing,maritime surveillance operations,Trajectory,Surveillance,Signal processing algorithms,real-world maritime data streams,data handling,"
"proceedings - ismode 2022: 2nd international seminar on machine learning, optimization, and data science","2022","",""
"context learning from a ship trajectory cluster for anomaly detection","2023","This paper presents a context information extraction process over Automatic Identification System (AIS) real-world ship data, building a system with the capability to extract representative points of a trajectory cluster. With the trajectory cluster, the study proposes the use of trajectory segmentation algorithms to extract representative points of each trajectory and then use the k-means algorithm to obtain a series of centroids over all the representative points. These centroids, combined, form a new representative trajectory of the cluster. This new representative trajectory of the input cluster represents new contextual information extracted from the original set of trajectories, being possible to apply anomaly detection approaches over the new obtained context. The results show a suitable approach with several compression algorithms that are compared with a metric based on the Perpendicular Euclidean Distance.","Trajectory compression,Data mining,AIS data,Trajectory clustering,Context learning,"
"the collaborative learning agent (cla) in trident warrior 08 exercise","2009","",""
"a parametric study of unsupervised anomaly detection performance in maritime imagery using manifold learning techniques","2016","",""
"abnormal behaviour detection by using machine learning-based approaches in the marine environment: a literature survey","2022","",""
"advanced data analytics for ship performance monitoring under localized operational conditions","2021","Improving the operational energy efficiency of existing ships is attracting considerable interests to reduce the environmental footprint due to air emissions. As the shipping industry is entering into Shipping 4.0 with digitalization as a disruptive force, an intriguing area in the field of ship’s operational energy efficiency is big data analytics. This paper proposes a big data analytics framework for ship performance monitoring under localized operational conditions with the help of appropriate data analytics together with domain knowledge. The proposed framework is showcased through a data set obtained from a bulk carrier pertaining the detection of data anomalies, the investigation of the ship’s localized operational conditions, the identification of the relative correlations among parameters and the quantification of the ship’s performance in each of the respective conditions. The novelty of this study is to provide a KPI (i.e. key performance indicator) for ship performance quantification in order to identify the best performance trim-draft mode under the engine modes of the case study ship. The proposed framework has the features to serve as an operational energy efficiency measure to provide data quality evaluation and decision support for ship performance monitoring that is of value for both ship operators and decision-makers.","Energy efficiency,Data anomaly detection,Ship performance monitoring,Emission control,Machine learning,Big data analytics,"
"message from the mbdw'20 workshop chairs: mdm 2020","2020","MBDW 2020 is the second event on maritime big data, co-located this time with the 21th international conference on Mobile Data Management. MBDW is dedicated to big data innovations for the maritime domain and interdisciplinary science-driven maritime activities. Following a rigorous blind peer-review process, nine papers have been finally selected for being included in the proceedings and for online presentation. The selected papers cover a diversified range of topics, focussing on machine learning advances for vessel trajectories analysis and prediction, maritime anomaly detection, vessel trajectory compression, analysis of open historical vessel emissions datasets, data fusion and big data infrastructures for mobility data processing.",""
"automated activity pattern learning and monitoring provide decision support to supervisors of busy environments","2009","",""
"maritime anomaly detection using gaussian process active learning","2012","A model of normal vessel behaviours is useful for detecting illegal, suspicious, or unsafe behaviour; such as vessel theft, drugs smuggling, people trafficking or poor sailing. This work presents a data-driven non-parametric Bayesian model, based on Gaussian Processes, to model normal shipping behaviour. This model is learned from Automatic Identification System (AIS) data and uses an Active Learning paradigm to select an informative subsample of the data to reduce the computational complexity of training. The resultant model allows a measure of normality to be calculated for each newly-observed transmission according to its velocity given its current latitude and longitude. Using this measure of normality, ships can be identified as potentially anomalous and prioritised for further investigation. The model performance is assessed by its ability to detect artificially generated AIS anomalies at locations around the United Kingdom. Finally, the model is demonstrated on case studies from artificial and real vessel data to detect anomalies in unusual tracks.","identification technology,data mining,automatic identification system data,data-driven nonparametric Bayesian model,Bayes methods,Marine vehicles,normal vessel behaviours,unsafe behaviour detection,informative data subsampling,Accuracy,illegal behaviour detection,Bayesian methods,sampling methods,real vessel data,Gaussian process active learning,United Kingdom,Data models,Gaussian processes,artificially generated AIS anomalies detection,maritime anomaly detection,artificial vessel data,training computational complexity,training,Training,behavioural sciences,computational complexity,normal shipping behaviour model,Computational modeling,suspicious behaviour detection,learning (artificial intelligence),newly-observed transmission,AIS data,"
