"name","year","abstract","keywords"
"a novel approach exploiting properties of convolutional neural networks for vessel movement anomaly detection and classification","2022","The article concerns the automation of vessel movement anomaly detection for maritime and coastal traffic safety services. Deep Learning techniques, specifically Convolutional Neural Networks (CNNs), were used to solve this problem. Three variants of the datasets, containing samples of vessel traffic routes in relation to the prohibited area in the form of a grayscale image, were generated. 1458 convolutional neural networks with different structures were trained to find the best structure to classify anomalies. The influence of various parameters of network structures on the overall accuracy of classification was examined. For the best networks, class prediction rates were examined. Activations of selected convolutional layers were studied and visualized to present how the network works in a friendly and understandable way. The best convolutional neural network for detecting vessel movement anomalies has been proposed. The proposed CNN is compared with multiple baseline algorithms trained on the same dataset.","Vessel movement anomalies,Convolutional neutral networks,Radar datasets,Deep learning,Anomaly detection,"
"learning maritime traffic rules using potential fields","2015","",""
"fusing uncertain knowledge and evidence for maritime situational awareness via markov logic networks","2015","The concepts of event and anomaly are important building blocks for developing a situational picture of the observed environment. We here relate these concepts to the JDL fusion model and demonstrate the power of Markov Logic Networks (MLNs) for encoding uncertain knowledge and compute inferences according to observed evidence. MLNs combine the expressive power of first-order logic and the probabilistic uncertainty management of Markov networks. Within this framework, different types of knowledge (e.g. a priori, contextual) with associated uncertainty can be fused together for situation assessment by expressing unobservable complex events as a logical combination of simpler evidences. We also develop a mechanism to evaluate the level of completion of complex events and show how, along with event probability, it could provide additional useful information to the operator. Examples are demonstrated on two maritime scenarios of rules for event and anomaly detection.","Uncertainty management,Situational awareness,Markov Logic Networks,Context-based fusion,"
"security in devsecops: applying tools and machine learning to verification and monitoring steps","2023","",""
"a comprehensive survey on the applications of machine learning techniques on maritime surveillance to detect abnormal maritime vessel behaviors","2023","",""
"building robust neighborhoods for manifold learning-based image classification and anomaly detection","2016","",""
"anomaly detection with unknown anomalies: application to maritime machinery","2021","We present a framework for deriving anomaly detection algorithms on timeseries data when the time and expression of anomalous behaviour is unknown. The framework is suited for problems in which individual machine learning paradigms cannot be directly implemented: supervised learning is not applicable due to the lack of labelled data, unsupervised learning is not effective since the normal operations are insufficiently defined and take complex and diverse forms, and deep learning risks confusing problematic behaviours for expected ones due to the possible repetitiveness of similar anomalies. The proposed approach is comprised of two phases: unsupervised discovery of anomalies, and semi-supervised construction and tuning of the anomaly detection algorithm. By leveraging data exploration methods and expert knowledge, the resulting algorithms are interpretable and detect a wide range of anomalous behaviours. The approach is applied to the early detection of wear and tear of maritime propulsion and manoeuvring machinery. We show that the final algorithm is able to detect different types of anomalies, including an actual internal leakage in a thruster which is otherwise overlooked by the present rule-based alarm system.","diagnosis,predictive maintenance,condition-based monitoring,machine learning,anomaly detection,grey-box modelling,fault detection,"
"a contextual hybrid model for vessel movement prediction","2021","Predicting the movement of the vessels can significantly improve the management of safety. While the movement can be a function of geographic contexts, the current systems and methods rarely incorporate contextual information into the analysis. This paper initially proposes a novel context-aware trajectoriesâ€™ simplification method to embed the effects of geographic context which guarantees the logical consistency of the compressed trajectories, and further suggests a hybrid method that is built upon a curvilinear model and deep neural networks. The proposed method employs contextual information to check the logical consistency of the curvilinear method and then, constructs a Context-aware Long Short-Term Memory (CLSTM) network that can take into account contextual variables, such as the vessel types. The proposed method can enhance the prediction accuracy while maintaining the logical consistency, through a recursive feedback loop. The implementations of the proposed approach on the Automatic Identification System (AIS) dataset, from the eastern coast of the United States of America which was collected, from November to December 2017, demonstrates the effectiveness and better compression, i.e. 80% compression ratio while maintaining the logical consistency. The estimated compressed trajectories are 23% more similar to their original trajectories compared to currently used simplification methods. Furthermore, the overall accuracy of the implemented hybrid method is 15.68% higher than the ordinary Long Short-Term Memory (LSTM) network which is currently used by various maritime systems and applications, including collision avoidance, vessel route planning, and anomaly detection systems.","recurrent neural nets,Safety,deep learning (artificial intelligence),Mathematical model,safety management,movement prediction,AIS dataset,Predictive models,curvilinear method,ubiquitous computing,deep neural networks,CLSTM network,ship behavior,deep learning,ships,automatic identification system dataset,marine safety,marine engineering,Data models,contextual hybrid model,contextual information,vessel movement prediction,United States of America,geographic context,data compression,Automatic identification system,vessel types,Trajectory,compressed trajectory estimation,context-aware LSTM network,vessel route planning,Deep learning,Context modeling,context-aware long short-term memory network,logical consistency,context-aware trajectories simplification,"
"intelligent deep fusion network for anomaly identification in maritime transportation systems","2023","This paper introduces a novel deep learning architecture for identifying outliers in the context of intelligent transportation systems. The use of a convolutional neural network with decomposition is explored to find abnormal behavior in maritime data. The set of maritime data is first decomposed into similar clusters containing homogeneous data, and then a convolutional neural network is used for each data cluster. Different models are trained (one per cluster), and each model is learned from highly correlated data. Finally, the results of the models are merged using a simple but efficient fusion strategy. To verify the performance of the proposed framework, intensive experiments were conducted on marine data. The results show the superiority of the proposed framework compared to the baseline solutions in terms of several accuracy metrics.","maritime data,Transportation,Urban areas,homogeneous data,deep learning (artificial intelligence),highly correlated data,Anomaly detection,maritime transportation systems,transportation,smart and secure transportation systems,intelligent transportation systems,similar clusters,anomaly identification,simple but efficient fusion strategy,Data models,marine data,pattern clustering,convolutional neural network,convolutional neural nets,intelligent deep fusion network,Training,Convolutional neural networks,decomposition,Deep learning,data cluster,learning (artificial intelligence),deep learning architecture,Convolution neural network,"
"1st international workshop on multiple-aspect analysis of semantic trajectories, master 2019 held in conjunction with the 19th european conference on machine learning and principles and practice of knowledge discovery in databases, ecml pkdd 2019","2020","",""
"clustering of maritime trajectories with ais features for context learning","2021","This paper presents an analysis on Automatic Identification System (AIS) real world ship data to build a system with the capability to extract useful information for an anomaly detection problem. The study focuses on the adjustment of a clustering technique to trajectory data, specifically using a DBSCAN algorithm that is adapted by means of two approaches. On the one hand, the DTW trajectory similarity metric is used to obtain a distance between two trajectories. On the other hand, an extraction of features of interest from each trajectory allowing a summary of the trajectory in a single multidimensional instance. The results show that both approaches are feasible, although not very scalable to larger problems due to the computational complexity of the used algorithms. In addition, the study analyses possible uses of these approaches to existing data mining problems.","data mining,Clustering algorithms,anomaly detection problem,trajectory data,Marine vehicles,Conferences,Feature extraction,information retrieval,AIS feature extraction,information extraction,AIS real world ship data,single multidimensional instance,DTW trajectory similarity metric,pattern clustering,Artificial intelligence,Measurement,marine engineering computing,automatic identification system real world ship data,Context learning,DBSCAN algorithm,Trajectory,computational complexity,maritime trajectory clustering,context learning,Data mining,learning (artificial intelligence),AIS data,Trajectory clustering,"
"intelligent anomaly detection of trajectories for iot empowered maritime transportation systems","2023","The convergence of Maritime Transportation Systems (MTS) and Internet of Things (IoT) has led to the promising IoT-empowered MTS (IoT-MTS). However, abnormal trajectories of maritime transportation ships can have highly negative impacts on the management of IoT-MTS. Therefore, anomaly detection of trajectories is important for the successful deployment of IoT-MTS. In this paper, we propose a Transfer Learning based Trajectory Anomaly Detection strategy, named TLTAD, for IoT-MTS. Specifically, a variational autoencoder is used to discover the potential connections between each dimension of the normal trajectory, while a graph variational autoencoder is used to explore the spatial similarity between normal trajectories. Based on internal connection of trajectories, a deep reinforcement learning algorithm, Twin Delayed Deep Deterministic policy gradient (TD3), is employed to train the trajectory anomaly detection model. To reduce the model training time, transfer learning is used to migrate the trained anomaly detection model between different regions of an ocean area or between similar ocean areas. Moreover, an efficient data transformation module is designed to improve the efficiency of model transfer. The experiments were conducted on a real-world automatic identification system (AIS) dataset. The results indicate that the proposed TLTAD can provide accurate anomaly detection on shipsâ€™ trajectories in IoT-MTS with reduced model training times.","reduced model training times,Transportation,deep learning (artificial intelligence),Anomaly detection,maritime transportation systems,anomaly detection,Internet of Things,transportation,Marine vehicles,abnormal trajectories,Twin Delayed Deep Deterministic policy gradient,highly negative impacts,model training time,ships,IoT-MTS,trajectory anomaly detection model,deep reinforcement learning algorithm,Data models,normal trajectory,reinforcement learning,maritime transportation ships,Artificial intelligence,real-world automatic identification system dataset,Maritime Transportation Systems,graph variational autoencoder,trained anomaly detection model,Trajectory Anomaly Detection strategy,gradient methods,Deep reinforcement learning,model transfer,Trajectory,promising IoT-empowered MTS,intelligent Anomaly Detection,transfer learning,learning (artificial intelligence),data handling,Analytical models,"
"maritime group motion analysis: representation, learning, recognition, and deviation detection","2015","This paper introduces new concepts and methods in the analysis of group motions over extended periods of time, and applies it to an example from the maritime domain. Group motion analysis includes these challenges: (1) represent complex motion patterns of multiple entities as they execute group maneuvers and behavior patterns; (2) learn these group motion patterns in a qualitative fashion, invariant to the number of entities participating; (3) recognize such learned maneuvers and behaviors as they unfold in future group tracking data; and (4) detect in real-time deviations of an entity from a recognized group maneuver or behavior, as such motion anomalies may indicate a vessel emerging from a group. The approach adopts a linear field theory to represent the relative motions of objects, in combination with learning & recognition methods that self-organize three evolving field parameters into 3D clusters that represent maneuver categories, and categories sequences that represent behaviors.","Pattern recognition,motion analysis,image motion analysis,complex motion pattern representation,behavior pattern,learning methods,maritime group motion analysis,group tracking data,object tracking,marine engineering,object detection,group maneuvers,Tensile stress,Real-time systems,Indexes,Tracking,deviation detection,Trajectory,linear field theory,Sensors,maneuver behavior patterns,real-time deviations,learning (artificial intelligence),Group tracks,motion anomalies,"
"research into vessel behaviour pattern recognition in the maritime domain: past, present and future","2021","A comprehensive literature review on vessel behaviour pattern recognition in maritime and littoral environments, spanning a period of three decades, is presented. A vast majority of research focuses on anomalous vessel behaviour detection from Automated Identification System (AIS) data, using artificial intelligence (AI), Bayesian networks and machine learning based methods. AIS is a cooperative system that employs VHF transceivers to share vessel information through terrestrial and satellite communication networks. To track small boats not fitted with AIS, uncooperative surveillance systems are employed. These systems have been studied in a relatively small number of publications. In vessel behaviour pattern recognition, target classification is critically important, particularly, in asymmetric warfare situations. The paper concludes with a discussion of future outlook in vessel behaviour pattern recognition research.","Vessel behaviour recognition,Target tracking,Pattern of life,Anomaly detection,Plan recognition,Bayesian networks,Target classification,"
"anomaly detection in vessel tracks using bayesian networks","2014","In recent years electronic tracking has provided voluminous data on vessel movements, leading researchers to try various data mining techniques to find patterns and, especially, deviations from patterns, i.e., for anomaly detection. Here we describe anomaly detection with data mined Bayesian Networks, learning them from real world Automated Identification System (AIS) data, and from supplementary data, producing both dynamic and static Bayesian network models. We find that the learned networks are quite easy to examine and verify despite incorporating a large number of variables. We also demonstrate that combining dynamic and static modelling approaches improves the coverage of the overall model and thereby anomaly detection performance.","Models of normality,Maritime data,Anomaly detection,Machine learning,Bayesian networks,AIS,"
"engine vibration anomaly detection in vessel engine room","2022","Unsupervised and autonomous operations require new, more efficient, and smarter technical solutions. Digitalization is one of the enablers of autonomous operation, with installing new sensors and using the data for AI and machine learning. The trend is to move the handling the vast amount of data from sensors, installed in machines, and devices, close to the sensors. This way, data communication can be heavily reduced, while the latency of decisions based on data can be minimal. This is achieved by moving the advanced data analysis capabilities from the cloud to the edge. In this paper, the driver of technological development is the concept of an unmanned machine room, where the normal inspections performed by personnel are automated using sensors and algorithms.We present an analysis of vibration data, recorded at a cruise ferry\x92s engines, using a signal processing method called cepstrums. A cepstrum is a version of frequency analysis, intending to identify and visualize periodic structures in data using cepstrograms. Compared to spectrogram analysis, usage of cepstrogram enables better visualization of engine behavior into the shape of audio signals. This helped us discover the run-time vibration routine of the engines from where we could observe unusual vibration sensing generated from the engine. We started studying the unusual behavior and came to the conclusion that the engine is sometimes misfiring the cylinders, generating anomalies","anomaly,unmanned machine room,edge computing,vibration analysis,cepstrum,data communication,autonomous operation,unsupervised,"
"a distributed spatial method for modeling maritime routes","2020","In this work we propose a novel spatial knowledge discovery pipeline capable of automatically unravelling the â€œroads of the seaâ€ and maritime traffic patterns by analysing voluminous vessel tracking data, as collected through the Automatic Identification System (AIS). We present a computationally efficient and highly accurate solution, based on a MapReduce approach and unsupervised learning methods, capable of identifying the spatiotemporal dynamics of ship routes and most crucially their characteristics, thus deriving maritime â€œpatterns of lifeâ€ at a global scale, without the reliance on any additional information sources or a priori expert knowledge. Experimental results confirm high accuracy of results and superior performance in comparison to other methods, with the entire processing duration completing in less than 3 hours for more than a terabyte of non-uniform spatial data. Finally, to clearly demonstrate the applicability and impact of our proposed method, we evaluate its ability to detect real world â€œanomaliesâ€, such as maritime incidents reported in the European Marine Casualty Information Platform. Numerical results show the advantages of our scheme in terms of accuracy, with an achieved anomaly detection accuracy of higher than 93%, by detecting 313 out of 335 relevant maritime incidents.","data mining,Anomaly detection,anomaly detection,unsupervised learning,Marine vehicles,data driven maritime traffic,maritime traffic patterns,computationally efficient solution,patterns of life,routes,spatial knowledge discovery pipeline,MapReduce approach,ships,automatic identification system,marine safety,marine engineering,voluminous vessel tracking data,a priori expert knowledge,relevant maritime incidents,AIS,nonuniform spatial data,anomaly detection accuracy,ship routes,time 3.0 hour,highly accurate solution,pattern clustering,Artificial intelligence,information sources,Big Data,unsupervised learning methods,Roads,distributed spatial method,maritime modeling,Trajectory,entire processing duration,Surveillance,spatiotemporal dynamics,European Marine Casualty Information Platform,data handling,"
"from unsupervised to semi-supervised anomaly detection methods for hrrp targets","2020","Responding to the challenge of detecting unusual radar targets in a well identified environment, innovative anomaly and novelty detection methods keep emerging in the literature. This work aims at presenting a benchmark gathering common and recently introduced unsupervised anomaly detection (AD) methods, the results being generated using high-resolution range profiles. A semi-supervised AD (SAD) is considered to demonstrate the added value of having a few labeled anomalies to improve performances. Experiments were conducted with and without pollution of the training set with anomalous samples in order to be as close as possible to real operational contexts. The common AD methods composing our baseline will be One-Class Support Vector Machines (OC-SVM), Isolation Forest (IF), Local Outlier Factor (LOF) and a Convolutional Autoencoder (CAE). The more innovative AD methods put forward by this work are Deep Support Vector Data Description (Deep SVDD) and Random Projection Depth (RPD), belonging respectively to deep and shallow AD. The semi-supervised adaptation of Deep SVDD constitutes our SAD method. HRRP data was generated by a coastal surveillance radar, our results thus suggest that AD can contribute to enhance maritime and coastal situation awareness.","semisupervised anomaly detection methods,Pollution,unusual radar targets,benchmark gathering,Support vector machines,Anomaly detection,radar detection,HRRP targets,anomaly detection,unsupervised learning,high-resolution range profiles,Neural networks,semisupervised adaptation,novelty detection methods,radar target detection,radar computing,innovative anomaly,support vector machines,SAD method,machine learning,object detection,radar target recognition,innovative AD methods,search radar,identified environment,Deep SVDD,high-resolution range profile,Radar,common AD methods,convolutional neural nets,labeled anomalies,Training,One-Class Support Vector Machines,neural network,semisupervised AD,Radar detection,"
"data-driven prognostics using a combination of constrained k-means clustering, fuzzy modeling and lof-based score","2017","Today, failure modes characterization and early detection is a key issue in complex assets. This is due to the negative impact of corrective operations and the conservative strategies usually put in practice, focused on preventive maintenance. In this paper anomaly detection issue is addressed in new monitoring sensor data by characterizing and modeling operational behaviors. The learning framework is performed on the basis of a machine learning approach that combines constrained K-means clustering for outlier detection and fuzzy modeling of distances to normality. A final score is also calculated over time, considering the membership degree to resulting fuzzy sets and a local outlier factor. Proposed solution is deployed in a CBM+ platform for online monitoring of the assets. In order to show the validity of the approach, experiments have been conducted on real operational faults in an auxiliary marine diesel engine. Experimental results show a fully comprehensive yet accurate prognostics approach, improving detection capabilities and knowledge management. The performance achieved is quite high (precision, sensitivity and specificity above 93% and κ=0.93), even more so given that a very small percentage of real faults are present in data.","Local outlier factor,Constrained k-means clustering,Behavior characterization,Machine learning,Fuzzy modeling,Condition monitoring,"
