"name","year","abstract","keywords"
"a novel quality control method of time-series ocean wave observation data combining deep-learning prediction and statistical analysis","2023","Quality control (QC) of marine data is a critical aspect in ensuring the usability of oceanic data. In this paper, we propose a novel QC method for time-series ocean wave data, which combines deep learning prediction and statistical analysis. Our method first realizes multi-element LSTM prediction of the time-series ocean wave observation data, capturing both temporal consistency and physical relationships between the multi-element inputs. Then, it applies peak detection on the regional mean difference ratio derived from the predicted and true values of the ocean wave data, and finally labels the anomalous data points based on peak detection results. We conducted experiments on the time-series wave data of four sites from the National Marine Science Center, China, and compared our proposed method with traditional QC method that is currently used for operational marine data quality control, as well as classic anomaly detection models including Isolation Forest and VAE-LSTM. The results show a significant improvement in the Precision, Recall, and F1 Score for erroneous samples using our proposed method. Our proposed method takes advantages of both deep learning and statistical analysis and considers physical correlation of multiple elements of marine data, effectively addressing the problem of erroneous discrimination of abnormal sea conditions in the traditional method, and providing valuable insights for the study of marine time-series observational data.","Deep-learning prediction,Time-series data,Statistical analysis,Quality control,"
"maritime situational awareness forensics tools for a common information sharing environment (cise)","2019","CISE stands for Common Information Sharing Environment and refers to an architecture and set of protocols, procedures and services for the exchange of data and information across Maritime Authorities of EU (European Union) Member States (MS's). In the context of enabling the implementation and adoption of CISE by different MS's, EU has funded a number of projects that enable the development of subsystems and adaptors intended to allow MS's to connect and make use of CISE. In this context, the Integrated Systems Laboratory (ISL) has led the development of the corresponding Hellenic and Cypriot CISE by developing a Control, Command & Information (C2I) system that unifies all partial maritime surveillance systems into one National Situational Picture Management (NSPM) system, and adaptors that allow the interconnection of the corresponding national legacy systems to CISE and the exchange of data, information and requests between the two MS's. Furthermore, a set of forensics tools that allow geospatial & time filtering and detection of anomalies, risk incidents, fake MMSIs, suspicious speed changes, collision paths, and gaps in AIS (Automatic Identification System), have been developed by combining motion models, AI, deep learning and fusion algorithms using data from different databases through CISE. This paper briefly discusses these developments within the EU CISE-2020, Hellenic CISE and CY-CISE projects and the benefits from the sharing of maritime data across CISE for both maritime surveillance and security. The prospect of using CISE for the creation of a considerably rich database that could be used for forensics analysis and detection of suspicious maritime traffic and maritime surveillance is discussed.","EU Member States,surveillance,maritime traffic,CY-CISE projects,Maritime Security,Distributed CISE database,Forensics,security of data,maritime security,common information sharing environment,National Situational Picture Management system,Cypriot CISE,MS,deep learning,automatic identification system,marine engineering,Maritime Surveillance,Databases,AIS,CISE,C2I system,Europe,Information management,corresponding national legacy systems,Control,Artificial intelligence,Hellenic CISE,NSPM system,command and control systems,Command,maritime surveillance systems,control-command-information system,national security,fusion algorithms,integrated systems laboratory,ISL,Surveillance,AI,Tools,learning (artificial intelligence),time filtering,forensics tools,"
"challenges in vessel behavior and anomaly detection: from classical machine learning to deep learning","2020","",""
"online learning of temporal logic formulae for signal classification","2018","This paper introduces a method for online inference of temporal logic properties from data. Specifically, we tackle the online supervised learning problem. In this setting, the data is in form of a set of pairs of signals and labels and it becomes available over time. We propose an approach for efficiently processing the data incrementally. In particular, when a new instance is presented, the proposed method updates a binary tree that is linked with the inferred Signal Temporal Logic (STL) formula. This approach presents several benefits. Primarily, it allows the refinement of the current formula when more data is acquired. Moreover, the incremental construction offers insights on the trade-off between formula complexity and classification accuracy. We present two case studies to emphasize the characteristics of the proposed algorithm: 1) a fault classification problem in an automotive system and 2) an anomaly detection problem in the maritime environment.","anomaly detection problem,Prediction algorithms,Machine learning,temporal logic formulae,temporal logic,signal classification,signal temporal logic formula,automotive system,Decision trees,formula complexity,trees (mathematics),Impurities,STL,temporal logic properties,Binary trees,Complexity theory,online supervised learning problem,inference mechanisms,maritime environment,incremental construction,Task analysis,binary tree,online inference,learning (artificial intelligence),fault classification problem,"
"a novel model for ship trajectory anomaly detection based on gaussian mixture variational autoencoder","2023","The use of traditional methods in anomaly detection of multi-class ship trajectories showed some limitations in terms of robustness and learning ability of trajectory features. In view of this, an anomaly detection model for ship trajectory data based on Gaussian Mixture Variational Autoencoder (GMVAE) is proposed in this study using an unsupervised classification method. The proposed model modifies Variational Autoencoder (VAE) by changing the inferential distribution of prior distribution and approximate posterior to the Gaussian mixture model. A high-dimensional hidden space is constructed to learn the features of multi-class trajectory data, and the Dynamic Time Warping (DTW) method is applied to measure the error between the reconstructed trajectory and the original trajectory in order to judge whether the ship trajectory is abnormal. The Automatic Identification System (AIS) data from the US coastal areas are used to verify the proposed model, and the results are compared with other commonly used models in a manually labeled dataset. The research results indicate that the detection rate of the proposed model is 91.26%, and the false alarm rate is 0.68%, which performs the best. Using the Gaussian mixture model to describe the distribution of hidden space can improve the learning ability of multi-class trajectories of VAE, thus increasing the robustness of the model. This research can provide technical support for ship trajectory data analysis and risk management of maritime transportation.","Trajectory,anomaly detection of ship trajectory,Clustering algorithms,Classification algorithms,Mathematical models,gaussian mixture variational autoencoder (gmvae),unsupervised learning,Gaussian distribution,Marine vehicles,Artificial neural networks,intelligent transportation,AIS,"
"igroup learning and idetect for dynamic anomaly detection with applications in maritime threat detection","2018","The maritime transportation system is critical to the US and world economy. This paper reports on two novel statistical tools, iGroup learning for individualized grouping and baseline distribution formation, and iDetect for subsequent individualized detection of anomalous deviations from the baseline distribution. These statistical methods are being developed, tested, and implemented in the context of maritime threat detection, but can be easily applied in other areas. In the maritime domain, the tools aim to provide early warnings of anomalies and assessments of resulting risk for vessels being monitored. The paper presents some preliminary results about these tools and specifically reports on a case study aimed at finding anomalous behavior for vessels approaching a port.","maritime threat detection,anomalous behavior,statistical methods,Marine vehicles,Monitoring,iGroup learning,security of data,baseline distribution,statistical analysis,Standards,marine engineering,maritime domain,statistical tools,Artificial intelligence,Statistical analysis,dynamic anomaly detection,Trajectory,iDetect,Tools,maritime transportation system,"
"graph representation learning with encoding edges","2019","Network embedding aims at learning the low dimensional representation of nodes. These representations can be widely used for network mining tasks, such as link prediction, anomaly detection, and classification. Recently, a great deal of meaningful research work has been carried out on this emerging network analysis paradigm. The real-world network contains different size clusters because of the edges with different relationship types. These clusters also reflect some features of nodes, which can contribute to the optimization of the feature representation of nodes. However, existing network embedding methods do not distinguish these relationship types. In this paper, we propose an unsupervised network representation learning model that can encode edge relationship information. Firstly, an objective function is defined, which can learn the edge vectors by implicit clustering. Then, a biased random walk is designed to generate a series of node sequences, which are put into Skip-Gram to learn the low dimensional node representations. Extensive experiments are conducted on several network datasets. Compared with the state-of-art baselines, the proposed method is able to achieve favorable and stable results in multi-label classification and link prediction tasks.","Edge representation,Feature learning,Network mining,Network embedding,"
"artificial intelligence and machine learning in defense applications ii","2020","",""
"unsupervised maritime traffic graph learning with mean-reverting stochastic processes","2018","Inspired by the fair regularity of the motion of ships, we present a method to derive a representation of the commercial maritime traffic in the form of a graph, whose nodes represent way-point areas, or regions of likely direction changes, and whose edges represent navigational legs with constant cruise velocity. The proposed method is based on the representation of a ship's velocity with an Ornstein-Uhlenbeck process and on the detection of changes of its long-run mean to identify navigational way-points. In order to assess the graph representativeness of the traffic, two performance metrics are introduced, leading to distinct graph construction criteria. Finally, the proposed method is validated against real-world Automatic Identification System data collected in a large area.","real-world data,Clustering algorithms,Anomaly detection,unsupervised learning,graph construction criteria,Marine vehicles,mean-reverting stochastic processes,unsupervised maritime traffic graph learning,Stochastic processes,maritime situational awareness,DBSCAN,Ornstein-Uhlenbeck process,change detection,ships,automatic identification system,stochastic processes,motion control,AIS,navigational legs,maritime traffic graph,Artificial intelligence,velocity control,graph theory,constant cruise velocity,Legged locomotion,clustering,graph representativeness,Navigation,navigation,graph learning,navigational way-points,ship velocity,"
"predicting ais reception using tropospheric propagation forecast and machine learning","2022","The aim of this paper is to present a methodology for modelling and predicting the coverage of an Automatic Identification System (AIS) station based on tropospheric index forecast maps and modelling methods from machine learning. The aim of this work is to cartographically represent the areas in which the AIS signals emitted by ships will be received by a coastal station. This work contributes to the improvement of maritime situational awareness and to the detection of anomalies at sea [1], and in particular to the identification of AIS message falsifications [2] (ubiquity of a vessel by identity theft, falsification of GPS positions and deactivation of AIS).","identification technology,naval engineering computing,Marine vehicles,Machine learning,Conferences,Global Positioning System,Sea measurements,Predictive models,maritime situational awareness,predicting AIS reception,tropospheric electromagnetic wave propagation,ships,marine engineering,machine learning,tropospheric index forecast maps,tropospheric propagation forecast,modelling methods,AIS message,AIS signals,Indexes,Automatic Identification System station,VHF radio propagation,coastal station,marine communication,learning (artificial intelligence),"
"self-learning adaptive algorithm for maritime traffic abnormal movement detection based on virtual pheromone method","2015","The paper deals with a newly designed self-learning adaptive algorithm enabling detecting any non-standard movement in marine traffic based on the bio-inspired virtual pheromone method. The algorithm detects non-standard vessel movements purely based on the common marine traffic patterns from the Automated Identification System. The proposed approach provides rapid self-learning and fast adaptation characteristics. We verified the algorithm's accuracy in two modes, each of which incorporates different learning factors. The dataset for the verification of the proposed algorithm was provided by the marine traffic Automated Identification System of the Klaipeda seaport.","Traffic control,virtualisation,marine radar,Marine traffic,anomaly detection,unsupervised learning,traffic pattern,marine traffic patterns,nonstandard vessel movements,automated identification system,virtual pheromone,bioinspired virtual pheromone method,non-standard traffic,Standards,self-learning adaptive algorithm,Klaipeda seaport,Classification algorithms,Visualization,Algorithm design and analysis,traffic engineering computing,Surveillance,maritime traffic abnormal movement detection,"
"machine learning-assisted anomaly detection in maritime navigation using ais data","2020","The automatic identification system (AIS) reports vessels' static and dynamic information, which are essential for maritime traffic situation awareness. However, AIS transponders can be switched off to hide suspicious activities, such as illegal fishing, or piracy. Therefore, this paper uses real world AIS data to analyze the possibility of successful detection of various anomalies in the maritime domain. We propose a multi-class artificial neural network (ANN)-based anomaly detection framework to classify intentional and non-intentional AIS on-off switching anomalies. The multi-class anomaly framework captures AIS message dropouts due to various reasons, e.g., channel effects or intentional one for carrying illegal activities. We extract position, speed, course and timing information from real world AIS data, and use them to train a 2-class (normal and anomaly) and a 3-class (normal, power outage and anomaly) anomaly detection models. Our results show that the models achieve around 99.9% overall accuracy, and are able to classify a test sample in the order of microseconds.","security of data,maritime traffic situation awareness,multiclass anomaly framework,pattern classification,multiclass artificial neural network,AIS message dropouts,neural nets,illegal fishing,learning (artificial intelligence),illegal activities,ships,automatic identification system,marine engineering,machine learning-assisted anomaly detection,maritime navigation,AIS transponders,"
"unsupervised maritime traffic pattern extraction from spatio-temporal data","2015","Maritime traffic pattern extraction is a fundamental and crucial factor for maritime surveillance and anomaly detection. Emerging technologies like Automatic Identification System (AIS) provides multi-dimensional data which is used to construct a maritime traffic model. In this paper, we propose a framework of maritime traffic pattern extraction from vessel AIS information, which learns a traffic pattern using an unsupervised technique, and can be applied on historical Automatic Identification System data. AIS data is a kind of spatio-temporal data that contains information of location data, as well as time stamps. In this way, traffic pattern is described by AIS data. Furthermore, we conduct a simulation experiment that extracts traffic pattern from the AIS data through the unsupervised technique. The proposed framework takes advantage of AIS data, which is a type of the spatiotemporal data that consists of vessel motion information, to perform the experiment. The result shows that the unsupervised framework converts useful information from raw AIS data to effective traffic pattern. The proposed method strongly supports the further research on maritime traffic pattern extraction of AIS data. Besides, an overview of the framework and the unsupervised technique for high-level maritime situation awareness is presented.","Traffic control,Clustering algorithms,unsupervised learning,anomaly detection,Marine vehicles,vessel AIS information,spatiotemporal data,data analysis,ships,automatic identification system,marine engineering,Automatic Identification System,maritime traffic pattern,AIS,maritime surveillance,Data models,feature extraction,Classification algorithms,identification,Trajectory,maritime situation awareness,maritime traffic pattern extraction,density-based clustering,Data mining,"
"framework for ship trajectory forecasting based on linear stationary models using automatic identification system","2022","Maritime surveillance is of utmost priority for a nation's security, and hence it's economy. For maritime awareness, coastal surveillance, and maritime activities in the Region of Interest (ROI) should be monitored. One of the ways to keep this in check is to restrain unwanted infiltration. Monitoring unwanted infiltration is feasible through vessel trajectory forecasting and anomaly detection in real time. Most solutions for trajectory predictions are available but require a huge amount of historical data, and high-power computing resources. Here, the requirement is developing a decision support framework consisting of both lite weight approaches for short-term predictions and deep learning-based techniques for long-term forecasting. This paper aims to find the suitability of Linear Stationary Models (LSM) like the Auto-Regressive Integrated Moving Average Model (ARIMA) for predicting and forecasting the Vessel Trajectory as means of lite weight short-term predictions. For this purpose, the Automatic Identification System (AIS) dataset of the U.S. West Coast is used. The significant effort was for data pre-processing to create a robust dataset for model training. An appropriate model after the model-selection process is used for trajectory forecasting. The model's accuracy is validated using Root Mean Square Error (RMSE) performance indices for residual and forecast errors. A window generator model is integrated with the best-fitted ARIMA model for recursive real-time predictions, with varied sizes and visualization. The proposed time-series model provided a very high accuracy as the RMSE value for prediction and 48 hours forecast are 0.023 and 0.017, respectively.","Auto-Regressive Integrated Moving Average Model,Window Generator,Trajectory Forecast,Time Series Analysis,Automatic Identification System,Maritime Surveillance,"
"cognitively-inspired motion pattern learning & analysis algorithms for higher-level fusion and automated scene understanding","2007","We have developed a suite of neurobiologically inspired algorithms for exploiting track data to learn normal patterns of motion behavior, detect deviations from normalcy, and predict future behavior. These capabilities contribute to higher-level fusion situational awareness and assessment objectives. They also provide essential elements for automated scene understanding to shift operator focus from sensor monitoring and activity detection to assessment and response. Our learning algorithms learn behavioral patterns at a variety of conceptual, spatial, and temporal levels to reduce a massive amount of track data to a rich set of information regarding their field of regard that supports decision-making and timely response initiation. Continuous incremental learning enables the models of normal behavior to adapt well to evolving situations while maintaining high levels of performance. Deviations from normalcy result in reports being published directly to operator displays or to other reasoning components within a larger system. Deviation tolerance levels are user settable during system operation to tune alerting sensitivity. Operator (or other system component) responses to anomaly alerts can be fed back into the algorithms to further enhance and refine learned models. These algorithms have been successfully demonstrated to learn vessel behaviors across the maritime domain and to learn vehicle and dismount behavior in land-based settings.","Motion detection,Pattern analysis,Decision making,Algorithm design and analysis,Layout,Motion analysis,Computerized monitoring,Displays,Vehicles,Tracking,"
"unsupervised extraction of knowledge from s-ais data for maritime situational awareness","2013","Automatic vessel behaviour analysis is a key factor for maritime surveillance and relies on an efficient representation of knowledge about vessels activity. Emerging technologies such as space-based AIS provides a new dimension of service and creates a need for new methods able to learn a maritime scene model at an oceanic scale. In this paper, we propose such a framework: a probabilistic normalcy model of vessel dynamics is learned using unsupervised techniques applied on historical S-AIS data and used for anomaly detection and prediction tasks, thus providing functionalities for high-level situational awareness (level 2 and 3 of the JDL).","surveillance,vessel activity,Clustering algorithms,Hidden Markov models,knowledge representation,unsupervised learning,anomaly detection,Marine vehicles,vessel dynamics,probabilistic normalcy model,security of data,automatic vessel behaviour analysis,maritime situational awareness,space-based AIS,marine safety,marine engineering,emerging technology,maritime surveillance,Data models,Length measurement,oceanic scale,vehicle dynamics,unsupervised knowledge extraction,prediction tasks,high-level situational awareness,maritime scene model,historical S-AIS data,Trajectory,unsupervised techniques,probability,knowledge acquisition,Surveillance,marine vehicles,"
"transfer learning for prognostics and health management (phm) of marine air compressors†","2021","",""
"detection of abnormal vessel behaviours from ais data using geotracknet: from the laboratory to the ocean","2020","The constant growth of maritime traffic leads to the need of automatic anomaly detection, which has been attracting great research attention. Information provided by AIS (Automatic Identification System) data, together with recent outstanding progresses of deep learning, make vessel monitoring using neural networks (NNs) a very promising approach. This paper analyse a novel neural network we have recently introduced -GeoTrackNet- regarding operational contexts. Especially, we aim to evaluate (i) the relevance of the abnormal behaviours detected by GeoTrackNet with respect to expert interpretations, (ii) the extent to which GeoTrackNet may process AIS data streams in real time. We report experiments showing the high potential to meet operational level of the model.","automatic anomaly detection,GeoTrackNet,maritime traffic,Anomaly detection,anomaly detection,real-time,neural networks,neural nets,deep learning,automatic identification system,marine engineering,AIS data streams,abnormal vessel behaviours,AIS,Wind,Artificial intelligence,Real-time systems,Big Data,maritime big data,Training,Trajectory,traffic engineering computing,marine vehicles,vessel monitoring,learning (artificial intelligence),"
