"name","year","abstract","keywords"
"function-shape-based particle swarm optimization and its application in maritime static target cooperative search","2017","The application of particle swarm algorithm in optimization has been growing over the last few years, but this approach becomes computationally impracticable when the complexity of the problem increases. In this context, an improvement of the particle swarm algorithm-the function-shape-based particle swarm optimization (FSPSO) is presented. For a practical maritime cooperative search problem, FSPSO makes particles move around in the corresponding solution space according to certain rules to gather information firstly. Then FSPSO exploits the history data acquired during the first process to analyze the shape of the solution space. Based on the knowledge about the function shape, FSPSO generates solutions and iteration strategies. At last, the position and speed of each particle will be updated iteratively, aiming at producing a high quality solution to the optimization problem. The main idea behind FSPSO is to hybridize PSO with the search mode of a human being. This paper uses maritime static target cooperative search as a test domain. In order to evaluate the effectiveness of FSPSO, we perform a comparison between the performances of FSPSO with other approaches drawn from the scientific literature. Results demonstrate that FSPSO is able to produce statistically significantly higher quality solutions, outperforming many other approaches.","Decoding,Generators,history data,heuristics,information theory,particle swarm optimisation,Software packages,particle swarm optimization,maritime search,Multiplexing,iteration strategies,practical maritime cooperative search problem,Complexity theory,search problems,function shape,maritime static target cooperative search,FSPSO,function-shape,Algorithm design and analysis,cooperative,particle swarm algorithm-the,Field programmable gate arrays,"
"motion modeling and simulation of maritime autonomous surface ships in realistic environmental disturbances","2020","A novel modeling and simulation pipeline is proposed in this paper to predict the six-degrees-of-freedom (6-DOF) motion of MASS under realistic environmental disturbances. The MASS model consists of several physics-based differential equations that are built based on state-of-the-art studies. The onboard sensors are utilized to drive the MASS model to keep the consistent control input with the real ships. A build-in hydrodynamic database describes the motion characteristics of ships. Moreover, an actual sea database is developed based on the third-generation wave numerical model to reproduce the ocean characteristics in the simulation. The spatial-and time-varying environmental vector fields are obtained from the real sea database to ensure consistency with the real environment. Three real voyage cases are reproduced by the presented method. The simulation results are compared with the records from onboard sensors for validation. The RMSE of the simulated trajectories is 3.789', 3.110', and 1.318' under the single influence of disturbances due to the inappropriate description of the real sea. Under the coupling disturbances, the RMSE of trajectories reduces to 0.1829', 0.5249', and 0.4030'. Consequently, the results indicate that the ocean database accurately reflected the ocean characteristics realistically, and the presented method can effectively predict the motions of the real ship under the actual sea environmental disturbances.","onboard sensors,control system synthesis,state-of-the-art studies,third-generation wave numerical model,remotely operated vehicles,maritime autonomous surface ships,Marine vehicles,ship,Mathematical model,coupling disturbances,simulated trajectories,spatial- time-varying environmental vector fields,Predictive models,realistic environmental disturbances,ships,differential equations,hydrodynamic database,hydrodynamics,motion control,Databases,Oceans,position control,ocean database,motion modeling,motion characteristics,actual sea environmental disturbances,physics-based differential equations,Hydrodynamics,Numerical models,time series,six-degrees-of-freedom,actual sea database,mobile robots,MASS model,marine control,numerical analysis,consistent control input,ocean characteristics,"
"maritime anomaly detection in a real-world scenario: ever given grounding in the suez canal","2022","In this paper we present how automatic maritime anomaly detection tools can be successfully applied in real-world situations such as the major event of the container vessel Ever Given, which grounded in the Suez Canal on March 23rd 2021. The anomaly detector is designed to process the available sequence of Automatic Identification System (AIS) reports, information from ground-based or satellite radar systems if available, and contextual information defining the expected nominal behavior of navigation. A statistical hypothesis testing procedure is sequentially run to decide whether or not a deviation from the nominal behavior happened within a specific time period, for instance two consecutive data points. We show, based on the recorded AIS data from the Ever Given, that the proposed detector could have been triggered and alerted to anomalous behavior fully 19 minutes before the grounding.","anomaly detector,Anomaly detection,Marine vehicles,Grounding,statistical hypothesis testing,Ever Given grounding,automatic maritime anomaly detection tools,statistical analysis,Ornstein-Uhlenbeck process,Testing,ships,Containers,automatic identification system,radar,maritime surveillance,satellite radar systems,contextual information,container vessel,Suez Canal,Artificial intelligence,ground-based system,marine engineering computing,Maritime anomaly detection,Irrigation,statistical hypothesis testing procedure,expected nominal behavior,AIS data,"
"intensified aridity over the indo-pacific warm pool controlled by ice-sheet expansion during the last glacial maximum","2022","The magnitude, direction and cause of precipitation changes across the Indo-Pacific Warm Pool (IPWP) during the Last Glacial Maximum (LGM) remain elusive. In particular, it is still inconclusive whether tropical or extra-tropical factors controlled such precipitation changes. Determining the spatio-temporal distribution of precipitation in the IPWP during the LGM is a valid strategy to address this issue, but the existing precipitation records are dominantly from maritime continents and marginal seas, with few data from pelagic oceans. In order to fill this gap, we analyzed the oxygen isotopic compositions of single Ethmodiscus rex diatom frustules (δ18OE. rex) from a sediment core (WPD-03) consisting of laminated diatom mats (LDMs) in the eastern Philippine Sea (EPS). δ18OE. rex was controlled mainly by sea-surface salinity variation and, thus, can reflect open-ocean precipitation changes across the IPWP. Our precipitation proxy records, in combination with existing published data, reveal spatial patterns of precipitation change that indicate overall drying across the IPWP during the LGM. Based on a comparison of paleoclimatic records with modeling results, we propose that extra-tropical factors (ice-sheet size) controlled precipitation variability in the IPWP during the LGM through a combination of zonal shifts of ENSO and meridional migration of the ITCZ. Strong aridity during the LGM prevented formation of a subsurface barrier layer and, hence, allowed accessing of sufficient nutrients to surface waters, stimulating blooms of E. rex and subsequent formation of LDMs in the IPWP. These findings suggest an important role for high-latitude climate in the tropical hydrological cycle during the LGM.","Tropical West Pacific,Diatom blooms,Sea-surface salinity,Model simulation,Tropical hydroclimate,High-latitude forcing,"
"fusion detection algorithm of maritime radar and electro-optical pod for complex sea conditions","2023","In order to improve the perceptual capability of Unmanned Surface Vessels (USVs) in complex sea conditions, a fusion detection algorithm has been developed that combines maritime radar and electro-optical (EO) pod. This algorithm integrates the positional state of the USV, class information of the maritime target obtained through a vision-based target detection algorithm, and processed maritime radar information. By using Gaussian and morphological filtering, the fusion of position state information from the USV, EO pod data, and maritime radar data is achieved. This effectively mitigates the negative impact of environmental factors, such as waves and water mist, on target detection. A cooperative sensing process between the maritime radar and EO pod is proposed to fuse the data obtained from both sources, resulting in accurate comprehensive target information. Experimental results show that the fusion algorithm achieves an average accuracy of 80.24% and a detection rate of 74.7%, enabling precise detection of maritime targets, including their distance, speed, and category. This enhanced perceptual capability is essential for USVs operating in complex maritime environments, enabling better decision-making and navigation performance.","maritime radar data,class information,accurate comprehensive target information,sensor fusion,marine radar,electro-optical pod,vision-based target detection algorithm,fusion algorithm,enhanced perceptual capability,target detection,complex maritime environments,positional state,combines maritime radar,fusion detection algorithm,object detection,complex sea conditions,Collaboration,synergistic sensing,Surface morphology,Radar,position state information,Unmanned Surface Vessels,unmanned surface vehicles,detection rate,maritime radar information,Radar imaging,USVs operating,Object detection,Signal processing algorithms,EO pod,maritime target,multi-sensor fusion,Radar detection,"
"maritime situational awareness forensics tools for a common information sharing environment (cise)","2019","CISE stands for Common Information Sharing Environment and refers to an architecture and set of protocols, procedures and services for the exchange of data and information across Maritime Authorities of EU (European Union) Member States (MS's). In the context of enabling the implementation and adoption of CISE by different MS's, EU has funded a number of projects that enable the development of subsystems and adaptors intended to allow MS's to connect and make use of CISE. In this context, the Integrated Systems Laboratory (ISL) has led the development of the corresponding Hellenic and Cypriot CISE by developing a Control, Command & Information (C2I) system that unifies all partial maritime surveillance systems into one National Situational Picture Management (NSPM) system, and adaptors that allow the interconnection of the corresponding national legacy systems to CISE and the exchange of data, information and requests between the two MS's. Furthermore, a set of forensics tools that allow geospatial & time filtering and detection of anomalies, risk incidents, fake MMSIs, suspicious speed changes, collision paths, and gaps in AIS (Automatic Identification System), have been developed by combining motion models, AI, deep learning and fusion algorithms using data from different databases through CISE. This paper briefly discusses these developments within the EU CISE-2020, Hellenic CISE and CY-CISE projects and the benefits from the sharing of maritime data across CISE for both maritime surveillance and security. The prospect of using CISE for the creation of a considerably rich database that could be used for forensics analysis and detection of suspicious maritime traffic and maritime surveillance is discussed.","EU Member States,surveillance,maritime traffic,CY-CISE projects,Maritime Security,Distributed CISE database,Forensics,security of data,maritime security,common information sharing environment,National Situational Picture Management system,Cypriot CISE,MS,deep learning,automatic identification system,marine engineering,Maritime Surveillance,Databases,AIS,CISE,C2I system,Europe,Information management,corresponding national legacy systems,Control,Artificial intelligence,Hellenic CISE,NSPM system,command and control systems,Command,maritime surveillance systems,control-command-information system,national security,fusion algorithms,integrated systems laboratory,ISL,Surveillance,AI,Tools,learning (artificial intelligence),time filtering,forensics tools,"
"generating bunkering statistics from ais data: a machine learning approach","2021","In shipping, the optimization of the bunkering location is dependent on price, deviation from the planned route and the cost of delays incurred by the bunkering operation itself. Despite their potential importance, detailed statistics for bunkering operations at the individual port call level (e.g. waiting times, barge capacity, location - anchorage or terminal) are not available. I develop a new method, based on the Density-Based Spatial Clustering of Applications with Noise (DBSCAN) algorithm, that can a) identify tanker vessels used as bunkering tankers, b) detect stationary ocean-going vessels at anchorage or alongside terminals and c) automatically recognize bunkering operations as a rendezvous between an ocean-going vessel and a bunkering barge. I find that the high time complexity of the DBSCAN algorithm in this setting can be compensated by adjusting the algorithm to distributed computer settings. In the empirical study, I use the output to describe the relative importance of Mediterranean ports for bunkering and provide statistics on waiting and servicing times. The empirical findings are important for the optimization of the bunkering location decision in shipping and studies on regional port competitiveness.","Bunkering operations,Bunkering statistics,DBSCAN,Machine learning,Spatial recognition,"
"data augmentation method of object detection for deep learning in maritime image","2020","Maritime object detection is an essential element for the situational awareness in autonomous ships. Recently, as the deep learning technology evolves, the attempt that the ship recognize the surrounding environment by using deep learning technology is gradually increasing. Deep learning methods, however, require a lot of data, but lack a publicly available dataset for object detection in the maritime domain. In this paper, we proposed a data augmentation method that can automatically extend the object detection dataset in maritime image. Extract the mask of the foreground object and combine it with the new background to automatically generate the location information and data of the object. Through the proposed method, we can learn high quality data by configuring various limited data features.","object detection dataset,robot vision,Marine vehicles,ship,Machine learning,Conferences,data features,Feature extraction,maritime object detection,data augmentation method,deep learning methods,ships,object detection,feature extraction,publicly available dataset,maritime domain surveillance,situational awareness,deep learning technology,deep-learning,maritime image,mobile robots,Object detection,Data mining,data augmentation,learning (artificial intelligence),Detectors,autonomous ships,"
"a novel technique to identify ais transmissions from vessels which attempt to obscure their position by switching their ais transponder from normal transmit power mode to low transmit power mode","2022","Automatic Identification Systems (AIS) are transponder systems installed on marine vessels which transmit the location, speed and other vessel details. These signals are received by shore side AIS Base stations. The use of AIS is mandatory under international SOLAS regulations for certain categories of vessels. AIS is used to monitor for pollution, search and rescue (SAR) and illegal fishing activity. Some vessel operators deliberately interfere with their AIS transponders, including spoofing their real position or switching their AIS transponder to low transmit power, to reduce the likelihood of being detected but still being in compliance with SOLAS regulations. This might suggest that they are involved in nefarious activity. This paper presents a technique to detect vessels which are switching their Class-A, AIS transponders from normal transmit power to low transmit power mode, by utilising the Received Signal strength Indicator field (RSSI) that the receiving Base Station tags incoming AIS messages with. The technique presented, analyses received RSSI in combination with predicted RSSI values via mathematical modelling and presents a unique detection algorithm. Data from the Irish National AIS was used for the study. Although only a small amount of testing was carried out, results showed that for a test vessel which switched its transponder to low power transmit mode, it was found that a specific drop in RSSI of approximately 10 dBm (decibel-milliwatts) was detectable for different distances from the receiving base station.","AIS spoofing,Received signal strength indicator,Low transmit power,Sybil attack,Automatic identification system,"
"maritime anomaly detection of malicious data spoofing and stealth deviations from nominal route exploiting heterogeneous sources of information","2021","Based on a proper stochastic formulation of the vessel dynamic, exploiting piecewise Ornstein-Uhlenbeck (OU) mean-reverting processes, we propose an effective anomaly detection procedure to jointly reveal Automatic Identification System (AIS) data spoofing and/or surreptitious deviations from the planned route. Supported by reliable information from monitoring systems (coastal radars and spaceborne satellite sensors), an expanded five-hypothesis testing problem is posed involving two anomaly detection strategies based on the Generalized Likelihood Ratio Test (GLRT) and the Model Order Selection (MOS) methodologies.","vessel dynamic,maximum likelihood estimation,spaceborne satellite sensors,piecewise Ornstein-Uhlenbeck mean-reverting processes,generalized likelihood ratio test,model order selection,five-hypothesis testing problem,Sensor systems,Automatic Identification System data spoofing,monitoring systems,security of data,maritime security,Sea measurements,Stochastic processes,maritime situational awareness,target tracking,GLRT,stealth deviations,Ornstein-Uhlenbeck process,automatic identification system,marine engineering,stochastic processes,nominal route,stochastic formulation,data spoofing,Gaussian processes,Radar tracking,maritime anomaly detection,coastal radars,Maritime anomaly detection,MOS,multiple statistical hypothesis test,Sensors,heterogeneous information sources,Spaceborne radar,Radar detection,"
"intelligent maritime surveillance framework driven by fusion of camera-based vessel detection and ais data","2022","Efficient maritime surveillance is necessary for navigation, which usually uses cameras to capture the vessels. However, the information in camera-based data is limited. In this work, we propose a novel intelligent maritime surveillance framework driven by the fusion of camera-based vessel detection and Automatic Identification System (AIS) data. Firstly, we employ a vessel detection network to get the relative positions of the vessels from the calibrated camera-based data. Meanwhile, we design a series of filters based on data completeness, detection range, and vessel course to exclude the invalid AIS data. In the end, we propose a data fusion module based on estimating the time when the vessel arrive at the specific position. According to the experiment on our collected dataset, the proposed framework performs competitively in diversified scenes. The mean absolute distance deviation of the estimation is less than 30 meters, and the accuracy of data fusion is 81.423%.","surveillance,sensor fusion,Automatic Identification System data,data acquisition,medical image processing,intelligent maritime surveillance framework driven,vessel detection network,image fusion,marine safety,invalid AIS data,cameras,object detection,camera-based vessel detection,Video surveillance,Data integration,detection range,Matched filters,Fuses,calibration,vessel course,Navigation,calibrated camera-based data,image segmentation,efficient maritime surveillance,Meters,Estimation,data fusion module,"
"applying maritime wireless communication to support vessel monitoring","2017","This paper applies wireless communication technology using 2.4 GHz frequency in marine field to support Vessel Monitoring System, where it sails on the island and marine field that are not getting signal coverage from Base Transceiver Station (BTS) on land. Applying of Long Range (LR) WiFi with 2.4 GHz frequency is used as an extension of cost- effective data service on maritime wireless communications. Updates are in Long Range WiFi which is permanently on island or buoy so that can be shared by vessels in particular fishing vessels to transmit important information relating shipping activities such as vessel positions via Global Positioning System (GPS) on a mobile phone. The result is the system that can extend data connection up to 8 km.","Network architecture,cost- effective data service,fishing vessels,Long Range WiFi,radio transceivers,Antenna measurements,Monitoring,Global Positioning System,Mobile handsets,System analysis and design,Wireless communication,maritime wireless communication,Vessel Monitoring System,wireless communication technology,Maritime Wireless Communication,distance 8.0 km,ships,frequency 2.4 GHz,mobile radio,marine field,vessel positions,GPS,mobile phone,Base Transceiver Station,Wireless fidelity,marine communication,BTS,signal coverage,wireless LAN,"
"machine learning-assisted anomaly detection in maritime navigation using ais data","2020","The automatic identification system (AIS) reports vessels' static and dynamic information, which are essential for maritime traffic situation awareness. However, AIS transponders can be switched off to hide suspicious activities, such as illegal fishing, or piracy. Therefore, this paper uses real world AIS data to analyze the possibility of successful detection of various anomalies in the maritime domain. We propose a multi-class artificial neural network (ANN)-based anomaly detection framework to classify intentional and non-intentional AIS on-off switching anomalies. The multi-class anomaly framework captures AIS message dropouts due to various reasons, e.g., channel effects or intentional one for carrying illegal activities. We extract position, speed, course and timing information from real world AIS data, and use them to train a 2-class (normal and anomaly) and a 3-class (normal, power outage and anomaly) anomaly detection models. Our results show that the models achieve around 99.9% overall accuracy, and are able to classify a test sample in the order of microseconds.","security of data,maritime traffic situation awareness,multiclass anomaly framework,pattern classification,multiclass artificial neural network,AIS message dropouts,neural nets,illegal fishing,learning (artificial intelligence),illegal activities,ships,automatic identification system,marine engineering,machine learning-assisted anomaly detection,maritime navigation,AIS transponders,"
"unsupervised maritime traffic pattern extraction from spatio-temporal data","2015","Maritime traffic pattern extraction is a fundamental and crucial factor for maritime surveillance and anomaly detection. Emerging technologies like Automatic Identification System (AIS) provides multi-dimensional data which is used to construct a maritime traffic model. In this paper, we propose a framework of maritime traffic pattern extraction from vessel AIS information, which learns a traffic pattern using an unsupervised technique, and can be applied on historical Automatic Identification System data. AIS data is a kind of spatio-temporal data that contains information of location data, as well as time stamps. In this way, traffic pattern is described by AIS data. Furthermore, we conduct a simulation experiment that extracts traffic pattern from the AIS data through the unsupervised technique. The proposed framework takes advantage of AIS data, which is a type of the spatiotemporal data that consists of vessel motion information, to perform the experiment. The result shows that the unsupervised framework converts useful information from raw AIS data to effective traffic pattern. The proposed method strongly supports the further research on maritime traffic pattern extraction of AIS data. Besides, an overview of the framework and the unsupervised technique for high-level maritime situation awareness is presented.","Traffic control,Clustering algorithms,unsupervised learning,anomaly detection,Marine vehicles,vessel AIS information,spatiotemporal data,data analysis,ships,automatic identification system,marine engineering,Automatic Identification System,maritime traffic pattern,AIS,maritime surveillance,Data models,feature extraction,Classification algorithms,identification,Trajectory,maritime situation awareness,maritime traffic pattern extraction,density-based clustering,Data mining,"
