"name","year","abstract","keywords"
"interference awareness and characterization for gnss maritime applications","2018","An international maritime measurement campaign was done to detect and record radio frequency interferences in the Satellite Navigation frequency bands. The system, installed on a large container ship, consists of a conformal seven elements antenna array, an ad-hoc data recorder system and a multi-antenna navigation receiver prototype. In this paper, a detection and analysis methodology is proposed and pertinent results of three months of measurements are shown.","GNSS interference awareness,Antenna arrays,container ship,Antenna measurements,conformal seven elements antenna array,marine navigation,Radio navigation,time 3.0 month,ships,satellite navigation,ad-hoc data recorder system,Global Navigation Satellite System (GNSS),GNSS maritime applications,radiofrequency interference,radio frequency interferences,satellite navigation frequency bands,international maritime measurement campaign,Maritime Navigation,multiantenna navigation receiver prototype,Receivers,Radio Frequency Interference (RFI),Cybersecurity,Interference,Global navigation satellite system,"
"textual risk mining for maritime situational awareness","2014","In this paper, we propose an auxiliary Machine Learning (ML) and Natural Language Processing (NLP) integrated system for maritime situational awareness (MSA) operations. We bring into account a new and influential asset - human intuition and perception - to the existing semi-automated decision support systems that mostly rely on numerical data collected by electronic sensors or cameras located either directly on the vessels or in the maritime command-and-control centers. For our project, we gathered weekly textual reports spanning twelve months from the United States Worldwide Threats to Shipping Reports repository that belongs to the National Geospatial-Intelligence Agency (NGA), We considered the maritime incident reports written by human operators as a valuable and accessible unstructured textual input source in which a span of text1 is called â€œriskâ€ if it expresses one of the following kinds of vessel incidents: fired, robbed, boarded, hijacked, attacked, chased, approached, kidnapped, boarding attempted, suspiciously approached or clashed with. Our approach benefits from probability distributions of some useful features annotated based on a list of lexicons that contain expressions denoting vessel types, risks types, risk associates, maritime geographical locations, dates and times. These distributions are captured and used to anchor the span of â€œrisksâ€ as they are described in the textual reports. After some preprocessing steps that include tokenization, named entity extraction and part-of-speech tagging, the textual risk mining system applies a variety of sequence classification algorithms, e.g., Conditional Random Fields, Conditional Markov Models and Hidden Markov Models in order to compare the risk classification performance. Empirical results show that our NLP/ML-based system can extract variable-length risk spans from the textual reports with about 90% correctness.","Markov processes,decision support systems,hidden Markov models,statistical distributions,tokenization,Risk management,attacked vessel incident,human intuition,Hidden Markov models,maritime geographical locations,conditional Markov models,maritime domain awareness,maritime command-and-control centers,Feature extraction,natural language processing,chased vessel incident,entity extraction,variable-length risk span extraction,maritime incident reports,maritime situational awareness,sequence classification algorithms,conditional random fields,robbed vessel incident,electronic sensors,United States worldwide threats to shipping reports repository,maritime situational awareness operation,fired vessel incident,marine safety,National Geospatial-Intelligence Agency,marine engineering,boarded vessel incident,feature annotation,machine learning,semiautomated decision support systems,cameras,part-of-speech tagging,risk management,NLP/ML-based system,Classification algorithms,probability distributions,risks types,risk classification performance,textual risk mining system,weekly textual reports,auxiliary ML,auxiliary machine learning,hijacked vessel incident,command and control systems,vessels,human perception,vessel types,MSA operation,kidnapped vessel incident,risk associates,risk detection,NGA,text analysis,boarding attempted vessel incident,approached vessel incident,Data mining,learning (artificial intelligence),sequence-based classifiers,"
"sea surface height measurements using a low-cost gnss buoy with multiple gnss receivers","2023","Accurate Sea surface height (SSH) measurements are important for global climate change and sea level rise monitoring. Satellite altimeters can provide global coverage observations but with coarse temporal and spatial resolution, while tide gauges offer high-precision measurements but are limited to coastal regions. The advent of Global Navigation Satellite System (GNSS) buoys bridge the gap between the tide station and the satellite altimeter, which realize continuous and reliable absolute SSH measurements in the coastal zone. However, most of buoys are equipped with GNSS geodetic receivers and antennas, which are expensive and with high power consumption. The emergence of low-cost receivers has been applied in fields such as autonomous driving and disaster monitoring, yet low-cost receivers suffer precision limitations due to signal quality issue in the harsh marine environment. To solve the reliability issue of low-cost receivers in SSH measurements, firstly, a low-cost buoy platform with four dual-frequency receivers is designed in this contribution. GNSS antennas are installed on the four corners of a square with a side length of 1.180 m, and the total power consumption is less than 4 W. Additionally, a robust outlier detection method, the Geometric Constraint algorithm, is proposed to improve the reliability and accuracy of GNSS SSH results. The performance of our buoy was validated in Jingye Lake at Tianjin University on April 30, 2022, and another experiment was conducted in Bohai Bay, Tianjin, on August 20, 2022, to assess the performance of a self-developed MG-Buoy for SSH measurement under real oceanic conditions. The experimental results indicate that the precision of single-frequency SSH measurement is 0.91 cm using the GNSS Post Processed Kinematic (PPK) technique with a single antenna, while the dual-frequency can achieve 0.50 cm accuracy. After adopting the Geometric Constraint method, the measurement accuracy of single-frequency and dual-frequency SSH values are 0.49 cm and 0.40 cm, respectively, representing a 46.2% and 20.0% improvements compared to the root mean square (RMS) value for the single GNSS antenna.","Geometric Constraint,Sea surface height,Attitude measurements,Multiple GNSS receivers,Low-cost,Buoy,"
"changes in maritime traffic patterns according to installation of floating lidar using spatial analysis","2023","Recently, with the development of marine space around the world, friction between maritime traffic and various marine activities is intensifying. In particular, different recommendations are being made for the buffer zone between offshore wind farms and maritime traffic, as the criteria vary significantly. In order to respond to these changes in marine space, conducted this study on the change of maritime traffic patterns before and after the installation of floating LiDAR (Light Detection And Ranging) in marine facilities and apply it to future changes in maritime traffic patterns. The maritime traffic data was based on Automatic Identification System (AIS) data, and it was targeted at cargo ships and tankers with regular traffic patterns. A trajectory and spatial analysis were performed based on the AIS in the marine space. As a result of analyzing the globally maritime traffic patterns targeting the location of the installation complex of LiDARs, it can be confirmed that the existing maritime traffic patterns change into three maritime traffic patterns. Furthermore, the study employed the Hausdorff-distance algorithm for clustering analysis, categorizing vessels with similar trajectories. This approach facilitated a locally analysis of the buffer zone associated with individual LiDAR, considering the length of the vessels. As a result, it was analyzed that each vessel navigated at different buffer zone depending on the size of the vessel, and it is possible for safe navigation and forecast the future maritime traffic patterns.","Traffic control,Maritime traffic,maritime traffic data,buffer zone,Marine vehicles,wind power plants,globally maritime traffic patterns,Laser radar,marine space,existing maritime traffic patterns change,ships,marine safety,marine engineering,Wind farms,marine facilities,Oceans,regular traffic patterns,pattern clustering,Artificial intelligence,offshore installations,optical radar,future maritime traffic patterns,telecommunication traffic,spatial analysis,automatic identification system (AIS),Analytical models,"
"making sense of heterogeneous maritime data","2022","While an abundance of real-time maritime information exists and is readily available to monitoring authorities, there are still many instances in which ships are found to be engaged in dangerous or illegal activities. In order to prevent such activities, authorities employ Vessel Traffic Services systems since they promote safety at sea while also assisting in management of ports. In this paper we report on research done in cooperation with Denbridge Marine Ltd., a global provider of maritime solutions, and present an application integrated in a Vessel Tracking Services system that allows the detection of normal vessel activity as well as dangerous or illegal situations in real-time, using information from the Automatic Identification System, a radar sensor and other information. We use a set of phenomena representing maritime activities of interest in the language of Phenesthe, our Complex Event Processing engine, and detect them on real maritime data streams from the area of Liverpool, United Kingdom. We evaluate our application and show that our system is capable of detecting and visualising maritime activities on the map in real time. Finally, we study and demonstrate the significance of using data from the Automatic Identification System along with radar data for maritime monitoring.","RADAR,complex event processing engine,Safety,vessel tracking services system,complex event processing,Marine vehicles,radar data,vessel traffic services systems,temporal logic,ships,automatic identification system,marine safety,marine engineering,AIS,Seaports,heterogeneous maritime data monitoring,Radar tracking,Real-time systems,Data visualization,maritime monitoring,condition monitoring,United Kingdom,Radar detection,"
"study of the classification task into an integrated multisensor system for maritime border control","2008","This work focuses on the classification task performed into a multi-sensor system for the coastal surveillance. The system is composed of two platforms of sensors: a land based platform, equipped with a land based radar, an Automatic Identification System (AIS) and an infrared camera (IR); an airborne platform, carrying an airborne radar that can operate in a spotlight Synthetic Aperture Radar (SAR) mode, a video camera, and a second IR camera. The tasks performed by the system are the detection, tracking, identification, and classification of multiple targets, the evaluation of their threat level, and the selection of an intervention on them. The classification algorithm implemented inside the system exploits an analytical approach based on the confusion matrix (CM) of the imaging sensors that belong to the system. Some measures of effectiveness (MoE) of the system are evaluated, considering both the cases where an ideal error free classification process and a non-ideal classification process are performed.","airborne radar,classification,sensor fusion,second IR camera,measures of effectiveness,matrix algebra,Cameras,Sensor systems,multiple target tracking,Infrared sensors,Sea measurements,multi-sensor data fusion,Synthetic aperture radar,error free classification process,maritime border control,integrated multisensor system,target tracking,confusion matrix,automatic identification system,Performance evaluation,Multisensor systems,telecommunication congestion control,synthetic aperture radar,search radar,land based platform,radar imaging,sensor imaging,coastal surveillance,Airborne radar,video camera,Automatic control,Control systems,land based radar,video cameras,"
"a framework for discovering maritime traffic conflict from ais network","2017","Thanks for the common use of Automatic Identification System (AIS) network has made a large number of the maritime traffic data to be available. Ships equipped with AIS automatically exchange navigational information with nearby ships and terrestrial AIS receivers to facilitate the tracking and monitoring of ships' location and movement for collision avoidance and control. Obviously, with increasing amount of maritime shipping traffic, the navigational collisions are one of the growing safety concerns in maritime traffic situation awareness. To understand the collision situations can help the maritime traffic managers to improve the safety control of maritime traffic. However, it is difficult to statistically analyze such collision due to the number of collected real cases of collisions are relatively low within a short period of time. To overcome the problem of low sample size, we discover traffic conflict from data collected by AIS network to substitute the real collision. Given a set of maritime traffic data collected from AIS network, we try to discover ships' movements that have conflict behaviors and these behaviors may bring a possible collision if they do not take any evasive action. We propose a framework of Clustering-and-Detection to automatically discover the clusters of conflict trajectory from AIS trajectory data in an unsupervised way. Based on real AIS data, the experimental results show that the proposed framework is able to effectively discover sets of trajectory with conflict situation from maritime AIS traffic data. The statistical analysis on the discovered sets of conflict trajectory is able to provide useful knowledge for maritime traffic monitoring.","maritime traffic situation awareness,maritime traffic monitoring,maritime shipping traffic,maritime traffic conflict,maritime AIS traffic data,collision situations,Safety,maritime traffic data,Automatic Identification System network,Marine vehicles,AIS network,ships,marine safety,marine engineering,real AIS data,terrestrial AIS receivers,pattern clustering,Trajectory data mining,Artificial intelligence,safety control,conflict behaviors,clustering-and-detection,AIS data,Roads,Trajectory,conflict trajectory,conflict situation,Conflict detection,Maritime traffic data,Navigation,navigation,nearby ships,collision avoidance,Data mining,navigational collisions,maritime traffic managers,Navigation collision,"
"application of track-before-detect techniques in gnss-based passive radar for maritime surveillance","2019","GNSS-based passive radar has been recently proved able to enable moving target detection in maritime surveillance applications. The main restriction lies in the low Equivalent Isotropic Radiated Power (EIRP) level of navigation satellites. Extending the integration times with proper target motion compensation has been shown to be a viable solution to improve ship detectability, but this involves computational complexity and increasing sensitivity to motion model mismatches. In this work, we consider the application of a Track-Before-Detect (TBD) method to considerably increase the integration time (and therefore the detection capability) at the same time keeping the computational complexity affordable by practical systems. Dynamic programming TBD algorithms have been specialized for the considered framework and tested against experimental dataset. The obtained results show the effectiveness of this approach to improve the detection capability of the system despite the restricted power budget.","Satellites,moving target detection,long-integration time,marine radar,radar detection,passive radar,track-before-detect,Program processors,ship detectability,satellite navigation,track-before-detect techniques,maritime surveillance,Target tracking,track-before-detect method,search radar,motion model mismatches,Radar tracking,Doppler effect,integration time,radar tracking,low equivalent isotropic radiated power level,maritime surveillance applications,restricted power budget,Passive radar,marine communication,GNSS-based passive radar,Surveillance,detection capability,target motion compensation,"
"multi-armed bandits scheme for tasks offloading in mec-enabled maritime communication networks","2020","Driven by the advancement of science and technology, the issue of marine ship Internet of Things (IoT) users' assignment of computing tasks offloading has become more and more challenging. When faced with the complex and dynamic marine environment, considering the different quality requirements of maritime applications, we have addressed this issue in this paper. We first propose the space-air-ground-edge (SAGE) maritime communication network architecture. This novel architecture is used to offload computing-intensive applications and services for IoT users in the marine environment. At the same time, based on the Multi-Armed Bandits (MAB) problem, considering budget constraints and other marine environmental conditions such as delay and energy consumption, we propose an algorithm for selecting an edge server strategy. Simulation results of this paper show that the scheme has a better performance under different quality of service (QoS) requirements, which proves that the scheme is effective.","edge intelligence,space-air-ground-edge maritime communication network architecture,marine environmental conditions,IoT users,Internet of Things,quality of service,computing tasks offloading,maritime communications networks,resource intensive applications,Communication networks,ships,Quality of service,Servers,MultiArmed Bandits problem,marine engineering,mobile computing,mobile edge computing,Computer architecture,marine ship Internet of Things,quality of service requirements,task offloading,marine communication,computing intensive applications,Simulation,Multi-Armed Bandits,Task analysis,MEC enabled maritime communication networks,resource allocation,"
"sigmar: ensuring integrity and authenticity of maritime systems using digital signatures","2021","Distributed maritime bridge systems are customary standard equipment on todayâ€™s commercial shipping and cruising vessels. The exchange of nautical data, e.g., geographical positions, is usually implemented using multicast network communication without security measures, which poses serious risks to the authenticity and integrity of transmitted data. In this paper, we introduce digital SIGnatures for MARitime systems (SIGMAR), a low-cost solution to seamlessly retrofit authentication of nautical data based on asymmetric cryptography. Extending the existing IEC 61162-450 protocol makes it is possible to build a backward-compatible authentication mechanism that prevents common cyber attacks. The development was successfully accompanied by permanent investigations in a bridge simulation environment, including a maritime cyber attack generator. We demonstrate SIGMARâ€™s feasibility by introducing a proof-of-concept implementation on low-cost and low-resource hardware and present a performance analysis of our approach.","SIGMAR,customary standard equipment,IEC Standards,computer network security,local area networks,distributed maritime bridge systems,Position measurement,NMEA 0183,multicast network communication,security measures,IEC standards,Authentication,IEC 61162-450,Bridges,cruising vessels,data recording,telecommunication standards,digital signatures,Maritime Cyber Security,ships,Performance analysis,Hardware,backward-compatible authentication mechanism,Integrity,geographical positions,low-resource hardware,common cyber attacks,IEC 61162-450 protocol,bridge simulation environment,cryptographic protocols,marine communication,Protocols,maritime cyber attack generator,nautical data authentication,commercial shipping,"
"towards case-based reasoning for maritime anomaly detection: a positioning paper","2009","",""
"maritime border security using sensors, processing, and platforms to detect dark vessels","2018","Maritime security is critical to national prosperity, but with a large area to be secured and limited resources available, our current maritime situational awareness is not sufficient to secure our borders. This challenge is compounded by the fact that many bad actors intentionally avoid using transponders to obscure their location and actions for nefarious purposes. New solutions are required to detect these â€œdarkâ€ vessels in the expansive maritime domain and thereby enable increased maritime situational awareness and security. In this paper, we present a concept for increased maritime situational awareness, specifically designed to secure our borders against dark vessels using a novel combination of existing technologies. Our concept is Sensors and Platforms for Unmanned Detection of Dark Ships (SPUDDS), which consists of our intelligent ship detection and classification software integrated onboard our autonomous long-duration sensor buoy, which provides long-range passive detection of non-emitting dark vessels for maritime situational awareness.","long-duration sensor buoy,long-range passive detection,intelligent ship classification software,classification,autonomous long-duration sensor buoy,detection,nonemitting dark vessel detection,maritime border security,Marine vehicles,dark ships,maritime security,maritime situational awareness,Meteorology,SPUDDS,dark vessel detection,ships,intelligent sensors,intelligent ship detection,Sea surface,Software,sensors and platforms for unmanned detection of dark ships,unmanned systems,security,Detectors,"
"estimation of the contributions of the sources driving pm2.5 levels in a central mediterranean coastal town","2018","Receptor modelling techniques are widely used in order to identify the main natural and anthropogenic processes driving aerosol levels at a receptor. In this work, Positive Matrix Factorization (PMF) was used to apportion PM2.5 levels at a traffic site (Msida) located in a coastal town. 180 filters collected throughout a yearly sampling campaign conducted in 2016, were chemically characterized by light absorbance analysis, x-ray fluorescence and ion chromatography in order to determine the concentrations of black carbon, 17 elements and 5 ions, respectively. The resulting chemical data base was used in conjunction with PMF in order to identify the 7 components affecting the PM2.5 levels at the receptor site. Six of these sources are considered to be typical of the atmospheric composition of coastal traffic sites: traffic (27.3%), ammonium sulfate (23.6%), Saharan dust (15%), aged sea salt (12.7%), shipping (5%) and fresh sea salt (4.6%). This is the first time that such a study was carried out in Malta and helps in understanding the aerosol pollution climate of the Central Mediterranean, which is still relatively understudied when compared to the Eastern and Western Mediterranean. Furthermore, we have isolated a factor exclusive to Malta: the fireworks component, which is responsible for 2.9% of the PM2.5 and which has health implications due to its chemical composition. The results of this work should also serve to guide the policy makers in achieving the necessary emission reductions in order to achieve the WHO guideline for PM2.5 by 2020.","PM,Positive matrix factorization,Natural aerosol sources,Anthropogenic aerosol sources,Source apportionment,Central mediterranean,"
"the canadian maritime coastal defence vessel (mcdv) and the integrated survey and inspection system","1993","Canada's new Maritime Coastal Defence Vessels will be the first naval ships to be fitted with a ground-breaking new Mine Countermeasures system. The system provides the capability to: acquire sonar images of the seabed with the highest combination of area coverage rate and resolution; accurately geographically position and geocode the sonar image data; store all acquired image data in a geographically keyed database; perform target detection and classification using change detection and inspect suspicious objects using a Remotely Operated Vehicle.<>","position measurement,Remotely operated vehicles,MCDV,Inspection,Sonar detection,geographic positioning,target detection,Marine vehicles,geographically keyed database,acoustic imaging,Business,Sea measurements,military systems,Intersymbol interference,Canadian Maritime Coastal Defence Vessel,naval ships,geocoding,Payloads,ships,sonar image data,ISIS,Mine Countermeasures,sonar,telecommunications computing,integrated survey and inspection system,seabed,Image resolution,Surveillance,target classification,Remotely Operated Vehicle,"
