"name","year","abstract","keywords"
"insights and guidance for offshore co2 storage monitoring based on the qics, eti mmv, and stemm-ccs projects","2020","Carbon Capture and Storage (CCS) is a collective term for technologies that allow society to unlock the benefits of energy intensive processes like fertiliser production and combustion of fuels (fossil or biologically sourced) without releasing the CO2 to the atmosphere. Hence, CCS could assist in accelerating decarbonisation while society pursues a just energy transition. This paper aims to summarise the learnings of three research projects that all investigated aspects of marine monitoring for CCS from a CO2 storage operator’s perspective. The QICS (Quantifying and Monitoring Potential Ecosystem Impacts of Geological Carbon Storage), ETI MMV (Energy Technologies Institute Measurement, Monitoring and Verification of CO2 Storage), and STEMM-CCS (Strategies for Environmental Monitoring of Marine CCS) projects collectively represent over twelve years of dedicated research to assess environmental impacts and to develop technologies for detection, location, and quantification of potential leakage from offshore geological storage of CO2. Each project used controlled releases in representative environments to test their methods and technologies. QICS as the first of the three projects, focused on the understanding of sensitivities of the UK marine environment to a potential leak from a CO2 storage complex and tested technologies to detect such emissions. The ETI MMV project brought together research and industry partners to develop and sea trial an operational, integrated and cost-effective marine monitoring system for geological CO2 storage. As a commercial project, these results have never been published before and this paper shares for the first-time insights from this work. In February 2020, STEMM-CCS, completed its quest to test techniques for environmental monitoring over a marine CO2 storage site in the UK North Sea, further improved near seabed leakage characterisation capabilities, and delivered a first marine CCS demonstration level ecological baseline. This paper aims to summarise some of the key insights from the three projects and provides references where available for the interested reader. The key finding of all three projects is that the impacts of small to medium CO2 leakages from large-scale storage are limited and localised. Technology capabilities exist for integrated marine CO2 storage monitoring and their performance has been benchmarked at controlled release trials. Even small leakages of 10−50 L/min can be detected at unknown locations in a large area of interest. Finally, the first important steps towards automated monitoring data analysis have been made, including automated leakage signal detection from Side Scan Sonar data (ETI MMV project) and automated species identification from marine biology images (STEMM-CCS project). Some remaining challenges include missed/false alerts because of large variations in the background signal, the cost of monitoring large areas over long periods, and making real-time decisions based on big data. Continued work to reduce the cost of marine monitoring technologies and advancing automation of data processing and analysis will be important in order to support safe and efficient offshore CCS deployment at large scale.","CCS,Location,Offshore CO2 storage,Regulation,Impact assessment,Quantification,Monitoring,Verification,Detection,Attribution,"
"low-cost, intelligent drifter fleet for large-scale, distributed ocean observation","2022","We have developed Persistent Environmental Awareness Reporting and Location (PEARL) ocean drifters. PEARL drifters are small, rugged, low-cost, autonomous, environmentally friendly ocean drifters that represent a significant opportunity for high-impact applications in both national security and environmental ecosystem monitoring. Drifters record and report data which is processed by advanced edge analytics before being compressed for satellite transmission to populate a large data repository with sensor data that is combined and analyzed to discover signals of interest in the ocean environment with the goal of increasing distributed maritime awareness. Each drifter is entirely self-contained, powered by solar panels and backup batteries, with a large array of sensors, compute module for onboard data processing, and satellite modem for data reporting. The drifter architecture is flexible and can be customized for a specific purpose. The complete data record is stored locally and processed by the onboard compute module, which runs anomaly detection algorithms that detect nearby activity. Anomalous events, as well as baseline environmental data, are reported to a cloud database using satellite short burst data transmission. Though each independent drifter is a powerful sensing tool, the low unit cost permits large scale deployment. To date thousands of drifters have been deployed over vast areas of the ocean and are reporting data to a remote database where cloud-based analytics algorithms develop global situational awareness and update local edge algorithms on the drifters based on learnings across the full network.","Satellites,data reporting,remote sensing,distributed ocean observation,complete data record,environmental ecosystem monitoring,Location ocean drifters,lagrangian drifter,intelligent drifter fleet,high-impact applications,anomaly detection,maritime domain awareness,drifter architecture,Persistent Environmental Awareness Reporting,Distributed databases,environmental data,vessel tracking,satellite communication,marine systems,Turning,oceanographic equipment,sensor data,advanced edge analytics,onboard compute module,cloud computing,ocean circulation,baseline environmental data,satellite transmission,Oceans,geophysics computing,data reduction,ocean environment,maritime awareness,satellite modem,data repository,edge processing,PEARL drifters,oceanographic regions,onboard data processing,Roads,cloud-edge algorithms,Cloud computing,national security,satellite short burst data transmission,Sensors,environmentally friendly ocean drifters,oceanographic techniques,"
"the declining impact of piracy on maritime transport in the indian ocean: statistical analysis of 5-year vessel tracking data","2015","The analysis of the declining impact of piracy on maritime routes and vessel behaviours in the Indian Ocean is here performed using Long Range Identification and Tracking (LRIT) reports. A 5-year archive of vessel position data covering the period characterized by the highest number of attacks and the subsequent decline provides a unique source for data-driven statistical analysis that highlights changes in routing and sailing speeds. The work, besides demonstrating the value of LRIT data for statistical maritime traffic analysis, can be used to ultimately provide quantitative support to the estimates of the additional fuel consumption due to piracy. In showing the return of the North–South traffic to the shortest path, the results testify to the effectiveness of the efforts put in place against piracy in the Western Indian Ocean.","Maritime surveillance,Long Range Identification and Tracking (LRIT),Maritime piracy,Knowledge discovery,Maritime routes,"
"exploring ais data for intelligent maritime routes extraction","2020","Maritime traffic route is the basis for the analysis of ship traffic characteristics and navigation safety. However, the spatial freedom of ship navigation makes the extraction of maritime traffic route a challenging task. In order to realize the extraction of ship traffic routes at sea, a maritime route extraction method based on ship history automatic identification system (AIS) data is proposed. In this method, the ship trajectory with rich position information is transformed into a ship trip semantic object (STSO) with semantic information, and each ship trip is abstracted as a “stop-waypoint-stop” trip object. In addition, based on the graph theory, the STSO is further integrated into the nodes and edges of a directed maritime traffic graph to realize the extraction and expression of the shipping routes. In order to prove the effectiveness of this method, the real-world AIS historical data are used for testing, and the results show that this method can effectively extract maritime traffic routes.","Automatic Identification System (AIS),Semantic trajectory,Shipping route,Maritime traffic,Graph theory,"
"modelling and simulation on stopping motion based on propeller c-series in maritime simulator","2021","In order to improve the simulation accuracy of stopping motion of twin-propeller twin-rudder ship in maritime simulator, a new propeller map was used. The formulas were regressed by figures of Propeller C-series, which is proposed by Maritime Research Institute Netherlands(MARIN) for controllable pitch propellers(CPP). The thrust coefficient and torque coefficient of different pitch angle and pitch ratio were obtained by regression equation. The mathematical model of the ship motion was established based on separated modelling method. The resistance model was established and calculated by the Lap-Keller chart. The simulation tests were carried out both by MATLAB and simulator testing programs. The results were compared with real ship test data, which showed a great performance. The Propeller C-Series can significantly improve the simulation accuracy of the ship stopping motion in maritime simulator.","Controllable Pitch Propellers,ship stopping motion,CPP,propeller map,regression equation,MATLAB programs,Mathematical models,propeller C-series,Propellers,controllable pitch propellers,separated modelling method,ship test data,regression analysis,mathematical model,Mathematical Model of Ship,Propeller C-series,simulator testing programs,torque,ships,Lap-Keller chart,Torque,Maritime Simulator,twin-propeller twin-rudder ship,propellers,thrust coefficient,resistance model,mechanical engineering computing,Propulsion,pitch control (position),Resistance,Maritime Research Institute Netherlands,mathematical analysis,pitch ratio,Computational modeling,maritime simulator,pitch angle,Analytical models,torque coefficient,"
"the aleutian low, storm tracks, and winter climate variability in the bering sea","2007","Previous studies have found inconsistent results regarding how wintertime conditions in the Bering Sea relate to variations in the North Pacific climate system. This problem is addressed through analysis of data from the NCEP/NCAR Reanalysis for the period 1950–2003. Composite patterns of sea-level pressure, 500hPa geopotential heights, storm tracks and surface air temperature are presented for four situations: periods of strong Aleutian Low, weak Aleutian Low, warm Bering Sea air temperatures, and cold Bering Sea air temperatures. Winter temperatures in the Bering Sea are only marginally related to the strength of the Aleutian Low, and are much more sensitive to the position of the Aleutian Low and to variations in storm tracks. In particular, relatively warm temperatures are associated with either an enhanced storm track off the coast of Siberia, and hence anomalous southerly low-level flow, or an enhanced storm track entering the eastern Bering Sea from the southeast. These latter storms do not systematically affect the mean meridional winds, but rather serve to transport mild air of maritime origin over the Bering Sea. The leading indices for the North Pacific, such as the NP and PNA, are more representative of the patterns of tropospheric circulation and storm track anomalies associated with the strength of the Aleutian Low than patterns associated with warm and cold wintertime conditions in the Bering Sea.","Aleutian Low,Winds,Storm tracks,North Pacific,Bering Sea,Climate variability,"
"a bernoulli track-before-detect filter for interacting targets in maritime radar","2021","This article is devoted to the problem of multitarget tracking in the maritime environment using Bernoulli track-before-detect (TBD) filtering. Detection and tracking of weak targets in sea clutter using high-resolution airborne radar is notoriously challenging compared to classical target tracking problems. Furthermore, the measured amplitude in range-azimuth cells that are in the vicinity of closely spaced (interacting) targets represents a superposition of individual target contributions, demanding a special joint treatment. This article proposes a novel solution for multitarget tracking using Bernoulli TBD for maritime radar and covers cases when targets are both far apart and closely spaced. Comparisons with existing TBD algorithms are used to verify the efficacy of the proposed Bernoulli TBD algorithm with realistic sea clutter simulations used to create challenging scenarios with variable target strengths.","airborne radar,track before detect (TBD),existing TBD algorithms,radar detection,Maritime radar,radar clutter,high-resolution airborne radar,sea clutter,Sea measurements,weak targets,interacting targets,Noise measurement,Radio frequency,multitarget tracking,Bernoulli track-before-detect filtering,target tracking,filtering theory,Target tracking,object detection,closely spaced targets,Radar tracking,range-azimuth cells,Radar,interacting,radar tracking,maritime environment,individual target contributions,variable target strengths,Clutter,realistic sea clutter simulations,classical target tracking problems,Bernoulli track-before-detect filter,Bernoulli TBD algorithm,maritime radar,"
"spatio-temporal data mining for maritime situational awareness","2015","Maritime Situational Awareness (MSA) is the capability of understanding events, circumstances and activities within and impacting the maritime environment. Nowadays, the vessel positioning sensors provide a vast amount of data that could enhance the maritime knowledge if analysed and modelled. Vessel positioning data is dynamic and continuous on time and space, requiring spatio-temporal data mining techniques to derive knowledge. In this paper, several spatio-temporal data mining techniques are proposed to enhance the MSA, tackling existing challenges such as automatic maritime route extraction and synthetic representation, mapping vessels activities, anomaly detection or position and track prediction. The aim is to provide a more complete and interactive Maritime Situational Picture (MSP) and, hence, to provide more capabilities to operational authorities and policy-makers to support the decision-making process. The proposed approaches are evaluated on diverse areas of interest from the Dover Strait to the Icelandic coast.","synthetic representation,Trajectory,data mining,Synthetic aperture radar,maritime situational awareness,Safety,Ports (Computers),mapping vessels activities,maritime situational picture,Data mining,automatic maritime route extraction,spatio-temporal data mining,Security,Knowledge discovery,oceanographic techniques,"
"geochemical and stable isotopic variability within two rivers rising under the same mountain, but belonging to two distant watersheds","2013","Complementary geochemical and stable isotope investigations of the Gorski Kotar karst aquifer system in western Croatia were obtained for the first time, to answer the question whether both studied rivers drain the same aquifer system or not. The two main rivers, the Kupa and the Rječina, rise under the same mountain range, but belong to two different watersheds (Black Sea and Adriatic Sea). The karst aquifer of Gorski Kotar is a potentially important source of drinking water for two neighboring countries, Croatia and Slovenia (Central and South Europe), and is strongly influenced by both Mediterranean and continental weather conditions. It is a part of the Dinaric karst, which is “locus typicus” for karst worldwide and one of the most typical karst areas in the world. To answer the main question of our research, baseline data were thoroughly collected comprising stable isotopes, concentration of dissolved and total trace metals in water, and multi-elemental analyses of river sediments, together with other physical-chemical parameters (pH, dissolved oxygen, electric conductivity and temperature). Total dissolved solid (TDS) was not measured but estimated as (EC) 0.67. Such multi-technique approach was applied for the first time in the Dinaric karst systems. Multi-elemental analysis of fine sediment fraction (<63μm) of eight samples was performed by ICP-MS. Elemental composition of sediments is quite different in the two studied river valleys, which indicates different origin of their waters. Also, concentrations of selected metals were compared with existing sediment quality criteria and anthropogenic influence is evaluated and discussed. Analytical results of major ions determined in three springs (Kupa spring, Rječina spring, Zvir spring in the City of Rijeka) were used to construct a Piper diagram, which showed that they are of a Ca–Na–HCO3–Cl type. The highest concentration of Mg is present in the Kupa spring, while the highest concentrations of Na and Cl are present in the Zvir spring. Groundwaters are underlain by limestone, less by dolomite and are under a maritime influence. There is a big difference with the main groundwater types reported in North Africa, i.e. in the south Mediterranean Sea, where two main groundwater types are Na–Cl and Ca–SO4–Cl. Concentrations of total and dissolved fractions of trace metals in surface water samples were determined by voltammetry and compared to the European Water Framework Directive values. Concentrations of total Pb and Zn are significantly higher in the water of the Kupa spring than the Rječina spring, suggesting that the karst water bodies of the two springs are not of the same origin. In addition, stable isotope composition (deuterium and oxygen-18) was determined in the spring waters sampled during low and high water conditions. Due to the significant difference in oxygen isotope-ratios it was concluded that the karst reservoir for the Kupa and Rječina springs is not identical. The results obtained from the combination of physical–chemical, geochemical (water and sediment) and isotope multi-technique analyses pointed out that even though the springs of the Kupa and Rječina rivers originate from the same mountain range, they do not drain the same karst aquifer.","Risnjak National Park,Kupa and Rječina rivers (Croatia),Stable isotopes (deuterium and oxygen-18),Water quality,Transboundary karst aquifer,Perhumid climate,Sediment and water chemistry,Physical–chemical parameters,"
"satellite machine-type communication for maritime internet of things: an interference perspective","2019","Satellite machine-type communication plays a crucial role in the maritime Internet of Things. The realization of such a system, i.e., the VHF data exchange (VDES) satellite system, however, faces many technical challenges. Due to its global broadcasting nature, the interference generated from the emissions of the VDES satellite space stations to the incumbent or future land systems in the same band is of major concern to the International Telecommunication Union (ITU) spectrum allocation. However, neither regulatory rules nor related studies have been specified or made available in the literature regarding such interference. This paper utilizes the electromagnetic power flux density (PFD) mask concept for evaluating and constraining the emission onto earth from a satellite space station. The mathematical analysis and derivation are based on the principle that the actual interference from a space station that a land system experiences is no worse than that from any other land system allowed by the regulations. We demonstrate the derivation of such a PFD mask from three closely related regulations on the legacy land mobile systems by the Electronic Communications Committee (ECC) and ITU and present the corresponding constraints imposed on the VDES satellite system and their impacts on the performance of the system.","VDES satellite space station system,interference perspective,satellite machine-type communication,maritime machine-type communication,VHF data exchange satellite system,Internet of Things,Marine vehicles,satellite communication,electromagnetic PFD mask concept,Space stations,ITU,Electronic Communications Committee,e-navigation,electronic data interchange,Maritime Internet of Things,Artificial intelligence,space communication links,maritime Internet of Things,radiofrequency interference,ITU spectrum allocation,electromagnetic power flux density mask concept,Satellite broadcasting,ECC,mathematical analysis,land system experiences,land mobile systems,Interference,International Telecommunication Union spectrum allocation,"
"study of inland river maritime radar image gabor wavelet edge recognition based on direction adaptive","2015","To realize automatic extracting edge of bank and bridge from inland marine time radar image, the first step is to get the detection region and realize superposition with the electronic chart display system automatically. Image processing of the radar image should be done firstly, to get radar coastline and the edge of the bridge and location information. The basic way of image processing in the target extraction based on two extraction methods, morphology and color characteristic. Color feature is mainly suitable for color image target. Especially for clear goals, according to color component achieve target extraction. Morphological features for feature extraction. The main method is to realize the target of morphology through the preset or template matching target to get extraction. Maritime radar image without templates, the conventional extraction method is mainly been used in morphology to extract the target. Generally implemented to extract the linear through Hough transform, for the non linear characteristics of target used fractal way. Fractal needs through a large amount of data access to lines of latitude interval. Interval target extraction based on latitude, with large amount of calculation. In this paper, through combination of Hough transform to get the tendency of shoreline bridge information, we use the Gabor wavelet certain tendency feature of shoreline and Bridges to extract the target, in a certain extent, reduce the amount of calculation, and achieve the target of extraction.","Edge detection,Image edge detection,marine radar,Wavelet transforms,Feature extraction,Bridges,Filter,edge detection,image colour analysis,image matching,Gabor wavelet,Rivers,Hough transforms,color image target,electronic chart display system,conventional extraction method,feature extraction,maritime radar image,Connected domain,radar imaging,color feature,wavelet transforms,nonlinear characteristics,Radar imaging,Hough transform,interval target extraction,inland river maritime radar image Gabor wavelet edge recognition,image processing,Gabor filters,detection region,template matching,direction adaptive,"
"intelligent deep fusion network for anomaly identification in maritime transportation systems","2023","This paper introduces a novel deep learning architecture for identifying outliers in the context of intelligent transportation systems. The use of a convolutional neural network with decomposition is explored to find abnormal behavior in maritime data. The set of maritime data is first decomposed into similar clusters containing homogeneous data, and then a convolutional neural network is used for each data cluster. Different models are trained (one per cluster), and each model is learned from highly correlated data. Finally, the results of the models are merged using a simple but efficient fusion strategy. To verify the performance of the proposed framework, intensive experiments were conducted on marine data. The results show the superiority of the proposed framework compared to the baseline solutions in terms of several accuracy metrics.","maritime data,Transportation,Urban areas,homogeneous data,deep learning (artificial intelligence),highly correlated data,Anomaly detection,maritime transportation systems,transportation,smart and secure transportation systems,intelligent transportation systems,similar clusters,anomaly identification,simple but efficient fusion strategy,Data models,marine data,pattern clustering,convolutional neural network,convolutional neural nets,intelligent deep fusion network,Training,Convolutional neural networks,decomposition,Deep learning,data cluster,learning (artificial intelligence),deep learning architecture,Convolution neural network,"
