"name","year","abstract","keywords"
"societal need for improved understanding of climate change, anthropogenic impacts, and geo-hazard warning drive development of ocean observatories in european seas","2011","Society’s needs for a network of in situ ocean observing systems cross many areas of earth and marine science. Here we review the science themes that benefit from data supplied from ocean observatories. Understanding from existing studies is fragmented to the extent that it lacks the coherent long-term monitoring needed to address questions at the scales essential to understand climate change and improve geo-hazard early warning. Data sets from the deep sea are particularly rare with long-term data available from only a few locations worldwide. These science areas have impacts on societal health and well-being and our awareness of ocean function in a shifting climate. Substantial efforts are underway to realise a network of open-ocean observatories around European Seas that will operate over multiple decades. Some systems are already collecting high-resolution data from surface, water column, seafloor, and sub-seafloor sensors linked to shore by satellite or cable connection in real or near-real time, along with samples and other data collected in a delayed mode. We expect that such observatories will contribute to answering major ocean science questions including: How can monitoring of factors such as seismic activity, pore fluid chemistry and pressure, and gas hydrate stability improve seismic, slope failure, and tsunami warning? What aspects of physical oceanography, biogeochemical cycling, and ecosystems will be most sensitive to climatic and anthropogenic change? What are natural versus anthropogenic changes? Most fundamentally, how are marine processes that occur at differing scales related? The development of ocean observatories provides a substantial opportunity for ocean science to evolve in Europe. Here we also describe some basic attributes of network design. Observatory networks provide the means to coordinate and integrate the collection of standardised data capable of bridging measurement scales across a dispersed area in European Seas adding needed certainty to estimates of future oceanic conditions. Observatory data can be analysed along with other data such as those from satellites, drifting floats, autonomous underwater vehicles, model analysis, and the known distribution and abundances of marine fauna in order to address some of the questions posed above. Standardised methods for information management are also becoming established to ensure better accessibility and traceability of these data sets and ultimately to increase their use for societal benefit. The connection of ocean observatory effort into larger frameworks including the Global Earth Observation System of Systems (GEOSS) and the Global Monitoring of Environment and Security (GMES) is integral to its success. It is in a greater integrated framework that the full potential of the component systems will be realised.",""
"use of the automatic identification system (ais) on autonomous weather buoys for maritime domain awareness applications","2006","The United States Coast Guard (USCG), as part of the Department of Homeland Security, is responsible for a wide variety of missions in the maritime domain. In order to support the accomplishment of these missions, the USCG needs to collect as much information as possible on activities occurring in the maritime domain. A large part of maritime activity relates to the movement of vessels. Therefore, detection, classification, identification and monitoring of vessels are a key component of what is known as Maritime Domain Awareness (MDA). The Automatic Identification System (AIS) is a technology that is used primarily as a tool for maritime safety, including vessel collision avoidance and as a means for coastal nations' Vessel Traffic Services (VTSs) to get information on vessels operating near their coasts. AIS equipment aboard vessels continuously and autonomously transmits information about the vessel including its identity, position, course, and speed to enhance safety. These transmissions can be received by other vessels or by land-based stations equipped with AIS receivers. The USCG sees the capability AIS provides, particularly for vessel tracking, as a major contributor to MDA and VTS. To extend the capability of USCG land-based AIS monitoring stations further offshore, the USCG Maritime Domain Awareness Program Integration Office sponsored the development of a near real-time, autonomous automatic identification and telemetry system based on AIS technology for installation on National Oceanic and Atmospheric Administration (NOAA) weather buoys through the National Data Buoy Center (NDBC) and its technical support contractor, Science Applications International Corporation (SAIC).","Satellites,prototype system,satellite telemetry,Monitoring,geosynchronous satellite transmission system,Transmitters,satellite transmitter,AD 2005 03 to 2005 06,autonomous weather buoys,Assembly systems,oceanographic equipment,Relays,AIS-equipped vessel detection,Automatic Identification System,Cape Cod,Maritime Domain Awareness applications,MDA,Prototypes,Charleston,Strait of Juan de Fuca,offshore installations,Telemetry,real-time relay,Real time systems,USCG,South Carolina,national security,meteorology,AIS receiver,NDBC Data Assembly Center,NDAC,Massachusetts,marine vehicles,collision avoidance,System testing,Embedded system,San Francisco Harbor,"
"psr-based feature adaptation with anomaly re-prediction for maritime target tracking","2022","The tracking method for the relevant filter cannot track when the target is affected by the background and in the scene of occlusion. We propose a target tracking algorithm based on the peak-to-sidelobe ratio (PSR) feature weight adaptation with anomaly re-detection based on the efficient convolution operator for manual features (ECO_HC) algorithm. The weights of the HOG features and CN features corresponding to the peak-to-sidelobe ratio are used as dynamic weight coefficients, and the maximum response value after their fusion is the area where the target may appear. Determine the target tracking status by calculating the tracking confidence of the response map, and when there is a tracking anomaly, the ECO_HC tracker is enhanced using the Kalman filter to re-predict the target position. The proposed algorithm has experimented on the OTB-50 dataset. The results show that our algorithm can cope with complex scenarios and improves by 3.0% in tracking accuracy and 2.8% in tracking success rate compared with the baseline algorithm ECO_HC. Finally, conduct tracking experiments on the actual sea surface scenes, and the proposed algorithm effectively suppresses the effects of common interference factors on the tracking effect.","response map,anomaly re-detection,tracking success rate,baseline algorithm ECO_HC,Kalman filter,Kalman filters,tracking anomaly,Prediction algorithms,target tracking status,PSR-based feature adaptation,dynamic weight coefficients,tracking confidence,maximum response value,ECO_HC tracker,tracking effect,Filtering algorithms,Filtering,feature dynamic fusion,target tracking,actual sea surface scenes,efficient convolution operator,object tracking,HOG features,manual features algorithm,relevant filter,target position,Target tracking,correlation filter,feature extraction,tracking method,Sea surface,target tracking algorithm,weight adaptation,anomaly prediction,CN features,Anomaly Re-Prediction,Interference,maritime target tracking,Heuristic algorithms,peak-to-sidelobe ratio,"
"mobile data fusion from multiple tracking sensors to augment maritime safety: mobile detection, early identification, and tracking of moving objects","2015","We present a novel mobile solution to provide efficient services for data fusion towards augmenting maritime safety. It is the first, to the best authors knowledge, complex and integrated fusion of data coming from multiple mobile and typical tracking sensors (e.g. Low weight/high performance radar, position transmission mechanisms and electro-optic/systems and hyper-spectral sensors). The key aim is to assist the detection and early identification and tracking of moving targets (e.g. With moving target indication and data fusion/correlation capabilities), as well as methods for obstacle detection and maritime surveillance. Maritime mobile services have to exchange real time data with multiple maritime/aerial assets no matter where the operation is conducted (close to harbors or at the open sea) and independently from the existing surveillance infrastructure. The proposed approach is also useful for the detection of marine pollution incidents. This innovative single window solution presents high efficiency, low operational costs' profiles and possibly contributes to standardization in construction as it utilizes typical tracking infrastructure and typical mobile devices (smartphones and tablets/ipads) & PCs.","real time data exchange,Mobile Vessel Surveillance,surveillance,surveillance infrastructure,sensor fusion,mobile geoinformatics,maritime/aerial assets,Safety,correlation capabilities,image motion analysis,Mobile Maritime Security,Cameras,Marine vehicles,Mobile Geoinformatics,multiple tracking sensors,Mobile communication,geophysical image processing,moving objects tracking,object tracking,marine safety,marine engineering,maritime surveillance,object detection,mobile computing,early identification,Radar tracking,Prototypes,obstacle detection,geographic information systems,marine pollution incidents detection,correlation methods,marine pollution,maritime mobile services,mobile detection,moving target indication,mobile data fusion,maritime safety,"
"a distributed spatial method for modeling maritime routes","2020","In this work we propose a novel spatial knowledge discovery pipeline capable of automatically unravelling the â€œroads of the seaâ€ and maritime traffic patterns by analysing voluminous vessel tracking data, as collected through the Automatic Identification System (AIS). We present a computationally efficient and highly accurate solution, based on a MapReduce approach and unsupervised learning methods, capable of identifying the spatiotemporal dynamics of ship routes and most crucially their characteristics, thus deriving maritime â€œpatterns of lifeâ€ at a global scale, without the reliance on any additional information sources or a priori expert knowledge. Experimental results confirm high accuracy of results and superior performance in comparison to other methods, with the entire processing duration completing in less than 3 hours for more than a terabyte of non-uniform spatial data. Finally, to clearly demonstrate the applicability and impact of our proposed method, we evaluate its ability to detect real world â€œanomaliesâ€, such as maritime incidents reported in the European Marine Casualty Information Platform. Numerical results show the advantages of our scheme in terms of accuracy, with an achieved anomaly detection accuracy of higher than 93%, by detecting 313 out of 335 relevant maritime incidents.","data mining,Anomaly detection,anomaly detection,unsupervised learning,Marine vehicles,data driven maritime traffic,maritime traffic patterns,computationally efficient solution,patterns of life,routes,spatial knowledge discovery pipeline,MapReduce approach,ships,automatic identification system,marine safety,marine engineering,voluminous vessel tracking data,a priori expert knowledge,relevant maritime incidents,AIS,nonuniform spatial data,anomaly detection accuracy,ship routes,time 3.0 hour,highly accurate solution,pattern clustering,Artificial intelligence,information sources,Big Data,unsupervised learning methods,Roads,distributed spatial method,maritime modeling,Trajectory,entire processing duration,Surveillance,spatiotemporal dynamics,European Marine Casualty Information Platform,data handling,"
"a search strategy and vessel detection in maritime environment using fixed-wing uavs","2023","In this paper, we address the problem of autonomous search and vessel detection in an unknown GNSS-denied maritime environment with fixed-wing UAVs. The main challenge in such environments with limited localization, communication range, and the total number of UAVs and sensors is to implement an appropriate search strategy so that a target vessel can be detected as soon as possible. Thus we present informed and non-informed methods used to search the environment. The informed method relies on an obtained probabilistic map, while the non-informed method navigates the UAVs along predefined paths computed with respect to the environment. The vessel detection method is trained on synthetic data collected in the simulator with data annotation tools. Comparative experiments in simulation have shown that our combination of sensors, search methods and a vessel detection algorithm leads to a successful search for the target vessel in such challenging environments.","detection,target vessel,fixed-wing UAVs,unknown GNSS-denied maritime environment,Location awareness,MBZIRC,informed method,marine environment,Search problems,autonomous search,search methods,appropriate search strategy,satellite navigation,vessel detection method,noninformed method,Probabilistic logic,simulation,Annotations,autonomous aerial vehicles,search strategy,search problems,communication range,mobile robots,successful search,vessel detection algorithm,Computational modeling,Sensors,Navigation,fixed-wing UAV,"
"experimental comparison of ad hoc methods for classification of maritime vessels based on real-life ais data","2018","Classification of Maritime Vessels is a recurrent task in maritime surveillance systems. Classification can be conducted by different methods, e.g., NaÃ¯ve Bayes, k Nearest Neighbor, Decision Tree, Fuzzy Rule, or Neural Networks. The Automatic Identification System (AIS) is cooperative system of VHF-radio data exchange. By broadcasting of navigational data and ships' information it supports maritime safety, surveillance, and information. Based on measured AIS datasets of five maritime hotspots, easily implementable standard classification (i.e. ad hoc) methods from Data Science are compared to each other. These are evaluated in terms of accuracy. This experimental evaluation is motivated by the following question: Tip to which degree properties and behavior, e.g., vessel's type, can be detected by using large quantities of ship's positional, motion, and dimensions' data as provided by AIS? Future applications might include detection of fraudulent self-declarations of types, e.g., during illegal fishing activities.","surveillance,maritime surveillances systems,Fuzzy Rule,Nearest Neighbor,maritime vessels,Neural networks,Data Science,experimental comparison,Decision Tree,Decision trees,Neural Network,ad hoc methods,real-life AIS data,ships,marine safety,marine engineering,Automatic Identification System,AIS,Ions,pattern classification,NaÃ¯ve Bayes,Artificial intelligence,navigational data,maritime surveillance systems,Training,maritime hotspots,VHF radio propagation,KNIME Analytics Platform,VHF-radio data exchange,radio data systems,Surveillance,Classification,accuracy,Task analysis,performance evaluation,maritime safety,"
"maritime opportunistic transmission: when and how much can dtn node deliver?","2019","Maritime wireless communication delay tolerant networks (MWDTN) may develop slowly, if there is no efficient scheme to allocate network resources which are arrival data and limited energy. In this paper, we investigate the resources scheduling problem to utilize the sleeping scheduling (SS) and opportunistic transmission (OT) for energy conservation, while guaranteeing the Quality-of-Service (QoS) with worst-case delay. In addition, we assume the node of delay tolerant networks (DTN) only uses green energy absorbed from the sun and wind. We establish a reasonable harvest-and-consumption energy model. Considering to make a delay-energy tradeoff, an optimization algorithm based on Lyapunov optimization (LO), which makes the transmission determination for waking-up the DTN node and determines the optimal data quantity should be transmitted for current system state, is proposed to cope with the delay-energy tradeoff problem. Performance analysis indicates the restrictions in particular system status, such as upper bounds of queue and the worst-case delay. The simulation results illustrate that the proposed algorithm has competency to allocate energy efficiently within worst-case delay.","maritime opportunistic transmission,telecommunication power management,green energy,resources scheduling problem,Energy consumption,quality of service,transmission determination,Delays,optimization algorithm,maritime wireless communication delay tolerant networks,optimal data quantity,Wireless communication,Stochastic processes,telecommunication scheduling,harvest-and-consumption energy model,energy efficiency allocation,Sleeping Scheduling,performance analysis,Linear programming,delay-energy tradeoff problem,optimisation,opportunistic Transmission,radio networks,network resource allocation,Delay Toler-ant Networking,sleeping scheduling,Optimization,limited energy,opportunistic transmission,Maritime wireless communication,delay tolerant networks,marine communication,Energy conservation,energy conservation,DTN node,Lyapunov optimization,resource allocation,worst-case delay,arrival data,Delay-energy tradeoff,upper bounds,"
"a generic anomaly detection approach applied to mixture-of-unigrams and maritime surveillance data","2019","This paper proposes a new generic method to detect anomalies (i.e., statistical outliers) which can be used with a generative topic model. In this paper, we specify this method in the context of the Mixture-of-unigrams model, which is widely used in text mining. It is possible to detect anomalies with a topic model by applying a threshold to the likelihood. However, it is challenging to choose the threshold since the choice needs to consider both the similarities of the topics and the length of documents. This paper describes a new intuitive method to detect anomalies which simply manipulates the output of the trained model. Such an approach is anticipated to have parameters that are more intuitive to define for a given problem. To assess the utility of the proposed approach, we also present a use case involving identifying ships misreporting their ship-type using geo-location data from the Automatic Identification System (AIS) messages. We show that, if we train a model using data for one type of ship, it is possible to identify ships of another type as anomalous.","geo-location data,data mining,Anomaly detection,Mixture-of-unigrams model,Marine vehicles,natural language processing,security of data,trained model,generic anomaly detection,ships,automatic identification system,marine engineering,text mining,generative topic model,Training data,Data models,statistical outliers,intuitive method,Artificial intelligence,Training,text analysis,Probability,maritime surveillance data,learning (artificial intelligence),"
"a feasibility study of pnt integrity provision for maritime applications","2014","This paper focuses on provision of maritime position, navigation, and timing (PNT) integrity information in order to support safe maritime navigation and application. A simulation system for a feasibility study is used to evaluate the performance of the system according to the requirements set by the International Maritime Organization (IMO) resolution A.915 (22) on accuracy, integrity, and availability. In order to assess the performance requirements and service level of the system, a concept for maritime PNT integrity monitoring is proposed, and the considerations necessary to meet performance requirements are summarized. Related studies are analyzed, and their limitations in monitoring the integrity of the satellite signals are presented. To overcome these limitations, the port PNT information reliability is presented in this work, consisting of the Stanford plot. Finally, this feasibility study determines the reliability level of maritime PNT information, and simulation results are shown.","Reliability,Availability,computerised monitoring,IMO,Protection level,international maritime organization,maritime position,and timing integrity provision,navigation,maritime PNT integrity monitoring,satellite signal integrity monitoring,Error estimation,maritime PNT information reliability level,Integrity,PNT,reliability,marine navigation,Global Positioning System,"
"deep reinforcement learning based joint edge resource management in maritime network","2020","Due to the rapid development of the maritime networks, there has been a growing demand for computation-intensive applications which have various energy consumption, transmission bandwidth and computing latency requirements. Mobile edge computing (MEC) can efficiently minimize computational latency by offloading computation tasks by the terrestrial access network. In this work, we introduce a space-air-ground-sea integrated network architecture with edge and cloud computing components to provide flexible hybrid computing service for maritime service. In the integrated network, satellites and unmanned aerial vehicles (UAVs) provide the users with edge computing services and network access. Based on the architecture, the joint communication and computation resource allocation problem is modelled as a complex decision process, and a deep reinforcement learning based solution is designed to solve the complex optimization problem. Finally, numerical results verify that the proposed approach can improve the communication and computing efficiency greatly.","maritime network,Satellites,unmanned aerial vehicles,computation-intensive applications,computing latency requirements,telecommunication network management,maritime network service,computation resource allocation problem,telecommunication computing,Resource management,space-air-ground-sea integrated network architecture,satellite communication,deep learning,Servers,cloud computing,optimisation,mobile edge computing services,deep reinforcement learning based solution,edge computing,terrestrial access network,joint edge resource management,flexible hybrid computing service,reinforcement learning,Computer architecture,MEC,decision theory,computation offload,Edge computing,energy consumption,Cloud computing,marine communication,Task analysis,learning (artificial intelligence),transmission bandwidth,resource allocation,computation latency,UAV,"
"a preliminary study on an optical system for nautical and maritime traffic monitoring","2021","The nautical traffic is very difficult to monitor since many vessels are not cooperative. VTSs (Vessel Traffic Systems) use several sources of information for estimating shipsâ€™ Position Navigation and Velocity, such as AIS (Automatic Identification System) and RADAR (RAdio Detection And Ranging); nevertheless, VTS areas do not cover the entire costal area of a country. In many cases the classification and identification of small non-AIS vessels could provide an important to the safety of navigation.Indeed, especially during the summer, the nautical tourism has a great impact on the maritime traffic congestion. The issue involves many institutions such as Marine Protected Areas (MPAs) and local maritime authorities which are not able to monitor the high volume of nautical traffic. This work introduces an optical system designed to monitor the traffic in small coastal areas based on images acquired by a single camera. The reliability and accuracy of the system is conditioned by the size of the pixel on the sea surface (Ground Sample Distance-GSD) and by the camera footprint area as well. More in detail, this work focuses on the detection of the best camera placement on the coast for optimizing the GSD size and obtaining the shape of camera footprint. The inspection was conducted on a target area of the MPA â€œPunta Campanellaâ€ located on the Sorrento coast.","Optical imaging,local maritime authorities,maritime traffic monitoring,VTS areas,marine radar,Vessel Traffic Systems,nautical tourism,Cameras,Sea measurements,Metrology-Photogrammetry-Maritime Traffic Monitoring,Radio navigation,radio detection and ranging,entire costal area,nonAIS vessel classification,-Low cost-,ships,marine safety,Automatic Identification System,AIS,cameras,Shape,Sea surface,maritime traffic congestion,nautical traffic monitoring,Optical variables measurement,optical system,Positioning-Navigation,coastal areas,camera footprint area,radionavigation,nonAIS vessel identification,"
