"name","year","abstract","keywords"
"overview of the security architecture of the comprehensive maritime awareness system","2009","The Comprehensive Maritime Awareness (CMA) system tries to identify anomalous behavior and potential threats associated with the global maritime domain that could impact the United States and coalition partners' security. It analyzes data from multiple sources that impose different data handling requirements, to discover potential threats. Security architecture and mechanisms are essential enablers for data sharing. More data stewards will share their data when they feel secure with the data protection mechanism of the system that will host their data. Critical technologies for data protection and access mediation for CMA are Oracle label security (OLS) and attribute-based access control (ABAC) based on federated identity management. Federated identity providers use security assertion markup language (SAML) 2.0 as a protocol to exchange user identity and attributes. This paper provides a high-level overview of the CMA security architecture. It explains how different security mechanisms seamlessly work together to protect data and mediate access.","Access protocols,Mediation,anomalous behavior,federated identity management,Data handling,security architecture,Data analysis,Technology management,data protection mechanism,attribute-based access control,marine engineering,potential threats,Oracle label security,Protection,security assertion markup language,Access control,Identity management systems,Comprehensive Maritime Awareness system,Markup languages,authorisation,Data security,"
"predictive maintenance leveraging machine learning for time-series forecasting in the maritime industry","2020","One of the key challenges in the maritime industry refers to minimizing the time a vessel cannot be utilized, which has multiple effects. The latter is addressed through maintenance approaches that however in many cases are not efficient in terms of cost and downtime. Predictive maintenance provides optimized maintenance scheduling offering extended vessel lifespan, coupled with reduced maintenance costs. As in several industries, including the maritime domain, an increasing amount of data is made available through the deployment and exploitation of data sources, such as on board sensors that provide real-time information. These data provide the required ground for analysis and thus support for various types of data-driven decision making. In the maritime domain, sensors are deployed on vessels to monitor their engines and data analysis tools are needed to assist engineers towards reduced operational risk through predictive maintenance solutions that are put in place. In this paper, we present an approach for anomaly detection on time-series data, utilizing machine learning on the vessels sensor data, in order to predict the condition of specific parts of the vessel's main engine and thus facilitate predictive maintenance. The novel characteristic of the proposed approach refers both to the inclusion of new innovative models to address the case of predictive maintenance in maritime and the combination of those different models, highlighting an improved result in terms of evaluation metrics.","time-series forecasting,predictive maintenance leveraging machine,optimized maintenance scheduling,maritime,vessel lifespan,data-driven decision making,Anomaly detection,anomaly detection,maintenance engineering,Machine learning,data sources,reduced maintenance costs,time-series,scheduling,time-series data,downtime,predictive maintenance,deep learning,Oils,data analysis,machine learning,Data models,maritime domain,real-time information,decision making,predictive maintenance solutions,time series,condition monitoring,permutation entropy,gradient boosting,Engines,maritime industry,Sensors,maintenance approaches,learning (artificial intelligence),Fuels,"
"anomaly detection in vessel tracks using bayesian networks","2014","In recent years electronic tracking has provided voluminous data on vessel movements, leading researchers to try various data mining techniques to find patterns and, especially, deviations from patterns, i.e., for anomaly detection. Here we describe anomaly detection with data mined Bayesian Networks, learning them from real world Automated Identification System (AIS) data, and from supplementary data, producing both dynamic and static Bayesian network models. We find that the learned networks are quite easy to examine and verify despite incorporating a large number of variables. We also demonstrate that combining dynamic and static modelling approaches improves the coverage of the overall model and thereby anomaly detection performance.","Models of normality,Maritime data,Anomaly detection,Machine learning,Bayesian networks,AIS,"
"research into vessel behaviour pattern recognition in the maritime domain: past, present and future","2021","A comprehensive literature review on vessel behaviour pattern recognition in maritime and littoral environments, spanning a period of three decades, is presented. A vast majority of research focuses on anomalous vessel behaviour detection from Automated Identification System (AIS) data, using artificial intelligence (AI), Bayesian networks and machine learning based methods. AIS is a cooperative system that employs VHF transceivers to share vessel information through terrestrial and satellite communication networks. To track small boats not fitted with AIS, uncooperative surveillance systems are employed. These systems have been studied in a relatively small number of publications. In vessel behaviour pattern recognition, target classification is critically important, particularly, in asymmetric warfare situations. The paper concludes with a discussion of future outlook in vessel behaviour pattern recognition research.","Vessel behaviour recognition,Target tracking,Pattern of life,Anomaly detection,Plan recognition,Bayesian networks,Target classification,"
"machine learning-assisted anomaly detection in maritime navigation using ais data","2020","The automatic identification system (AIS) reports vessels' static and dynamic information, which are essential for maritime traffic situation awareness. However, AIS transponders can be switched off to hide suspicious activities, such as illegal fishing, or piracy. Therefore, this paper uses real world AIS data to analyze the possibility of successful detection of various anomalies in the maritime domain. We propose a multi-class artificial neural network (ANN)-based anomaly detection framework to classify intentional and non-intentional AIS on-off switching anomalies. The multi-class anomaly framework captures AIS message dropouts due to various reasons, e.g., channel effects or intentional one for carrying illegal activities. We extract position, speed, course and timing information from real world AIS data, and use them to train a 2-class (normal and anomaly) and a 3-class (normal, power outage and anomaly) anomaly detection models. Our results show that the models achieve around 99.9% overall accuracy, and are able to classify a test sample in the order of microseconds.","security of data,maritime traffic situation awareness,multiclass anomaly framework,pattern classification,multiclass artificial neural network,AIS message dropouts,neural nets,illegal fishing,learning (artificial intelligence),illegal activities,ships,automatic identification system,marine engineering,machine learning-assisted anomaly detection,maritime navigation,AIS transponders,"
"engine vibration anomaly detection in vessel engine room","2022","Unsupervised and autonomous operations require new, more efficient, and smarter technical solutions. Digitalization is one of the enablers of autonomous operation, with installing new sensors and using the data for AI and machine learning. The trend is to move the handling the vast amount of data from sensors, installed in machines, and devices, close to the sensors. This way, data communication can be heavily reduced, while the latency of decisions based on data can be minimal. This is achieved by moving the advanced data analysis capabilities from the cloud to the edge. In this paper, the driver of technological development is the concept of an unmanned machine room, where the normal inspections performed by personnel are automated using sensors and algorithms.We present an analysis of vibration data, recorded at a cruise ferry\x92s engines, using a signal processing method called cepstrums. A cepstrum is a version of frequency analysis, intending to identify and visualize periodic structures in data using cepstrograms. Compared to spectrogram analysis, usage of cepstrogram enables better visualization of engine behavior into the shape of audio signals. This helped us discover the run-time vibration routine of the engines from where we could observe unusual vibration sensing generated from the engine. We started studying the unusual behavior and came to the conclusion that the engine is sometimes misfiring the cylinders, generating anomalies","anomaly,unmanned machine room,edge computing,vibration analysis,cepstrum,data communication,autonomous operation,unsupervised,"
"proceedings - ismode 2022: 2nd international seminar on machine learning, optimization, and data science","2022","",""
"from unsupervised to semi-supervised anomaly detection methods for hrrp targets","2020","Responding to the challenge of detecting unusual radar targets in a well identified environment, innovative anomaly and novelty detection methods keep emerging in the literature. This work aims at presenting a benchmark gathering common and recently introduced unsupervised anomaly detection (AD) methods, the results being generated using high-resolution range profiles. A semi-supervised AD (SAD) is considered to demonstrate the added value of having a few labeled anomalies to improve performances. Experiments were conducted with and without pollution of the training set with anomalous samples in order to be as close as possible to real operational contexts. The common AD methods composing our baseline will be One-Class Support Vector Machines (OC-SVM), Isolation Forest (IF), Local Outlier Factor (LOF) and a Convolutional Autoencoder (CAE). The more innovative AD methods put forward by this work are Deep Support Vector Data Description (Deep SVDD) and Random Projection Depth (RPD), belonging respectively to deep and shallow AD. The semi-supervised adaptation of Deep SVDD constitutes our SAD method. HRRP data was generated by a coastal surveillance radar, our results thus suggest that AD can contribute to enhance maritime and coastal situation awareness.","semisupervised anomaly detection methods,Pollution,unusual radar targets,benchmark gathering,Support vector machines,Anomaly detection,radar detection,HRRP targets,anomaly detection,unsupervised learning,high-resolution range profiles,Neural networks,semisupervised adaptation,novelty detection methods,radar target detection,radar computing,innovative anomaly,support vector machines,SAD method,machine learning,object detection,radar target recognition,innovative AD methods,search radar,identified environment,Deep SVDD,high-resolution range profile,Radar,common AD methods,convolutional neural nets,labeled anomalies,Training,One-Class Support Vector Machines,neural network,semisupervised AD,Radar detection,"
"system architecture for real-time condition monitoring and anomaly detection on ships","2023","Sea-based rescue organizations play a vital role in maritime civil security by resolving offshore emergencies, securing sea routes, and monitoring critical naval infrastructure. However, increasing marine traffic makes rescue operations more difficult, demanding better organization and orchestration of available resources. Therefore, ensuring efficient maintenance, availability and timely deployment of rescue cruisers is of great importance, particularly in rough sea conditions. To achieve this, we design an AI-based system for predictive maintenance and condition monitoring that enables real-time analyses of the shipâ€™s sensory data and the detection of anomalies in the system behavior. In this paper, we detail our software and hardware architecture for these purposes, and we discuss the respective requirements regarding onboard and off-ship data analysis from various data sources (sensor data, camera data, weather data). We underpin our approach by emulating data flows derived from sensory data. Finally, we provide the first results in AI-based anomaly detection, allowing, for instance, early engine malfunctions identification before the actual failure occurs.","Machine Learning,Condition Monitoring,Computer architecture,Systems architecture,Soft sensors,Real-time systems,Anomaly Detection,Ship Sensory Data,Condition monitoring,System Architecture,Organizations,Hardware,"
"data-driven prognostics using a combination of constrained k-means clustering, fuzzy modeling and lof-based score","2017","Today, failure modes characterization and early detection is a key issue in complex assets. This is due to the negative impact of corrective operations and the conservative strategies usually put in practice, focused on preventive maintenance. In this paper anomaly detection issue is addressed in new monitoring sensor data by characterizing and modeling operational behaviors. The learning framework is performed on the basis of a machine learning approach that combines constrained K-means clustering for outlier detection and fuzzy modeling of distances to normality. A final score is also calculated over time, considering the membership degree to resulting fuzzy sets and a local outlier factor. Proposed solution is deployed in a CBM+ platform for online monitoring of the assets. In order to show the validity of the approach, experiments have been conducted on real operational faults in an auxiliary marine diesel engine. Experimental results show a fully comprehensive yet accurate prognostics approach, improving detection capabilities and knowledge management. The performance achieved is quite high (precision, sensitivity and specificity above 93% and κ=0.93), even more so given that a very small percentage of real faults are present in data.","Local outlier factor,Constrained k-means clustering,Behavior characterization,Machine learning,Fuzzy modeling,Condition monitoring,"
"multi-label classification for ais data anomaly detection using wavelet transform","2022","Thanks to the Automatic Identification System (AIS), ships and other maritime equipment are able to communicate with each other, for example, by sending information about their position. This solution allows for early collision detection when two or more ships are on a collision course. In the newer version of AIS, a satellite infrastructure is used to extend the communication range. Unfortunately, satellite AIS deals with so-called packet collision effect: since there is a problem with synchronizing AIS data coming from multiple terrestrial areas, a single satellite may receive several AIS messages at the same time and be unable to correctly process them, causing the data to get lost or garbled. In this article, a machine learning based framework for detecting the incorrect AIS data is presented. In this approach, after the first stage (clustering), a dedicated anomaly detection algorithm searches for damaged AIS messages and conducts multi-label classification (with Random Forest and wavelet transform) to decide which fields of such message requires further correction. The results of measuring the effectiveness of the proposed approach using real AIS data are presented.","telecommunication security,Clustering algorithms,incorrect AIS data,single satellite,Anomaly detection,Wavelet transforms,anomaly detection,random forests,collision course,Marine vehicles,Machine learning,damaged AIS messages,Data analysis,dedicated anomaly detection algorithm searches,satellite communication,ships,wavelet transform,pattern classification,random forest,Classification algorithms,multiple terrestrial areas,pattern clustering,machine learning based framework,Artificial intelligence,multi-label classification,multilabel classification,wavelet transforms,satellite infrastructure,AIS data anomaly detection,maritime equipment,communication range,Trajectory,marine communication,Labeling,early collision detection,AIS data analysis,packet collision effect,satellite AIS deals,"
"navigation anomaly detection: an added value for maritime cyber situational awareness","2021","The maritime sector is facing a continuous shift towards digitalization. A ship built during the last decade shows all characteristics of a comprehensive information system, combining information and operational technologies. While industrial programmable logic controllers are used for engine and power management, the bridge is now highly relying on digital sensors, networks and displays for navigation. Meanwhile, over the last few years, many cyber attacks targeting maritime assets and made publicly confirm a real interest of criminal and non-state actors in this critical sector for our globalized economies. In this work, a concept designed to detect and visualize advanced navigation cyber attacks on maritime systems using contextual NMEA data analytics is presented. A strategy is built to enhance the detection of navigation spoofing attacks, assess possible physical impacts onboard and support decision makers.","comprehensive information system,power management,globalized economies,navigation spoofing attacks,maritime assets,Sensor phenomena and characterization,computer crime,Programmable logic devices,Marine vehicles,Anomaly Detection,ship,operational technologies,engine,marine navigation,industrial programmable logic controllers,Data analysis,maritime cyber situational awareness,data analysis,ships,Performance evaluation,information systems,marine engineering,digitalization,digital sensors,information technologies,advanced navigation cyber attacks,decision making,Real-time systems,Visualisation,navigation anomaly detection,Cyber Situational Awareness,Machine Learning,Maritime Systems,nonstate actors,decision makers,Navigation,maritime sector,NMEA data analytics,maritime systems,"
"cae: contextual auto-encoder for multivariate time-series anomaly detection in air transportation","2022","The Automatic Dependent Surveillance-Broadcast protocol is one of the latest compulsory advances in air surveillance. While it supports the tracking of the ever-growing number of aircraft in the air, it also introduces cybersecurity issues that must be mitigated e.g., false data injection attacks where an attacker emits fake surveillance information. The recent data sources and tools available to obtain flight tracking records allow the researchers to create datasets and develop Machine Learning models capable of detecting such anomalies in En-Route trajectories. In this context, we propose a novel multivariate anomaly detection model called Contextual Auto-Encoder (CAE). It uses the baseline of a regular LSTM-based auto-encoder but with several decoders, each getting data of a specific flight phase (e.g. climbing, cruising or descending) during its training. To illustrate the CAE’s efficiency, an evaluation dataset was created using real-life anomalies as well as realistically crafted trajectory modifications, with which the CAE as well as three anomaly detection models from the literature were evaluated. Results show that the CAE achieves better results in both accuracy and speed of detection. The dataset, the models implementations and the evaluation results are available in an online repository, thereby enabling replicability and facilitating future experiments.","Air traffic security,Anomaly detection,Multivariate time series,CAE,ADS-B,"
"geographical spatial analysis and risk prediction based on machine learning for maritime traffic accidents: a case study of fujian sea area","2022","",""
"abnormal behaviour detection by using machine learning-based approaches in the marine environment: a literature survey","2022","",""
"research progress on ship anomaly detection based on big data","2020","The purpose of ship behavior anomaly detection is to identify and monitor some non-expected behaviors of ships, so as to improve the navigation safety of ships. Its research is of great significance to the safety guarantee of maritime navigation, intelligent monitoring of sea areas and the development of port management. This paper summarizes and evaluates the research progress of ship anomaly detection based on big data and points out the future development trend. First of all, the concept of ship abnormal behavior is introduced, and the process of data-driven ship abnormal detection and its data basis are described in detail. Secondly, the data-driven ship anomaly detection methods are divided into statistical method, machine learning method and neural network method, and their research status and existing problems are reviewed respectively. Finally, focusing on maritime big data, temporal and spatial correlation of scenarios, online real-time anomaly detection and other aspects, the current problems and challenges in the study of ship anomaly detection are discussed, and the future research direction is introduced.","data-driven ship abnormal detection,Safety,Anomaly detection,Marine vehicles,progress review,ship navigation safety,security of data,Neural networks,neural nets,statistical analysis,real-time anomaly detection,data analysis,ships,ship behavior anomaly detection,marine safety,marine engineering,machine learning,statistical method,ship abnormal behavior,Statistical analysis,Big Data,maritime big data,abnormal detection,data-driven ship anomaly detection,maritime Big Data,neural network,Navigation,learning (artificial intelligence),"
