"name","year","abstract","keywords"
"advanced data analytics for ship performance monitoring under localized operational conditions","2021","Improving the operational energy efficiency of existing ships is attracting considerable interests to reduce the environmental footprint due to air emissions. As the shipping industry is entering into Shipping 4.0 with digitalization as a disruptive force, an intriguing area in the field of ship’s operational energy efficiency is big data analytics. This paper proposes a big data analytics framework for ship performance monitoring under localized operational conditions with the help of appropriate data analytics together with domain knowledge. The proposed framework is showcased through a data set obtained from a bulk carrier pertaining the detection of data anomalies, the investigation of the ship’s localized operational conditions, the identification of the relative correlations among parameters and the quantification of the ship’s performance in each of the respective conditions. The novelty of this study is to provide a KPI (i.e. key performance indicator) for ship performance quantification in order to identify the best performance trim-draft mode under the engine modes of the case study ship. The proposed framework has the features to serve as an operational energy efficiency measure to provide data quality evaluation and decision support for ship performance monitoring that is of value for both ship operators and decision-makers.","Energy efficiency,Data anomaly detection,Ship performance monitoring,Emission control,Machine learning,Big data analytics,"
"a bibliometric analysis of cyber security and cyber forensics research","2023","Cybersecurity is one of the most important concerns associated with ever expanding internet based technologies, products, services and networks. If cybersecurity is prevention then cyber forensics is the cure. Both are equally important pillars of digital security. This paper presents an extensive bibliometric analysis of cybersecurity and cyberforensic research published in Web of Science during the past decade (2011–2021). The analysis included yearly publications, publication types and trends across different verticals such as publishing sources, organizations, researchers, countries and keywords. Full counting method was used for citation analysis, whereas fractional counting method was implemented to analyze co-citation, co-author collaborations as well as keyword co-occurrences across all these verticals. Furthermore, timeline and burst detection analyses were carried out to unravel significant topic trends and citations in the last decade. The study presents bibliometric results in terms of the authors, organizations, countries, keywords, sources and documents with the highest collaborative link strengths worldwide in the field of cybersecurity and forensics. Latest trends, under-investigated topics and future directions are also presented.","Deep learning,Bibliometry,Anomaly detection,Malware detection,Cyber security,Machine learning,Cyber forensics,Cyber attack,"
"abnormal moving speed detection using combination of kernel density estimator and dbscan for coastal surveillance radars","2020","In this paper, we investigate the problem of detection of abnormal moving speeds for a coastal surveillance radar. A new definition of normal moving speeds which is based on the historical radar data of maritime targets on the monitoring area is introduced. The historical radar data is mined by the cell-based method, unsupervised machine learning to obtain the vessel normal moving speeds in the monitoring area. Then a logic rule is applied to detect the abnormal targets. The proposed method is tested with real data from a coastal surveillance radar. The test results show that the false alarm rate (FAR) is equal zero. It is also shown that this kind of anomaly detection can be integrated into a coastal surveillance radar for the detection of the maritime illegal activities.","data mining,coastal surveillance radar,vessel normal moving speeds,Kernel,marine radar,unsupervised machine learning,radar detection,Kernel Density Estimator,unsupervised learning,maritime illegal activities,anomaly detection,false alarm rate,Sea measurements,Abnormal Moving Speed,DBSCAN,radar computing,cell-based method,abnormal targets,Maritime Anomaly Detection,maritime targets,search radar,Radar,radar signal processing,abnormal moving speed detection,Surveillance,learning (artificial intelligence),Radar signal processing,monitoring area,historical radar data,Radar detection,"
"early anomaly detection in smart home: a causal association rule-based approach","2018","As the world's population grows older, an increasing number of people are facing health issues. For the elderly, living alone can be difficult and dangerous. Consequently, smart homes are becoming increasingly popular. A sensor-rich environment can be exploited for healthcare applications, in particular, anomaly detection (AD). The literature review for this paper showed that few works consider environmental factors to detect anomalies. Instead, the focus is on user activity and checking whether it is abnormal, i.e., does not conform to expected behavior. Furthermore, reducing the number of anomalies using early detection is a major issue in many applications. In this context, anomaly-cause discovery may be helpful in recommending actions that may prevent risk. In this paper, we present a novel approach for detecting the risk of anomalies occurring in the environment regarding user activities. The method relies on anomaly-cause extraction from a given dataset using causal association rules mining. These anomaly causes are utilized afterward for real-time analysis to detect the risk of anomalies using the Markov logic network machine learning method. The detected risk allows the method to recommend suitable actions to perform in order to avoid the occurrence of an actual anomaly. The proposed approach is implemented, tested, and evaluated for each contribution using real data obtained from an intelligent environment platform and real data from a clinical datasets. Experimental results prove our approach to be efficient in terms of recognition rate.","Anomaly detection,Markov logic network,Smart homes,Causal association rules,"
"high fidelity digital twin-based anomaly detection and localization for smart water grid operation management","2023","Smart Water Grid (SWG) plays a critical role in sustaining cities economic and social development, but challenges remain in fully realizing the benefits of SWG. While Digital twin (DT) has been discussed in some literature for possible SWG applications, there has been limited, or no technical framework developed to facilitate SWG operation and management. In this paper, a generic framework is developed for constructing SWG high fidelity Digital Twin (DT) by integrating digital thread with various digital models for visualization, data-driven analysis, physics-based simulations, and decision-making support. Both the physics-based models and data-driven models are trained/retrained and calibrated/re-calibrated respectively by using the data collected with the sensors installed throughout a SWG. The information derived from the SWG DT can be diagnostic, predictive, and prescriptive to significantly augment users’ intelligence for improving SWG operation and management. One important application of digital twin augmented intelligence is illustrated to timely detect and localize anomaly events, which may include, but not be limited to, pipe bursts and unauthorized water usages. The solution is tested on the selected areas in Singapore to construct the ever-green DT by calibrating and recalibrating the models for near real-time SWG operation management. The case study was conducted for three supply zones with the total pipeline length of more than 1000 km and 40 weeks of monitoring data, collected by 89 pressure monitoring stations and 8 flow meters at inlets and boundary. More than 3300 data-driven models are trained for optimizing the model performance to achieve accuracy of greater than 80% F1 score for detecting anomaly events, which are subsequently localized within 400 m with 2–3 days lead time.","Data analytics,Anomaly localization,Smart water grid,Anomaly detection,Machine learning,Digital twin,"
"message from the mbdw'20 workshop chairs: mdm 2020","2020","MBDW 2020 is the second event on maritime big data, co-located this time with the 21th international conference on Mobile Data Management. MBDW is dedicated to big data innovations for the maritime domain and interdisciplinary science-driven maritime activities. Following a rigorous blind peer-review process, nine papers have been finally selected for being included in the proceedings and for online presentation. The selected papers cover a diversified range of topics, focussing on machine learning advances for vessel trajectories analysis and prediction, maritime anomaly detection, vessel trajectory compression, analysis of open historical vessel emissions datasets, data fusion and big data infrastructures for mobility data processing.",""
"challenges in vessel behavior and anomaly detection: from classical machine learning to deep learning","2020","",""
"online learning of temporal logic formulae for signal classification","2018","This paper introduces a method for online inference of temporal logic properties from data. Specifically, we tackle the online supervised learning problem. In this setting, the data is in form of a set of pairs of signals and labels and it becomes available over time. We propose an approach for efficiently processing the data incrementally. In particular, when a new instance is presented, the proposed method updates a binary tree that is linked with the inferred Signal Temporal Logic (STL) formula. This approach presents several benefits. Primarily, it allows the refinement of the current formula when more data is acquired. Moreover, the incremental construction offers insights on the trade-off between formula complexity and classification accuracy. We present two case studies to emphasize the characteristics of the proposed algorithm: 1) a fault classification problem in an automotive system and 2) an anomaly detection problem in the maritime environment.","anomaly detection problem,Prediction algorithms,Machine learning,temporal logic formulae,temporal logic,signal classification,signal temporal logic formula,automotive system,Decision trees,formula complexity,trees (mathematics),Impurities,STL,temporal logic properties,Binary trees,Complexity theory,online supervised learning problem,inference mechanisms,maritime environment,incremental construction,Task analysis,binary tree,online inference,learning (artificial intelligence),fault classification problem,"
"maritime situation analysis framework: vessel interaction classification and anomaly detection","2015","Maritime domain awareness is critical for protecting sea lanes, ports, harbors, offshore structures like oil and gas rigs and other types of critical infrastructure against common threats and illegal activities. Typical examples range from smuggling of drugs and weapons, human trafficking and piracy all the way to terror attacks. Limited surveillance resources constrain maritime domain awareness and compromise full security coverage at all times. This situation calls for innovative intelligent systems for interactive situation analysis to assist marine authorities and security personal in their routine surveillance operations. In this article, we propose a novel situation analysis approach to analyze marine traffic data and differentiate various scenarios of vessel engagement for the purpose of detecting anomalies of interest for marine vessels that operate over some period of time in relative proximity to each other. We consider such scenarios as probabilistic processes and analyze complex vessel trajectories using machine learning to model common patterns. Specifically, we represent patterns as left-to-right Hidden Markov Models and classify them using Support Vector Machines. To differentiate suspicious activities from unobjectionable behavior, we explore fusion of data and information, including kinematic features, geospatial features, contextual information and maritime domain knowledge. Our experimental evaluation shows the effectiveness of the proposed approach using comprehensive real-world vessel tracking data from coastal waters of North America.","Kinematics,surveillance,hidden Markov models,interactive situation analysis,Hidden Markov models,Geospatial analysis,anomaly detection,Anomaly Detection,maritime domain awareness,marine traffic data analysis,data fusion,information fusion,data analysis,Maritime Domain Awareness,vessel engagement,routine surveillance operations,marine engineering,support vector machines,kinematic features,probabilistic processes,geospatial features,machine learning,left-to-right hidden Markov models,vessel interaction classification,innovative intelligent systems,pattern classification,contextual information,Time series analysis,maritime situation analysis framework,Critical Infrastructure Protection,Big Data,vessel tracking data,Trajectory,Machine Learning,probability,complex vessel trajectory analysis,pattern representation,traffic engineering computing,Surveillance,maritime domain knowledge,marine vehicles,Intelligent Systems,learning (artificial intelligence),Security,security,"
"towards digital twins of the oceans: the potential of machine learning for monitoring the impacts of offshore wind farms on marine environments","2023","",""
"deep learning techniques for securing cyber-physical systems in supply chain 4.0","2023","The fourth industrial revolution's transformation utilizes a Cyber-Physical System (CPS) to secure Supply Chain 4.0. It integrates manufacturing information with internet communication technology to create a smart CPS that tracks products from manufacture to customer delivery using the Internet of Things (IoT). This research uses a Machine Learning (ML) approach for network anomaly detection and constructing data-driven models to detect DDoS attacks on Industry 4.0 CPSs. Limitations of existing techniques, such as artificial data and small datasets, are addressed by capturing network traffic data from a real-world semiconductor production factory. 45 bidirectional network flow features are extracted, and labeled datasets are constructed for training and testing ML models. The proposed PCA-BSO algorithm is employed to select the most relevant features based on their eigenvalues, as the feature with the highest eigenvalues may not always improve classification accuracy. Supervised ML algorithms are evaluated through simulations to assess their performance.","Cyber-physical production system,Supply chain 4.0,Industrial revolution 4.0,Deep learning,information technology,Machine learning,"
"fusing uncertain knowledge and evidence for maritime situational awareness via markov logic networks","2015","The concepts of event and anomaly are important building blocks for developing a situational picture of the observed environment. We here relate these concepts to the JDL fusion model and demonstrate the power of Markov Logic Networks (MLNs) for encoding uncertain knowledge and compute inferences according to observed evidence. MLNs combine the expressive power of first-order logic and the probabilistic uncertainty management of Markov networks. Within this framework, different types of knowledge (e.g. a priori, contextual) with associated uncertainty can be fused together for situation assessment by expressing unobservable complex events as a logical combination of simpler evidences. We also develop a mechanism to evaluate the level of completion of complex events and show how, along with event probability, it could provide additional useful information to the operator. Examples are demonstrated on two maritime scenarios of rules for event and anomaly detection.","Uncertainty management,Situational awareness,Markov Logic Networks,Context-based fusion,"
"an overview of cawses-india program with emphasis to equatorial atmospheric coupling processes","2012","This paper presents an overview of CAWSES—India program, highlighting some of the Indian coordinated efforts to understand the Sun−Earth system as a whole, with special emphasis to the equatorial and low latitude phenomena. Two multi-institutional, multi-instrument campaigns, one under ‘Space Weather: Science and Applications’ and the other emphasizing tides under ‘Atmospheric Coupling Processes’ were conducted during February–April 2006. The highlights of the campaigns include improved prediction of equatorial spread-F (ESF) based on a ‘new factor’ combining the strength and asymmetry of the equatorial ionization anomaly (EIA); simultaneous detection of quasi-2-day wave at both E and F region heights; tomographic image showing a Traveling Ionospheric Disturbance (TID) in association with a counter electrojet (CEJ) event—all highlighting the neutral and electrodynamical coupling of the equatorial ionosphere−thermosphere regions; an unusual lowering of mesospheric temperature during a moderate geomagnetic storm—highlighting a new space weather effect; diurnal tide showing a peak amplitude of 35m/s at 45km in zonal wind and a significantly lower amplitude (∼15m/s) in the meridional wind and also evidence of convective activity in the lower atmosphere influencing the tidal variability in the Mesosphere−Lower Thermosphere (MLT) region highlighting the vertical coupling of the atmospheric regions. The development of models for equatorial and low latitude ionosphere has been among the prime activities taken up under ‘Space Climate’. Two models have been developed towards this end: one based on Second Degree (SD) relationships of F region parameters to the mean sun spot number and the other a Multiple Regression Analysis (MRA) based model involving expressions relating F region parameters to that representing solar and geomagnetic activities. The two models, intended for long and short term predictions, have been found to represent the equatorial and low latitude ionosphere over Indian longitudes better than the commonly used International Reference Ionosphere (IRI). Under the theme of ‘Solar Influence on Atmospheric Climate’, a study has been made on the effects of solar variability on middle atmosphere using satellite data and model simulations, highlighting the significant differences between them.","Ionosphere,Magnetosphere,CAWSES,Stratosphere–troposphere,Solarwind,Mesosphere,Thermosphere,"
"security in devsecops: applying tools and machine learning to verification and monitoring steps","2023","",""
"utilizing machine learning on freight transportation and logistics applications: a review","2023","This review article explores and locates the current state-of-the-art related to application areas from freight transportation, supply chain and logistics that focuses on arrival time, demand forecasting, industrial processes optimization, traffic flow and location prediction, the vehicle routing problem and anomaly detection on transportation data. This review categorizes the related works according to machine learning methodologies so as to present the methods’ evolution through time, their combinations and their connection with the various applications in the specified fields. Thus, a reader would effortlessly get insights about the current state-of-the-art related to machine learning in freight transportation and related application areas.","Logistics 4.0,Supply chain,Literature review,Data mining,Machine learning,Intermodal freight transportation,"
"a comprehensive survey on the applications of machine learning techniques on maritime surveillance to detect abnormal maritime vessel behaviors","2023","",""
"artificial intelligence and machine learning in defense applications ii","2020","",""
"anomaly detection with unknown anomalies: application to maritime machinery","2021","We present a framework for deriving anomaly detection algorithms on timeseries data when the time and expression of anomalous behaviour is unknown. The framework is suited for problems in which individual machine learning paradigms cannot be directly implemented: supervised learning is not applicable due to the lack of labelled data, unsupervised learning is not effective since the normal operations are insufficiently defined and take complex and diverse forms, and deep learning risks confusing problematic behaviours for expected ones due to the possible repetitiveness of similar anomalies. The proposed approach is comprised of two phases: unsupervised discovery of anomalies, and semi-supervised construction and tuning of the anomaly detection algorithm. By leveraging data exploration methods and expert knowledge, the resulting algorithms are interpretable and detect a wide range of anomalous behaviours. The approach is applied to the early detection of wear and tear of maritime propulsion and manoeuvring machinery. We show that the final algorithm is able to detect different types of anomalies, including an actual internal leakage in a thruster which is otherwise overlooked by the present rule-based alarm system.","diagnosis,predictive maintenance,condition-based monitoring,machine learning,anomaly detection,grey-box modelling,fault detection,"
"markov logic networks for context integration and situation assessment in maritime domain","2012","The detection of anomalies has a critical role in situational assessment. In this paper, we break down the concept of anomaly in the maritime domain into different levels and relate them to the JDL fusion model. We also show how uncertain context knowledge can be encoded through Markov Logic Networks (MLNs) which offer a convenient framework leveraging both the expressive power of first order logic and the probabilistic uncertainty management of Markov networks. Every formula in the knowledge base is assigned a weight indicating its confidence. Different types of knowledge with associated uncertainty can therefore be fused together within MLNs and on-line inference can be performed as input data is processed by the system, and the formulas are grounded in the knowledge base. Promising examples are demonstrated on a sample set of rules for maritime event and anomaly detection.","Markov processes,context integration,sensor fusion,probabilistic uncertainty management,anomaly detection,Marine vehicles,Grounding,situation assessment,security of data,Markov logic networks,Knowledge based systems,threat assessment,Markov random fields,marine engineering,maritime event recognition,maritime domain,probabilistic logic,Context,situational awareness,uncertainty handling,inference mechanisms,Uncertainty,online inference,first order logic,JDL fusion model,knowledge base,"
"a novelty detection approach to diagnosing hull and propeller fouling","2019","Hull and propeller performance have a primary role in overall vessel efficiency. Vessel fouling is a common phenomenon where undesirable substances attach or grow on the ship hull. A clear understanding of the extent of the degradation of the hull will allow better management of assets and prediction of the best time for dry docking and hull maintenance work. In this paper, the authors investigate the problems of predicting the hull condition in real operations based on data measured by the on-board systems. The proposed solution uses an unsupervised Machine Learning (ML) modelling technique to eliminate the need for collecting labeled data related to the hull and propeller fouling condition. Two anomaly detection methods based on Support Vector Machines and k-nearest neighbour have been applied to predict the hull condition using the available parameters measured on-board. Data from the Research Vessel The Princess Royal has been exploited to show the effectiveness of the proposed methods and to benchmark them in a realistic maritime application.","Data analytics,Hull and propeller performance,Sensor data collection,Supervised learning,Hull fouling detection,Ship efficiency,"
"1st international workshop on multiple-aspect analysis of semantic trajectories, master 2019 held in conjunction with the 19th european conference on machine learning and principles and practice of knowledge discovery in databases, ecml pkdd 2019","2020","",""
"predicting ais reception using tropospheric propagation forecast and machine learning","2022","The aim of this paper is to present a methodology for modelling and predicting the coverage of an Automatic Identification System (AIS) station based on tropospheric index forecast maps and modelling methods from machine learning. The aim of this work is to cartographically represent the areas in which the AIS signals emitted by ships will be received by a coastal station. This work contributes to the improvement of maritime situational awareness and to the detection of anomalies at sea [1], and in particular to the identification of AIS message falsifications [2] (ubiquity of a vessel by identity theft, falsification of GPS positions and deactivation of AIS).","identification technology,naval engineering computing,Marine vehicles,Machine learning,Conferences,Global Positioning System,Sea measurements,Predictive models,maritime situational awareness,predicting AIS reception,tropospheric electromagnetic wave propagation,ships,marine engineering,machine learning,tropospheric index forecast maps,tropospheric propagation forecast,modelling methods,AIS message,AIS signals,Indexes,Automatic Identification System station,VHF radio propagation,coastal station,marine communication,learning (artificial intelligence),"
