"name","year","abstract","keywords"
"maritime environment perception based on deep learning","2022","Environment perception is an essential aspect of automated maritime vehicles, especially in high-traffic areas. In recent years, deep-learning-based object detection using LiDAR has been well developed in the automotive sector but has not yet seen a similar level of sophisticated development in maritime applications. In these applications, LiDAR detection should be fused with other maritime navigation systems such as the automatic identification system (AIS) to expand the detection range. To address this, we propose a novel deep-learning-based concept for maritime environment perception by using LiDAR as a primary sensor and AIS as an assisting information source. This approach consists of three functional modules: object detection, multi-object tracking, and static environment mapping. For object detection, we apply a convolutional neural network (CNN) to detect floating objects represented as oriented bounding boxes. To train the CNN, we propose a method that generates simulated labeled datasets. The detected objects from CNN are tracked with Kalman Filter banks. The remaining LiDAR data points are treated as static environments and represented by polygons. We evaluated the approach by using simulative and real-world datasets. In the simulation, the average precision of the CNN object detector reaches 60.8%, with a data processing rate of 40 Hz in GPU. Our real-world evaluations show that this approach can track 83% of the vessels in a crowded harbor, with the overall intersection over union reaching 64%. Our proposed approach represents the first application of CNN for LiDAR-based maritime environment perception, demonstrating its high potential for future online and real-world applications.","high-traffic areas,real-world applications,static environment mapping,Kalman filters,CNN object detector,automated maritime vehicles,deep-learning-based concept,static environments,Laser radar,neural nets,frequency 40.0 Hz,deep learning,object tracking,automatic identification system,LiDAR detection,Intelligent vessels,supervised learning,maritime navigation,AIS,object detection,sophisticated development,image classification,Radar tracking,Artificial intelligence,convolutional neural network,optical radar,Point cloud compression,Radar,maritime applications,maritime navigation systems,detection range,LiDAR-based maritime environment perception,multi-object tracking,Object detection,deep-learning-based object detection,multiobject tracking,learning (artificial intelligence),remaining LiDAR data points,Detectors,"
"a method for ice-aware maritime route optimization","2014","We present a method for ice-aware maritime route optimization. Our aim is to increase the safety and efficiency of maritime transport under icy conditions. The proposed method is based on the Aâˆ— algorithm, developed by Hart et al. It uses a model of maritime navigation, consisting of (1) a sea spatial model, (2) ship maneuverability model, (3) sea ice model, and (4) ship performance model. The sea ice model, which provides a snapshot of the sea ice conditions, is based on previous work by the Finnish Meteorological Institute. The ship performance model, based on previous work by Kotovirta et al., estimates ship transit speed as a function of ice conditions and ship design parameters. The main novelties in this paper are the application of the Aâˆ— algorithm to maritime route optimization and development of an associated cost function that takes into account ice conditions and available icebreaker assistance. We present preliminary results based on the method, using the Baltic Sea as a case study. Generated routes are compared with historical routes under the same ice conditions. Areas of future work and needed enhancements are briefly discussed.","Finnish meteorological institute,icebreaker assistance,Vectors,Marine vehicles,Cost function,marine navigation,ship performance model,ice-aware maritime route optimization,A* algorithm,sea spatial model,routing,maritime navigation,optimisation,sea ice model,Baltic sea,Sea ice,ice navigation,route optimization,Navigation,ship maneuverability model,"
"solar and tropical ocean forcing of late-holocene climate change in coastal east asia","2017","In this study, paleoclimate signals were extracted from high-resolution sediment records very recently produced from the Mulyoungari swamp on Jeju Island, South Korea and examined to determine the main factors driving late Holocene climate change in East Asia. The high resolution of the Mulyoungari records allows the detection of multidecadal to centennial-scale climate change with various cycles. This enables comparisons with important paleoclimate proxies such as total solar irradiation (ΔTSI) and sea surface temperatures (SSTs) in the western tropical Pacific (WTP). Spectral analyses of pollen and magnetic susceptibility (MS) data identify significant periodicities of 780, 470, 135–145, and 50–70years. The Mulyoungari swamp responded sensitively to global climate change during the Holocene, showing well known Holocene cycles in the results. Our tree pollen index of warmness (TPIW) shows important late Holocene cold events associated with low sunspot periods such as Oort, Wolf, Spörer, and Maunder Minimum. Comparisons among standard Z-scores of filtered TPIW, ΔTSI, and other paleoclimate records from central and northeastern China, off the coast of northern Japan, southern Philippines, and Peru all demonstrate significant relationships. This suggests that solar activity drove Holocene variations in both East Asian Monsoon (EAM) and El Niño Southern Oscillation (ENSO). In particular, the latter seems to have predominantly controlled the coastal climate of East Asia to the extent that the influence of precession was nearly muted during the late Holocene.","Western tropical Pacific,East Asian Monsoon,Late Holocene,Solar activity,Jeju Island,El Niño Southern-Oscillation,"
"dem analyses and morphotectonic interpretation: the plio-quaternary evolution of the eastern ligurian alps, italy","2012","The Ligurian Alps (Italy) straddle a complex and ill-defined tectonic transition that accommodates Eurasia–Adria shortening driving concurrent growth of the western Alps and northern Apennines. We focus on the Plio-Quaternary landscape evolution of the eastern part of the Ligurian Alps with the goal of defining the active tectonics through an analysis of topography, drainage networks, and river long profiles. The Ligurian Alps have a steep, seaward-facing escarpment with topographic features reminiscent of the geomorphic markers preserved on both actively-uplifting coastlines and passive margins. For example, there are seaward-facing benches that are thought to be uplifted marine terraces common to active margins; but the drainage divide of the seaward escarpment shows clear evidence of recent northward migration into the Po foreland, a process consistent with escarpment retreat characteristic of passive or subsiding margins. This study explores the active tectonics consistent with these diverse landscape evolution pathways. Our analysis reveals that rock-type strongly throttles the development of topographic relief, drainage networks, and northward migration of the drainage divide. However, we also identify segments of the escarpment that indicate recent base level falls through an analysis of modeled channel steepness and comparison with mean hillslope gradient. The base level falls are consistent with numerous barbed tributaries that are best explained as recent stream captures. No significant correlation among the stream captures at the drainage divide, suspected marine terraces at the coast, Ligurian Sea bathymetry, and active seismicity indicates that the escarpment is the footwall of a segmented normal fault. This normal fault is embedded in a regionally subsiding margin where actively uplifting segments lead to a straightened, pinned drainage divide, whereas, relatively inactive segments permit divide migration into the footwall block. These results are broadly consistent with rock uplift increasing eastward toward Genova across the long-suspected Alps–Apennine Sestri–Voltaggio fault zone. They highlight the respective roles of legacy structures, rock-type, and localized rock uplift in constructing a landscape in an otherwise extending and subsiding crustal retrowedge of an active subduction plate boundary.","Tectonic geomorphology,DEM analysis,Ligurian Alps,River longitudinal profile,"
"radiation detection system integration using multiple-input multiple-output radios","2022","",""
"scalable distributed change detection and its application to maritime traffic","2017","Building on a novel methodology based on the Ornstein-Uhlenbeck (OU) process to perform accurate long-term predictions of future positions of ships at sea, we present a statistical approach to the detection of abrupt changes in the process parameter that represents the desired velocity of a ship. Proceeding from well-established change detection techniques, the proposed strategy is also computationally efficient and fit well with big data processing models and paradigms. We report results with a large real-world Automatic Identification System (AIS) data set collected by a network of terrestrial receivers in the Mediterranean Sea from June to August 2016.","Mediterranean Sea,Apache Spark,maritime traffic,long-term predictions,well-established change detection techniques,Marine vehicles,ship,big data,statistical approach,Covariance matrices,statistical analysis,big data processing models,Ornstein-Uhlenbeck process,ships,AIS,statistical change detection,Artificial intelligence,Big Data,real-world Automatic Identification System data,Trajectory,Random variables,Receivers,traffic engineering computing,scalable distributed change detection,long-term target state predicion,"
"network-based fleet management systems for streamline maritime operation - a case study of f plastics marine corporation","2009","Effective and integrated communication that supports the administration and operation of the vessels as well as the requirements of the crews is becoming more and more mission critical. Competitiveness within the maritime industry increasingly depends on reach, flexibility and cost efficiency of the entire IT & communication infrastructure. The maritime industrypsilas business processes require open standards based and integrated IT & telecommunication architecture. In addition crew satisfaction and ILO (International Labour Organization) demand for Internet access, email and mobile communication creating new challenges for ship operators. This study adopted a case to analyze the fleet management systems, and proposes a new system with broadband interface to ensure the efficiency, effectiveness and security requirements of marine corporations. Our new VSAT CBAND system has its strengths in four functions ldquoldquonavigation informationrdquo, ldquoengine room informationrdquo, ldquodocuments and databaserdquo and audio/video transmissionrdquo. In this case successful implementation, we compared the conducted benefits after the new VSAT CBAND system implementation and that before. This new system can reduce the communication expense US$11646/month.","Mission critical systems,International Labour Organization,Case Study,Telecommunication standards,Communication system security,telecommunication network management,Costs,telecommunication computing,Marine vehicles,F-plastics marine corporation,Internet access,email,navigation information,Mobile communication,maritime industry business process,broadband interface,VSAT,Electronic mail,network-based fleet management systems,information and communication technology,streamline maritime operation,satellite ground stations,Plastics,communication infrastructure,broadband networks,Fleet Management Systems,marine communication,audio-video transmission,VSAT CBAND system,Communication industry,mobile communication,Internet,engine room information,"
"the least-cost network selection scheme for delay-constrained transmission in the multi-band maritime communication system","2011","As various types of wireless systems are characterized by its own individual reliability and transmission cost in the multi-band maritime communication network, a means of selecting a least-cost system is required for transmitting the shipment information within a pre-specified time constraint. In this paper, a simple decision criterion for a least-cost network selection has been derived with a stochastic Markov decision process, so as to warrant the delay-constrained transmission in a distributed manner. Our simulation results show that the proposed approach can reduce the transmission cost dramatically under the varying channel conditions of the different networks.","Markov processes,multiband maritime communication system,Markov Decision Process,wireless systems,Monitoring,Reliability,Communication networks,stochastic Markov decision process,mobile radio,least cost network selection scheme,delay constrained transmission,radio networks,Steady-state,Network Selection,decision criterion,marine communication,shipment information,Simulation,Temperature sensors,prespecified time constraint,"
"noise reduction and atmospheric correction for coastal applications of landsat thematic mapper imagery","1999","The Landsat Thematic Mapper (TM) has three visible bands centered at 485 nm, 560 nm, and 660 nm which can be used for ocean applications. This article presents a method for deriving the bottom albedo from the TM in coastal waters. Our study of historical TM images shows degradation of the sensor through time. Pattern noise in the imagery in Bands 2 and 3 was analyzed and removed using a combination of Fourier filtering and edge-detection techniques. Noise was first examined over clear and deep nearby oceanic waters, and the filter algorithms developed there were applied to the entire image. To estimate water-leaving radiance from the satellite sensor, Rayleigh and aerosol path radiance were removed. Radiance due to aerosol scattering was calculated for offshore pixels assuming a marine aerosol type, and it was removed as a constant from the entire scene. The TM sensor calibration was validated by comparing water-leaving radiance values over the clear waters of the Florida current with known, normalized water-leaving radiance values. Corrections for water path radiance and water-column attenuation of bottom-reflected radiance were made for regions of known depth, allowing the bottom albedo and vegetative pixel fraction to be determined for shallow reef areas in the Florida Keys.",""
"neighborhood rough residual networkâ€“based outlier detection method in iot-enabled maritime transportation systems","2023","Outlier detection can identify anomalies in large-scale data. To provide reliability and security for Internet of Things (IoT)-enabled maritime transportation systems (MTSs), in this paper we propose an outlier detection method based on the neighborhood rough residual network (NRRN). We calculate the neighborhood approximation accuracy and neighborhood conditional entropy to obtain the neighborhood combined entropy describing the discrimination ability of the condition attribute subset to the information system. We then delete the redundant attributes according to the attribute combination importance derived from the neighborhood combined entropy. The data after attribute reduction are used to train the convolutional neural network, and the residual network (ResNet50) is used to avoid the degradation of model performance caused by the increase in the number of network layers. The proposed method is compared with mainstream outlier detection algorithms on a fishing vessel operation dataset. Experiments show that the proposed method can greatly improve the accuracy of outlier detection while taking into account interpretability and computational efficiency, thereby ensuring the data integrity of IoT-enabled MTSs.","Outlier detection,Data models,residual network,neighborhood combined entropy,Transportation,Entropy,data integrity,Anomaly detection,Behavioral sciences,Marine vehicles,Residual neural networks,IoT-enabled maritime transportation systems,"
"galernas: a history of coastally trapped disturbances (2003−2020) with hidden frontogenesis in the bay of biscay","2023","Galerna is the term accepted for an abrupt westerly change that affects the north coast of Spain. The wind surge travels from the mid-north coast of Spain to France, generally reaching their maximum intensity at the Basque Coast, and cuts off a period of hot weather, clear skies, and calm conditions at sea. The galernas have a large history of shipwrecks and fishermen deaths. They have been characterized as coastally trapped disturbances (CTD) and their propagation, enhanced with the local formation of a micro-front, was documented to behave like a density current. Alternatively, synoptic fronts have also been reported to cause galernas, considered to be more intense than those generated by a local micro-front. In this article we have generated the first climatology (2003–2020) of these events based on an objective identification methodology. The developed Event Identification Software (EIS), based on both 10-min surface station data and hourly ERA5 reanalysis fields, together with a new Front Identification Scheme (FIS) have enabled a deeper study into the origin and development of these micro-fronts, and a more comprehensive exploration of the interaction of the oceanic fronts entering the Bay of Biscay. Our results show that the area receives an average of four to five relatively intense galernas (Vmax > 50 km h−1) per year. Their number shows a great interannual variability (from one to seven) and a marked seasonality: May and June concentrate the largest fraction (almost one episode each year) and practically no episodes in winter. They occur more frequently between noon and the late afternoon, where the most intense wind records concentrate. Very strong galernas (Vmax > 72 km h−1) have occurred in all 18 years, can happen in any month from February to November, and their monthly distribution does not show the mentioned seasonality. On the contrary, the highest rates of temperature decrease across the galerna front in the coastal stations (−∆T/0.5 h > 4 °C) do have a stronger seasonality, with May and June concentrating a relatively large number of cases with a more abrupt temperature drop. The FIS shows that most of the galernas (83.5%) have a local origin inside the Bay of Biscay, and only a few ones (16.5%) are caused by oceanic fronts initiated out of the region. The local frontogenesis is more frequently initiated by the relatively cold marine southwesterly pre-frontals preceding a parent oceanic front and blowing against the warm continentals inside the Bay of Biscay, after being ducted along the north and northwestern coast of Spain. This hidden local frontogenesis, first revealed by the FIS, seems to be enhanced by the observed lee troughing, which could have both a thermal and dynamic origin, acting simultaneously after the intense Foehn at the coastal strip, preceding the formation of the galerna front. The local front enhancement appears to be the reason for the apparent jump of the primary front, which may eventually weaken, and even disappear, as the galerna front sharpens. Even during the more occasional frontal galernas, directly caused by the westerlies or north-westerlies behind the oceanic front, their eastward propagation is more rapid over the coastal area. The front deforms in shape and may cause its characteristic unexpected/abrupt irruption. All the EIS detected galernas, even the frontal ones, are wind reversals caused by a coastally trapped marine boundary layer. The upper-level ridge over Europe, observed in all of them, seems to be a synoptic ingredient for their development, preventing the eastward propagation of Atlantic depressions and enhancing at the same time the temperature and pressure gradients between the marine and continental air masses.","Bay of Biscay,Galerna,Frontogenesis,Mesofront,Coastally trapped disturbances,"
"signal strength sensitivity and its effects on routing in maritime wireless networks","2008","Unlike terrestrial networks, the received signal strength in maritime wireless networks are subjected to perturbations due to the sea movement. Surface motions at sea cause variations in antenna heights and orientations of the communicating node (e.g. ships and buoys), thus affecting the received signal strength. In order to minimize such undesirable effects, we carried out a detailed study of the relationship between sea waves and the received signal strength. The effect of antenna gain variations due to tilting of antenna masts were studied by modeling sea waves. The channel path-loss variations were studied using a two-ray path-loss model for the maritime environment. Our analysis showed that the sea wave movements affect both short and longer links. We proposed a simple scheme to avoid the use of unstable links and implemented it on the QualNet network simulator. We carried out IEEE 802.16-based mesh network simulations with sea terrain and path loss models. We observed performance improvements in packet delay and throughput when the stable link selection scheme was used.","receiving antennas,Antennas,radio links,antenna heights variations,antenna masts tilting,channel path-loss variations,Distance measurement,Marine vehicles,QualNet network simulator,IEEE 802.16-based mesh network simulations,unstable links,sea waves,packet delay,maritime wireless networks routing,antenna gain variations,sea terrain,Gain,Receiving antennas,marine communication,signal strength sensitivity,communicating node,two-ray path-loss model,Signal to noise ratio,Interference,received signal strength,WiMax,"
"benchmarking of emulated wireless edge cloud connectivity for maritime environments","2022","Remote ship pilotage, smart fairway navigation, autonomous maritime transport and smart maritime logistics present new challenges to the maritime industry. One of the challenges is increasing dependency on reliable network connectivity that can range from low priority entertainment communications to high priority safety critical communications. Traffic prioritization is needed at the open sea, where ships typically resort to expensive satellite connectivity that incurs long latency and narrow bandwidth. Near the coastline, ships can switch to 5G-based communications with low latency and high bandwidth, and possibly even utilize low-latency edge computing capabilities. Our contribution in this paper is a cloud-based networking testbed that supports network traffic shaping to emulate satellite and 5G-based communications between an edge cloud located onboard a ship and another edge cloud located onboard another ship or at the shore under traffic loss scenarios. Potential use-cases for our work include emulation of peer-to-peer communications (i.e., ship-to-ship or ship-to-shore) and mesh networking. The system can also be used as a basis for real-time ship networking, for instance, as building block for traffic prioritization in Kubernetes-based edge clouds.","Satellites,autonomous maritime transport,smart maritime logistics,maritime,cloud-based networking,Safety,telecommunication computing,high priority safety critical communications,peer-to-peer communications,Telecommunication traffic,ship-to-shore,Switches,satellite,Wireless communication,reliable network connectivity,edge cloud,5G mobile communication,logistics,ships,marine safety,low-latency edge computing capabilities,5G,cloud computing,narrow bandwidth,real-time ship networking,emulated wireless edge cloud connectivity,low priority entertainment communications,maritime environments,remote ship pilotage,edge computing,networking,network traffic,traffic prioritization,ship-to-ship,Bandwidth,traffic loss scenarios,telecommunication traffic,Cloud computing,open sea,Kubernetes,smart fairway navigation,maritime industry,expensive satellite connectivity,Kubernetes-based edge clouds,"
