"name","year","abstract","keywords"
"drought-triggered western spruce budworm outbreaks in the interior pacific northwest: a multi-century dendrochronological record","2014","Douglas-fir forests in the interior Pacific Northwest are subject to sporadic outbreaks of the western spruce budworm, a species widely recognized as the most destructive defoliator in western North America. Outbreaks of the western spruce budworm often occur synchronously over broad regions and lead to widespread loss of leaf area and decrease in growth rates in affected stands. In spite of the ecological and economic significance of this defoliator, the mechanisms controlling this species’ population dynamics are still not fully understood. We used dendrochronological methods to reconstruct three centuries of western spruce budworm outbreaks at thirteen sites along a transect running from central Oregon to western Montana and compared the outbreak reconstructions with regional drought history. The reconstructions reveal repeated western spruce budworm outbreaks that sometimes persisted more than a decade and were significantly synchronous among sites. Synchrony was higher in the second half of the record, possibly due to changes in forest composition and structure brought about by land use practices. Across stands and regions, there was a moderately strong relationship between initiation of synchronous outbreaks and periods of transitional climate conditions in which moisture availability was below average prior to outbreak initiation, but above average in the first few years of an outbreak. There was a weak relationship between cessation of outbreaks and one or more years of high moisture availability. Outbreaks tended to occur near the end of droughts. The association between climatic variability and outbreak dynamics observed across this transect indicates that climate is an important driver of western spruce budworm outbreaks. Other factors that we did not test, but that may influence outbreak dynamics include stand structure, forest composition, predation, and phenological synchrony between larvae and host trees. Future changes in western spruce budworm outbreak dynamics will be determined by a combination of changing climate, interactions with other disturbance agents, and changing forest composition and structure. Our results suggest that western spruce budworm outbreaks will likely intensify if drought frequency increases in the future.","Dendrochronology,Pacific Northwest,Drought,Western spruce budworm,Defoliators,Insect outbreaks,"
"seashore sediment and water chemistry at the admiralty bay (king george island, maritime antarctica) – geochemical analysis and correlations between the concentrations of chemical species","2020","This study covers water and sediment chemical characteristics by the western shore of Admiralty Bay (King George Island, Antarctica) in 2016. Chemical processes between sediment and water have been described based on the determination of ions, metals, non-metals, and TOC concentrations. Rock weathering is an important source of Fe, Ni, Co, Al in the seashore area. The PCA shows the impact of acidification in the release metals from sediment. Our results indicate that riverine mineral fluxes need to be accounted for as the volume of melt increases in response to climate change. Based on geoaccumulation indexes (anthropogenic fingerprint), we observed an increased concentration of Pb (Igeo = 1.643), in the lake near station facilities and Cd in the area of Ecology Glacier (Igeo > 1.389). Taking into account climate change and the intensification of anthropopressure, our study indicates that Antarctica requires a special focus on the seasonal dynamics of mineral content and pollution assessment.","Antarctica,Migration of pollutants,Anthropogenic influence,Pollution,"
"maritime spatial wave transmission system","2019","Our research mainly studies the maritime spatial wave transmission system. We have used the empirical formula of the predecessors to classify electromagnetic wave transmission losses into four categories: free space loss, ionospheric absorption loss, sea surface reflection loss and additional loss. We also model the distribution of atmospheric noise and the problem of the reachable frequency band at the receiving point. Finally, under the actual situation, considering the factors such as loss, noise, minimum required signal-to-noise ratio, incident elevation angle, etc., to calculate the maximum count of hops under this model, that is, the optimal solution of the solution equation.","Electromagnetic scattering,Surface waves,electromagnetic wave transmission,atmospheric noise,Reflection,transmission loss,Propagation losses,Ionosphere,Data models,Sea surface,free space loss,electromagnetic wave transmission losses,ionospheric absorption loss,maritime spatial transmission,shadow effect,marine communication,max count of hops,maritime spatial wave transmission system,sea surface reflection loss,"
"detecting anomalous deviations from standard maritime routes using the ornstein–uhlenbeck process","2018","",""
"object detection based on multi-sensor proposal fusion in maritime environment","2018","In this paper, we propose an effective object detection framework based on proposal fusion of multiple sensors such as infrared camera, RGB cameras, radar and LiDAR. Our framework first applies the Selective Search (SS) method on RGB image data to extract possible candidate proposals which likely contain the objects of interest. Then it uses the information from other sensors in order to reduce the number of generated proposals by SS and find more dense proposals. Finally, the class of objects within the final proposals are identified by Convolutional Neural Network (CNN). Experimental results on real dataset demonstrate that our framework can precisely detect meaningful object regions using a smaller number of proposals than other object proposals methods. Further, our framework can achieve reliable object detection and classification results in maritime environments.","sensor fusion,marine radar,Cameras,Feature extraction,Laser radar,proposal generation,image colour analysis,deep neural networks,RGB cameras,radar,object detection,autonomous vehicles,Proposals,feature extraction,image classification,radar imaging,optical radar,convolutional neural nets,search problems,infrared imaging,maritime environment,infrared camera,object proposal methods,Microsoft Windows,RGB image data,multisensor proposal fusion,Object detection,Sensors,Convolutional Neural Network,Selective Search method,"
"learning for prediction of maritime collision avoidance behavior from ais network","2021","With the rapid increase in global maritime shipping, there is a great demand for the technology of maritime traffic monitoring to detect inappropriate encountering interaction between ships and prevent ship collision accidents. The Automatic Identification System (AIS) network makes it possible to collect a large volume of maritime traffic data and investigate the collision avoidance behavior of real-world ships. Most collision avoidance systems are based on expert systems and simulations based on the International Regulations for Preventing Collisions at Sea (COLREGs). Those regulations outline the general principles underlying collision avoidance; however, they do not provide specific guidance and fail to account for the complexity of many real-world situations. Furthermore, guidance systems coordinating the movement of a ship must have the capacity to predict the movement behavior of all ships involved in potential encounter situations, and do so as early as possible for anti-collision reaction. Our objective in this study was to model the collision avoidance behaviors of human operators in order to formulate a set of realistic trajectory predictions for encountering near collision scenarios. By machine learning approach, the proposed framework is able to learn a model of interaction movement behavior from collected AIS historical traffic data involving near collision situations and then generate a set of predicted trajectories while ships encountering. The proposed model eliminates the need for a priori information related to environmental conditions and the rules governing encounter situations. The resulting projections can be used to suggest anti-collision paths for navigators or to guide the selection of collision-free paths for maritime autonomous surface ships.","maritime traffic monitoring,collision-free paths,Regulation,maritime traffic data,Automatic Identification System network,collision avoidance systems,maritime autonomous surface ships,Marine vehicles,Machine learning,control engineering computing,Predictive models,AIS network,ships,marine safety,global maritime shipping,anti-collision paths,International Regulations for Preventing Collisions at Sea,machine learning,Sea surface,expert systems,marine engineering computing,interaction movement behavior,encounter situation,Trajectory,collision avoidance behavior,trajectory prediction,AIS historical traffic data collection,ship collision accidents,Navigation,navigation,COLREG,collision avoidance,marine control,learning (artificial intelligence),maritime collision avoidance behavior prediction,"
"demurrage pattern analysis using logical analysis of data: a case study of the ulsan port authority","2022","Maritime logistics, which accounts for around 80% of international trade around the world, has been a driving force for economic growth. Increases in maritime traffic, however, lead to increased congestion in berths and terminals. This congestion in turn negatively affects the total ship turnaround time and leads to decreased efficiency in port operations and a higher demurrage rate, which refers to the number of vessels in queue for more than a fixed time period waiting to load/unload out of the total number of vessels entering a port. The demurrage rate directly affects a port’s operating profits; thus, this rate needs to stay as low as possible. In this study, we focus on developing a methodology to address the demurrage rate of a port. To this end, we first collect two sets of vessel data (2016 annual data for training and 2019 annual data for validating) for ships entering and leaving the Port of Ulsan in the Republic of Korea and integrate these datasets with berth data and weather data. We tailor the logical analysis of data (LAD) technique to derive the patterns from the training data that mitigate or aggravate the demurrage rate. We use these patterns to predict the demurrage rate for the validating set of data. The overall binary classification results demonstrate the proposed LAD technique’s competitive performance, compared with other state-of-the-art machine learning methods. We then analyze the patterns to derive policy suggestions that can lower the demurrage rate at the Port of Ulsan. Our computational experiments find that the availability of tugs or pilots and port arrival times mainly affect the demurrage rate at the Port of Ulsan. Finally, our study showcases new possibilities for using patterns of demurrage and non-demurrage vessels obtained by LAD to help policymakers and port operators address the growing demurrage problem.","Maritime logistics,Maritime traffic data,Logical analysis of data,Port congestion,Demurrage rate,"
"on the effectiveness of ai-assisted anomaly detection methods in maritime navigation","2020","The automatic identification system (AIS) has become an essential tool for maritime security. Nevertheless, how to effectively use the static and dynamic voyage information of the AIS data in maritime traffic situation awareness is still a challenge. This paper presents a comparative study of artificial intelligence (AI) techniques on their effectiveness in dealing with various anomalies in maritime domain using the AIS data. The AIS on-off switching (OOS) anomaly is critical in maritime security, since AIS technology is susceptible to manipulation and it can be switched on and off to hide illegal activities. Thus, we try to detect and distinguish between intentional and non-intentional AIS OOS anomalies through our AI -assisted anomaly detection framework. We use AIS data, in particular positional and navigational status of vessels, to study the effectiveness of seven AI techniques, such as artificial neural network, support vector machine, logistic regression, k-nearest neighbors, decision tree, random forest and naive Bayes, in detecting the AIS OOS anomalies. Our experimental results show that ANN and SVM are the most suitable techniques in detecting the AIS OOS anomalies with 99.9% accuracy. Interestingly, the ANN model outperforms others when trained with a balanced (i.e., same order of samples per class) dataset, and SVM, on the other hand, is suitable when training dataset is unbalanced.","maritime traffic situation awareness,AI-assisted anomaly detection,decision trees,Support vector machines,logistic regression,Anomaly detection,static voyage information,random forests,ANN,marine navigation,Feature extraction,security of data,maritime security,k-nearest neighbors,regression analysis,AIS technology,naive Bayes,neural nets,naive Bayes methods,automatic identification system,marine safety,marine engineering,support vector machines,maritime navigation,dynamic voyage information,maritime domain,random forest,SVM,Artificial intelligence,AIS on-off switching anomaly,nearest neighbour methods,artificial neural network,Training,Trajectory,support vector machine,nonintentional AIS OOS anomalies,Navigation,artificial intelligence,decision tree,AIS data,"
"emerging marine pollution from container ship accidents: risk characteristics, response strategies, and regulation advancements","2022","Container ship accidents can contaminate the surrounding marine environment and even have wider impact. Our study aims to provide a comprehensive review of emerging marine pollution from container ship accidents with the focus on risk characteristics, response strategies, and regulation advancements. It was found that the number of container ship accidents significantly increased in the past decade, and most accidents occurred in ports, harbors, piers, anchorages, berths, and open seas. The types of accidents were mainly collisions, groundings, and fires. The risk of marine pollution from container ship accidents is complex due to the variety of containerized cargo. The contamination derived from heavy metal, plastic fiber, leaked fuel, and hazardous and noxious substances after accidents can endanger entire marine habitats and be continuously accumulated through the food chain, eventually posing a threat to human health. The risks and pollution caused by container boxes are often overlooked. There is a basic response process, comprising data collection, decision-making, emergency response, monitoring, etc., for container ship accidents. There are currently deficiencies in management regulations for mitigating sunken container pollution. Improving operating procedures, establishing regional cooperation frameworks, developing contingency plans and protocols, and increasing public awareness can help deal with these pollution issues.","Regulation,Container ship accidents,Environmental risk,Marine pollution,Response,"
"phytoplankton community changes in a coastal upwelling system during the last century","2023","Phytoplankton communities in coastal upwelling systems are influenced by the interplay between human-induced and natural climate forcing that vary regionally and the two factors have not been well quantified. Combining lipid biomarker analyses in 23 sediment cores from the Zhejiang coast of the East China Sea and a physical-ecological model, we found that during the 1960s–2000s there was a 42 ± 4% increase in diatom proportions and a 17 ± 8% decrease in dinoflagellate proportions within the core upwelling area that is attributed to changes in Kuroshio Current transport and coastal upwelling. During the 1950s–2000s there was a 16 ± 8% increase in dinoflagellate proportions and 12 ± 4% decrease in diatom proportions outside the core upwelling area which is attributed to anthropogenic nutrient inputs and climate warming. Our results provide a novel approach to quantify mechanisms of past and future changes in marine phytoplankton communities.","Changjiang River,Anthropogenic activities,Coastal upwelling,Diatoms,Kuroshio Current,Dinoflagellates,"
"toward a new maritime communication system in detroit of gibraltar where conventional and autonomous ships will co-exist","2017","In the next decades, hundreds of autonomous ships (AS) and Conventional ships (CS) will cross the Detroit of Gibraltar. For their autonomous operation, and remote control, these ships need to communicate with each other, with the vessel traffic system (VTS), with the port state control (PSC) and with the shore control centre (SCC). For a sustainable maritime industry, the biggest challenge will be the implementation of reliable and cost effective communication carrier to assure a continuous ships connectivity. Our contribution consists of quantifying and classifying the data to be transferred, the identification of ship mobility environment challenges, and the proposal of mobile WiMAX as a reliable, secure and cost effective maritime communication carrier. This communication carrier must be suitable for the dense maritime traffic, in the Detroit of Gibraltar, where conventional ships and autonomous ships will co-exist.","Ports (Computers),Marine vehicles,Communication,Reliability,Mobile communication,shore control centre,port state control,Wireless,ships,autonomous ships,Ship,Handover,vessel traffic system,sea ports,remote control,maritime communication system,dense maritime traffic,sustainable maritime industry,marine communication,WiMAX,reliable cost effective maritime communication carrier,Handover management,WiMax,"
"autonomous swarm unmanned vehicles surveillance adapted to maritime environmental changes using algorithm inspired by adaptive mechanism of living organisms","2017","We propose a swarm control algorithm for unmanned vehicles that adapts to unexpected environments while making the optimal formation. Our proposed algorithm, â€œautonomous and adaptive controlâ€, is inspired by the control mechanism of living organisms and reconciles adaptability under a complex and changing environment and optimality for the various purposes of the system. In this paper, we apply the proposed algorithm to a surveillance system using multiple unmanned undersea vehicles that will be used in realistic operations. We made computational simulations of the surveillance system considering a real and complex seabed topography, sound speed profiles, and ocean current. We confirmed that the algorithm can work effectively in a complex and unexpected environment. The result show that the algorithm is can be used effectively in unexpected open-air conditions as well as in specific in-house conditions.","surveillance,multi-robot systems,autnomous control,maritime environmental changes,Heuristic algorithms,autonomous swarm unmanned vehicles surveillance,marine engineering,cooperative behaviors,Oceans,swarm control algorithm,autonomous underwater vehicles,adaptive control,Sonar,adaptive mechanism,autonomous control,Adaptation models,multiple unmanned undersea vehicles,swarm control,complex seabed topography,living organisms,Uncertainty,Computational modeling,Surveillance,swarm intelligence,cooperative systems,"
"baseline air mass selection at cape point, south africa: application of 222rn and other filter criteria to co2","2004","Concentrations of 222Rn (March 1999–August 2002) from a recently installed analyser at the station Cape Point (34°S, 18°E), South Africa, were analysed statistically. The combination of 222Rn with information on wind direction and carbon monoxide (CO) permitted a classification of air masses into continental, marine, and mixtures of both. The ability to select trace gas data representing purely maritime conditions is shown through application to carbon dioxide (CO2) data. 222Rn levels at Cape Point ranged from near zero to above 5000mBqm−3. Monthly percentiles show practically no seasonal dependence for values up to the 25th percentile (P25), corresponding to 222Rn <100mBqm−3, which is considered typical for marine air. In contrast, 222Rn percentiles exceeding P50 reveal an austral winter maximum, related to a higher incidence of continental air at that time of the year. The wind sector pattern for 222Rn concentrations largely coincides with that observed for CO, but covers a wider sector to the east, reflecting continental source areas. Air masses with 222Rn levels between 100 and 250mBqm−3 were found to be still affected by terrestrial sources. Our routinely used percentile-based statistical filter applied to CO2 accepted <75% of the data compared to the radon criterion for maritime air (222Rn <100mBqm−3), which only yielded 18%, but is more stringent in excluding terrestrial influences. CO2 data filtered by using a combination of various selection parameters agreed well with data obtained for 222Rn <100mBqm−3, confirming that this 222Rn threshold is a suitable criterion for purely maritime data. Nonetheless, for CO2 the statistical filter, which does not depend on other species and has better data coverage, still retains its applicability for routine trace gas filtering with respect to baseline concentrations.","CO,Rn (radon),Background concentration,Data filtering,Air mass classification,"
"augmented reality for maritime navigation assistance - egocentric depth perception in large distance outdoor environments","2021","Augmented reality (AR) provides enormous potential to improve navigation assistance interfaces by displaying information directly into the user's field of view. In maritime contexts, such AR interfaces could supplement conventional solutions that require users to interpret spatial positions visualized on two-dimensional maps. In order to design useful navigation assistance, it is crucial to understand how egocentric distances of displayed objects are perceived and how different design attributes influence depth estimation. While previous research mainly focused on depth perception in indoor environments and rather short distances, this paper presents an investigation of the perceived egocentric distance of virtual objects in distances up to 75 meters in an open outdoor environment. In a perceptual matching task experiment using the Microsoft HoloLens 2, participants had to move objects with different (i) shape, (ii) coloration, and (iii) relation to floor to various target distances. Our results suggest that participants overestimated the distance to virtual objects across all tested distances since they significantly underproduced target distances for all investigated design factors. Based on these results, we explored potential design implications for a maritime AR navigation assistance on a ship in the local port area.","augmented reality,Microsoft HoloLens 2,navigation assistance interfaces,spatial positions,human computer interaction,open outdoor environment,ship,marine navigation,egocentric depth perception,indoor environments,design attributes,perceptual matching task experiment,ships,Performance evaluation,marine engineering,distance outdoor environments,Seaports,Shape,perceived egocentric distance,depth estimation,AR interfaces,Indoor environment,two-dimensional maps,maritime navigation assistance,local port area,displayed objects,target distances,Human-centered computing-Human computer interaction (HCI)-Interaction paradigms-Mixed/augmented reality,maritime AR navigation assistance,Visualization,Human-centered computing-Visualization-Empirical studies in visualization-,Navigation,Rendering (computer graphics),virtual objects,user field of view,"
