"name","year","abstract","keywords"
"a bayesian iterative geomagnetic model with universal data input: self-consistent spherical harmonic evolution for the geomagnetic field over the last 4000 years","2019","Changes of the Earth's magnetic field have been observed with varying spatial and temporal resolution since the middle ages by means of compasses, and later by refined mechanical inclination and intensity instruments, until the modern use of quantum mechanical devices and satellite observations. Ancient records, on the other hand, rely on the natural magnetization of archaeological artifacts and other materials, such as rocks and sediments, being therefore indirect, less accurate and sparser. The combination of such heterogeneous records into a single, self-consistent, global model of the geomagnetic field is very challenging: the highly uneven data coverage, both in space and time, requires a careful handling of data uncertainties and error correlations. Previous models dealt with this problem using separated treatments of instrumental data and indirect records, respectively, as well as a different handling of the dipole field component, with respect to non-dipole terms. Here we present a global geomagnetic field model based, for the first time, on the simultaneous inversion of historical, archaeomagnetic, and volcanic records, using a Bayesian approach with minimal-committing time regularization that minimizes the energy of secular variation. A detailed assessment of data uncertainty and error correlation is used to minimize artifacts generated by the appearance of an overwhelming number of incomplete, mostly declination-only records, associated with shipboard measurements in the early colonial period. Our model yields lower dipole energies, which better match modern values, as well as higher non-dipole energies and a stronger secular variation of the dipole moment. Some model artifacts associated with extremely heterogeneous distributions of records in time and space are not completely eliminable and might be caused by incorrect a-priori uncertainty assessments. Alternatively, they might represent an intrinsic limit that can be overcome only by adding new records at critical locations and times.","Geomagnetism,Field modeling,Historical records,Secular variation,Archaeomagnetism,"
"prediction of rendezvous in maritime situational awareness","2018","In this work, we consider the problem of algorithmically predicting rendezvous among vessels based on their trajectory forecasts in a maritime environment. The problem is treated as hypothesis testing on the expected value of the distance between trajectories. We relate this quantity to the first and second degree Wasserstein distances between trajectory forecast distributions. These distributions are obtained using integrated Ornstein-Uhlenbeck process models with the trajectory measurements collected so far. Building upon these results, we propose an algorithm which traverses the trajectories observed so far for detecting rendezvous over a rolling time horizon. We demonstrate the efficacy of the proposed algorithm using simulations.","Wasserstein distances,predictive models,Prediction algorithms,situation awareness,hypothesis testing,Integrated Ornstein-Uhlenbeck process,Stochastic processes,Predictive models,stochastic processes,trajectory measurements,integrated Ornstein-Uhlenbeck process models,Forecasting,Wasserstein distance,Trajectory,probability,Uncertainty,mean reverting process,trajectory forecast distributions,knowledge discovery,"
"modeling of interferences on other satellites in maritime satellite communications","2013","In maritime mobile satellite communications, mechanically controlled tracking systems are used to compensate changes of antenna orientation due to changes of a ship attitude caused by waves or winds of the sea. Orientations of antennas on a ship are limited so that transmitted electromagnetic waves are not affected by structures on the ship. Thus it is allowed to transmit waves when a clearance angle is greater than certain criteria. Our group has researched about fundamental relation between clearance angles and interferences for other satellites or other systems on the ship by numerical simulations for a simplified model. In this report, a realistic ship model is assumed for the simulations. As a result, a clearance angle, which interferences to the receiving satellite are small, has been found out under the conditions of the simulations. A simple model which describes interferences to received levels of the aiming and neighboring satellites is presented.","Satellites,interference model,maritime,satellite receiving,electromagnetic wave transmission,Marine vehicles,Satellite antennas,Bridges,antenna orientation,interference,Transmitting antennas,Satellite communications,ship structures,numerical simulations,mobile radio,reception level,radiofrequency interference,mobile antennas,tracking systems,ship attitude,Receiving antennas,ship antenna,marine communication,maritime mobile satellite communications,diffracted wave,numerical analysis,"
"a visual analytics process for maritime resource allocation and risk assessment","2011","In this paper, we present our collaborative work with the U.S. Coast Guard's Ninth District and Atlantic Area Commands where we developed a visual analytics system to analyze historic response operations and assess the potential risks in the maritime environment associated with the hypothetical allocation of Coast Guard resources. The system includes linked views and interactive displays that enable the analysis of trends, patterns and anomalies among the U.S. Coast Guard search and rescue (SAR) operations and their associated sorties. Our system allows users to determine the potential change in risks associated with closing certain stations in terms of response time, potential lives and property lost and provides optimal direction as to the nearest available station. We provide maritime risk assessment tools that allow analysts to explore Coast Guard coverage for SAR operations and identify regions of high risk. The system also enables a thorough assessment of all SAR operations conducted by each Coast Guard station in the Great Lakes region. Our system demonstrates the effectiveness of visual analytics in analyzing risk within the maritime domain and is currently being used by analysts at the Coast Guard Atlantic Area.","Risk management,United States,Calendars,visual analytics process,data visualisation,maritime risk assessment,Decision making,data analysis,military computing,search and rescue operation,risk management,US Coast Guard Atlantic Area Command,Visual analytics,Data visualization,risk assessment,US Coast Guard Ninth District Command,Lakes,Coast Guard,maritime environment,maritime resource allocation,Time factors,resource allocation,"
"sparse multi-channel synthetic aperture radar based motion induced distortion correction and classification of maritime scenes","2021","Multi-channel Synthetic Aperture Radar (MSAR) in the maritime environment has proven to be an effective technique for improved image fidelity and scene characterization. Past demonstrations of MSAR-based methods for improvements such as motion induced distortion correction and image classification were performed using a uniformly spaced array of phase centers. In this paper, we derive novel extensions of these techniques to the case of sparse and non-uniformly spaced phase center configurations and demonstrate their effectiveness for a variety of platforms and sensor arrangements. We establish general techniques for correcting motion induced distortions, establish theoretical bounds of performance, and empirically validate our techniques on data derived from our airborne MSAR system. We then use these images to characterize the structure of the maritime scene using our MSAR-based classification technique. Our imaging and classification techniques are amenable to efficient implementation on diverse hardware platforms and sensor arrangements, and thus can find ready application in practical multichannel radar systems.","Phased arrays,image classification,Synthetic aperture radar,Radar imaging,Classification algorithms,Multi-channel synthetic aperture radar (SAR),Imaging,Radar polarimetry,Arrays,ocean imaging,"
"data gap analysis of ship and maritime data using meta learning","2021","With the developments in new Internet of Things (IoT) technology, ship owners and managers can access and analyze vast amounts of real-time onboard data. However, data collected from the ship’s engine and navigation information include various types of errors owing to imprecision, bias, sensor failure, or human error caused by manual recording by the ship operator’s hands. Such abnormal data make accurate ship performance prediction and monitoring difficult; thus, the original data need to be carefully refined through data preprocessing. Machine learning models have been used to detect and remove abnormal data; however, this yields inconsistent predictions in results depending on the types of machine learning models used. In this study, a robust data gap analysis method is proposed to detect abnormal data among ship and marine data collected in real time. Data preprocessing, including rule-based data imputation, clustering, denoising, and dimension reduction, is systematically performed; subsequently, a meta-learning model, which is a combination of various machine learning models, is used to predict ship performance and detect its abnormal data. This study compared the performance of single-machine learning models and meta models through various error analysis methods that utilize actual ship operation data. The single machine leading models have various error values depending on types of data and models, while the meta model consistently has values of less than 5% of mean absolute percentage error (MAPE) and relative root-mean-square error (RRMSE), showing a Nash–Sutcliffe efficiency coefficient(NSE) value of 0.7 or higher. Our proposed data gap analysis framework, including the meta-learning model, can be useful for monitoring the condition of ships, as it can more accurately and robustly classify them as normal or abnormal.","Data preprocessing,Machine learning error measures,Meta learning,Data gap analysis,"
"synergistic abiotic and biotic stressors explain widespread decline of pinus pinaster in a mixed forest","2019","Global change potentially increases forest vulnerability. Different abiotic and biotic factors may interact to cause forest decline and accelerated tree mortality. We studied a mixed Mediterranean continental forest where Pinus pinaster Ait. (maritime pine) shows widespread decline to analyse the role of different abiotic and biotic factors on health status and growth dynamics both at the individual and plot levels. We also analysed stand composition and regeneration of tree species to check whether there is a change in species dominance. Fungal pathogens were seldom present and we detected no pervasive fungi or insect infestation and no presence of pathogens like Heterobasidion or Phytophthora. Infection of hemiparasite plants like Viscum album L. (mistletoe) can reduce leaf area and its abundance is generally considered an expression of host decline. Yet, the existence among declining trees of high defoliation levels without mistletoe, but not vice versa, suggests that defoliation in response to some abiotic stressor could be a predisposing factor preceding mistletoe infection. Compared to healthy trees, declining and dead trees exhibited higher defoliation rates, smaller needles and lower recent growth with steeper negative trends. Dead and declining trees showed similar negative growth trends since the early 1990s droughts, which we interpreted as early warning signals anticipating mortality of currently declining trees in the near future. Mortality of maritime pine extending across all size classes, the lower presence of this species in the smallest size classes and its lack of regeneration suggest it is potentially losing its current dominance and being replaced by other co-occurring, more drought-tolerant species. Our results unravelled that maritime pine decline seems to be mainly driven by a combination of predisposing and inciting abiotic factors (microenvironment and drought stress) and biotic factors (mistletoe). The absence of widespread fungal pathogens suggests that they may have a minor role on pine decline acting only eventually as contributing factors. Although there could be other interrelations among factors or other biotic agents at play, our results strongly suggest that water stress plays a major role in the decline process of the dominant species on an ecosystem with strong land-use legacies.","Abiotic stress,Mistletoe,Defoliation,Drought,Land-use,Fungal pathogens,"
"incremental data uncertainty handling using evidence combination: a case study on maritime data reasoning","2015","Semantic incompatibility is a conflict that occurs in the meanings of data. In this paper, we propose an approach for data cleaning by resolving semantic incompatibility. Our approach applies a dynamic and incremental enhancement of data quality. It checks the coherency/conflict of the newly recorded facts/relations against the existing ones. It reasons over the existing information and comes up with new discovered facts/relations. We choose maritime data cleaning as a validation scenario.","Semantics,Datalog,Marine vehicles,Data Reasoning,maritime data reasoning,data quality,Semantic Data Cleaning,evidence combination,Databases,Probabilistic logic,uncertainty handling,Maritime Data,inference mechanisms,incremental data uncertainty handling,Uncertainty,dynamic enhancement,Cleaning,Cognition,data cleaning,learning (artificial intelligence),semantic incompatibility,data handling,incremental enhancement,"
"ocean oil spill detection from sar images based on multi-channel deep learning semantic segmentation","2023","One of the major threats to marine ecosystems is pollution, particularly, that associated with the offshore oil and gas industry. Oil spills occur in the world's oceans every day, either as large-scale spews from drilling-rig or tanker accidents, or as smaller discharges from all sorts of sea-going vessels. In order to contribute to the timely detection and monitoring of oil spills over the oceans, we propose a new Multi-channel Deep Neural Network (M-DNN) segmentation model and a new and effective Synthetic Aperture Radar (SAR) image dataset, that enable us to emit forewarnings in a prompt and reliable manner. Our proposed M-DNN is a pixel-level segmentation model intended to improve previous DNN oil-spill detection models, by taking into account multiple input channels, complex oil shapes at different scales (dimensions) and evolution in time, and look-alikes from low wind speed conditions. Our methodology consists of the following components: 1) New Multi-channel SAR Image Database Development; 2) Multi-Channel DNN Model based on U-net and ResNet; and 3) Multi-channel DNN Training and Transfer Learning. Due to the lack of public oil spill databases guaranteeing a correct learning process of the M-DNN, we developed our own database consisting of 16 ENVISAT-ASAR images acquired over the Gulf of Mexico during the Deepwater Horizon (DWH) blowout, off the west coast of South Korea during the Hebei Spirit oil tanker collision, and over the Black Sea. These images were pre-processed to create a 3-channel input image IM = ","Oil spill detection,Deep learning,SAR images,Spatial filtering,"
"hard and soft data fusion for maritime traffic monitoring using the integrated ornstein-uhlenbeck process","2020","When commonly used Automated Identification System (AIS) data to monitor vessel traffic is unavailable, one can resort to other types of data such as remote sensing and open source data to improve detection and tracking in order to increase Maritime Domain Awareness (MDA). The paper proposes a method for fusion of soft open source data (e.g. Twitter, Farkwar and other), remote sensing (RADARSAT-2) and S/T-AIS (hard) data in application to maritime traffic monitoring in the coastal and the open waters. The method assumes modeling vessels' motion by the Integrated Ornstein-Uhlenbeck process. The data fusion performance evaluation using real data is presented showing improved tracking for MDA especially in the absence of AIS data. The impact of inclusion of soft, in particular the Twitter data, into the fusion module is also discussed.","maritime traffic monitoring,sensor fusion,remote sensing,automated identification system data,integrated Ornstein-Uhlenbeck process,maritime domain awareness,Twitter data,Integrated Ornstein-Uhlenbeck process,data fusion performance evaluation,soft open source data,vessel traffic,hard open source data,ships,fusion module,marine safety,stochastic processes,marine engineering,AIS,Data models,MDA,Radar tracking,Artificial intelligence,Data integration,Uncertainty,hard and soft data fusion,Surveillance,Twitter,social networking (online),open waters,RADARSAT-2,"
"keeping the baddies out and the bridge calm: embedded authentication for maritime networks","2022","Integrated bridges of todayâ€™s vessels are complex and distributed maritime systems that interconnect versatile electronic equipment. However, digitized vessels have long ceased to be isolated systems and are thus increasingly vulnerable to cyber attacks. In this context, integrity and authentication of the communication onboard is crucial. Therefore, we introduce MARMAC, a low-cost solution to retrofit authentication of nautical communication. MARMAC is based on symmetric cryptography and extends the prevalent IEC61162-450 protocol enabling a backward-compatible solution which mitigates common attacks. Using a specific gatekeeper approach, MARMAC can prevent unauthenticated messages from being processed that could otherwise affect the nautical situational awareness on the bridge. Our approach is evaluated using real network traffic in a laboratory testbed with low-cost hardware, highlighting its feasibility and potential to secure existing maritime systems.","telecommunication security,Message Authentication Codes,Electric potential,common attacks,Multi-MAC,Authentication,Telecommunication traffic,MARMAC,IEC 61162-450,Bridges,baddies,Maritime Cyber Security,marine systems,Electronic equipment,nautical situational awareness,Performance evaluation,bridge,maritime networks,integrated bridges,NMEA0183,backward-compatible solution,network traffic,on-board communications,distributed maritime systems,low-cost solution,digitized vessels,onboard communication,telecommunication equipment testing,Integrity,IEC61162-450 protocol,message authentication,nautical communication,cryptographic protocols,marine communication,low-cost hardware,Protocols,embedded authentication,versatile electronic equipment,unauthenticated messages,symmetric cryptography,isolated systems,authorisation,specific gatekeeper approach,cyber attacks,"
"nmtlat: a new robust mobile multi-target localization and tracking scheme in marine search and rescue wireless sensor networks under byzantine attack","2020","After a shipwreck (ship collision, explosion, disappearance, etc.), people rely on the marine search and rescue wireless sensor networks (MSR-WSNs) as one key weapon to locate and track drowning targets to save lives and assets. However, due to the complex and dynamic ocean environment, marine sensors could be captured by malicious attackers and then become Byzantine sensors. Byzantine sensors may tamper with the actual sensor data at a fixed or time-varying probability and transmit it to the data fusion center (DFC), which renders the normal localization and tracking function of the search and rescue system downgrade or even fail. To address this issue, we develop a New robust marine mobile Multi-Target LocAlization and Tracking scheme called NMTLAT by eliminating abnormal measurement data from the initial measurement data. NMTLAT works in several steps. By analyzing and mining sensors data and behavior, we firstly employ the information entropy of the system composed of a single sensor and their neighbor sensors to develop an efficient dynamic threshold based Byzantine node identification method. After migrating Byzantine sensors, the DFC utilizes sensor-aware and preprocessed marine data of the beacon or honest sensors to complete target localization and trajectory tracking. Specifically, NMTLAT consists of a novel distributed and cooperative multi-target localization and tracking algorithm using both received signal strength indication (RSSI) and priori information of sensors location. NMTLAT employs the importance sampling method to approximate the posterior probability distribution of the sensors and targets location. Furthermore, when the marine target is outside MSR-WSNs coverage, a piecewise function is utilized to characterize the likelihood of finding a drowning target in the search and rescue sea area. Finally, the Lyapunov’s second stability theorem is adopted to measure the stability of the NMTLAT. Our extensive simulation experiments validate that the NMTLAT performance is superior to existing solutions in various marine search and rescue scenarios.","Importance sampling,Lyapunov’s stability theorem,Information entropy,Maritime search and rescue wireless sensor networks,Cooperative localization and tracking,Byzantine sensor identification,"
"experimental evaluation of tengs for energy harvesting in maritime applications","2019","Triboelectric nanogenerators (TENGs) have been recognized as a promising harvesting technology to satisfy the power requirements of some marine activities. Our current work addresses the TENG design for the purpose of energy harvesting in the sea. In this paper we present a prototype currently under development, in which spheres made of a triboelectric material move within a limited volume due to external mechanical excitation. The spheres move along a printed circuit board having several electrodes and a PDMS film deposited on top, producing numerous voltage spikes. Experimental results are provided with time-domain wave forms and power characterization of the TENG.","Triboelectric effect,Sea measurements,Sea surface,power characterization,external mechanical excitation,marine activities,printed circuit board,TENG design,triboelectricity,power requirements,blue energy harvesting,Electrodes,energy harvesting,maritime applications,triboelectric nanogenerators,Nanogenerators,triboelectric material move,Resistance,"
"compound-specific d/h ratios of the marine lakes of palau as proxies for west pacific warm pool hydrologic variability","2011","We tested the use of hydrogen isotopic ratios (δD) of lipids in marine lake sediments from the Micronesian Republic of Palau against the instrumental record of the last century to assess their capacity to record past hydrological changes of the Western Pacific Warm Pool. δD values of the algal lipid biomarker dinosterol (δDDino) and the more generic palmitic acid (δDPA) were found to be sensitive indicators of the intensity of regional precipitation, as recorded by the Southern Oscillation Index (SOI). The observed sensitivity is caused by the combined effect of: 1) The amount effect in tropical precipitation; 2) Dilution of the isotopically heavy saline surface waters with light precipitation; 3) A salinity effect on the biosynthetic D/H fractionation between lipid and lake water. Both lake water δD (δDLake) and δDDino could be expressed as a quadratic function of either precipitation or lake water salinity. δDDino values were used to reconstruct past hydrological changes of the region. Long-term variations in the strength and sign of the El Niño - Southern Oscillation (ENSO) since the Little Ice Age (LIA, ∼1450–1850 A.D.) and during the early Holocene (∼7–9 kyr BP) appeared to dominate decadal variability, and indicate very dry conditions during the LIA. Early Holocene δDDino values were on average ∼10‰ higher than those of recent centuries, which we interpret as a result of millennial scale hydrologic and water mass changes on a global level. The similar ∼35‰ range of δD changes during the early Holocene and last several centuries imply a similar range of decadal-centennial hydrologic variability during those two climate regimes. Our results indicate that a correlation exists between solar irradiance levels and tropical Pacific climate.","West Pacific Warm Pool,Marine lakes,Hydroclimate,Hydrogen isotopes,Paleoclimate,Biomarkers,Palau,"
