"name","year","abstract","keywords"
"joint maritime evaluation of transit escorts joint feasibility study / quick reaction test","2010","This paper provides an overview of the Joint Maritime Evaluation of Transit Escorts (J-METE) Joint Feasibility Study (JFS) and Quick Reaction Test (QRT) undertaken during 2009-2010 under the sponsorship of the Office of the Secretary of Defense (OSD), U.S. Department of Defense (DoD), Operational Test and Evaluation Directorate (DOT&E) Directorate. The JSF and QRT focused on the need to develop and test concepts of operations (CONOPS) and tactics, techniques and procedures (TTP) to protect in-transit/underway High Value Assets (HVAs) in U.S. waters from a threat spectrum that includes underwater vehicles, combat swimmers/suicide divers, conventional naval mines and unconventional underwater improvised explosive devices (UWIEDs). The presentation, views and conclusions discussed here are the responsibility of the author, alone, and must not be attributed to OSD/DoD, the DOT&E Directorate, Wyle Laboratories or Gryphon Technologies.","conventional naval mines,U.S. Navy,MHLD,Terrorism,U.S. Department of Defense,underwater improvised explosive devices,quick reaction test,threat spectrum,suicide diver,high value asset,underwater vehicle,joint feasibility study,underwater vehicles,tactics,Explosives,marine safety,unconventional underwater improvised explosive devices,suicide divers,Underwater vehicles,transit escort,restricted waterways,Sonar,sonar,sensors,chokepoints,high value assets,electro-optical,US Department of Defense,sensor,combat swimmers,Naval Oceanographie Mine Warfare Center,joint maritime evaluation,ports,Naval Oceanographie Command,explosives,UWIEDS,military vehicles,U.S. Coast Guard,mines,techniques and procedures,U.S. Department of Homeland Security,concepts of operations,"
"potential impact of long-life environmental sonobuoys on littoral asw","2009","The focus of military activity has recently shifted from large area engagements to regional conflicts. Consequently, supportive Naval maritime operations have continued to evolve toward littoral warfare in complicated shallow-water, near-shore environments. This evolution requires new sensors, advanced Concept of Operations, and improved data-analysis capabilities, among others. Planning operations in these harsh-environment areas is difficult because accurate predictions of tactical sensor performance depend on detailed knowledge of the local environmental conditions. Tactical mission planning is thus seldom optimal or efficient, often resulting in coverage gaps, increased risk, and reduced mission success. According to a Navy Mission Need Statement, 'Air ASW tactical execution, especially in littoral seas, requires in-situ environmental updates for preflight mission planning. In the conduct of ASW operations, an urgent need for explicit knowledge of environmental variables is required to optimize the effectiveness of operational acoustic sensors, as well as acoustic sensors in development ' The Naval Air Systems Command has considered extended-life environmental sonobuoy concepts to better characterize the littoral environment. Most designs contain a thermistor string to measure ocean temperatures and also hydrophones to measure ambient noise. This type of complex sonobuoy would be more expensive than a traditional single-measurement AXBT but it could provide a more thorough littoral environment assessment. This paper examines the trade-off between increased sensor complexity and improved ASW performance, in terms of cumulative detection probability. Some advantages of an extended-life combined thermistor string/hydrophone approach, compared to AXBTs and tactical hydrophones, are: 1) higher accuracy of the raw data; 2) temporal averaging to smooth out fluctuations; 3) extended area coverage during drift; 4) less chance for surface temperature anomalies (e.g., mixed-layer-depth errors) caused by various electronic and mechanical variability upon impact; 5) opportunities to discover thermal and acoustic feature boundaries during drift; and 6) less need to re-seed thus allowing longer tactical mission times. These advantages are evaluated relative to the following disadvantages: 1) increased cost; 2) potential drift outside the mission area; and 3) need for increased battery life for longer durations. The analysis is tempered by considering how a potential new system might be used. One assumption is that an environmental sampling decision aid is available to determine the minimum number and best initial locations of drifting sensors to meet performance objectives. The November 2007 Requirements Document from the Naval Oceanographic Office states ?Sampling guidance: Development of guidance on the best way to deploy, spatially and temporally, observation systems in order to meet various forecasting, model assimilation, and model evaluation objectives is needed.? Work in this area is reported in this Oceans '09 Conference in a paper entitled ?Uncertainty-based Adaptive AXBT Sampling with SPOTS?, which addresses optimal sampling requirements. For this trade-off analysis, temperature data from watersampling flights in the Sea of Japan off the east coast of Korea were used to simulate expected capability of a long-term drifting thermistor string. Then optimal initial positions for three notional buoys were determined followed by a simulation of drifting positions and data collected over 12 days. Ocean nowcasts were constructed and used to determine acoustic performance of a notional tactical sonobuoy field. The analysis shows that a drifting extended-life thermistor string can provide significant improvement in environmental characterization, tactical planning, and ASW detection performance.","Acoustic measurements,Sea measurements,military systems,Predictive models,Sonar equipment,Sampling methods,Ocean temperature,Noise measurement,littoral ASW,operational acoustic sensors,Thermistors,Temperature measurement,Acoustic sensors,long-life environmental sonobuoys,"
"modelling computational workload in a maritime combat system","2019","In this paper we examine computational workload modelling in a generic maritime combat system. We show how to construct models so that executable modelling can then be used to experiment with different hardware approaches for cost, power or performance improvements. This can assist in identifying problems earlier in the design lifecycle than by using traditional design methodologies such as prototyping. We use a generic sonar suite as an exemplar, showing the considerations required in building executable models for traditional and adaptive beamforming algorithms.","computational workload modelling,executable models,array signal processing,generic sonar suite,sonar processing,public domain software,Array signal processing,military computing,marine engineering,Hardware,hardware approach,computational workload,maritime combat system,Sonar,combat systems,Middleware,Computational modeling,Tools,component,model-driven engineering,design lifecycle,"
"communications-optimized task planning for maritime search and survey","2016","In this study we consider the scheduling of an unmanned underwater vehicle (UUV) performing search and survey of a target area (TA) based on the prediction of communications in maritime environmental conditions. While the UUV sweeps the TA, it gathers sonar data which is communicated back to the main ship via acoustic communications, and via radio frequency (RF) communications by surfacing at the end of a sweep when good communications are predicted. In this study we shown that by placing the most sweeps within the predicted good communication ranges, the information gain rate (IGR) can be maximized, therefore demonstrating the benefits of RF communications prediction capability while performing the survey mission.","information gain rate,maritime environmental conditions,remotely operated vehicles,Sonar detection,Marine vehicles,communications-optimized task planning,underwater vehicles,Radio frequency,sonar data,Atmospheric modeling,radiofrequency communications,Vehicles,ships,maritime survey,target area,acoustic communications,maritime search,sonar,underwater acoustic communication,communication prediction,main ship,unmanned underwater vehicle scheduling,Sensors,UUV,"
"morpho-bathymetric acoustic surveys as a tool for mapping traces of anthropogenic activities on the seafloor: the case study of the taranto area, southern italy","2022","In this study, an investigation procedure for mapping the traces of anthropogenic activities on the seafloor is proposed. Analyses are based on the interpretation of acoustic data (Multibeam Echosounder and Side Scan Sonar) acquired in the Taranto coastal area. Specific GIS tools supported the acoustic data analysis, interpretation, and mapping. These analyses highlighted that the seafloor of both coastal basins included in the investigated area is affected by a high distribution of traces related to different anthropogenic activities such as dredging, shipping, and mussel farming activities. Such kind of traces resulted efficiently detectable from morpho-bathymetric acoustic data. In particular, groove traces resulted highly distributed in both basins, while sunken mussel farm facilities are widely distributed in the Mar Grande basin. The results highlight as acoustic surveys represent a useful tool for orienting effective coastal management actions. This study points out how geophysical surveys support the geo-environmental characterization of highly urbanized coastal sectors.","Multibeam Echosounder,Contaminated coastal sites,Coastal geomorphology,Side Scan Sonar,Mar Grande,Mar Piccolo,"
"4-dimensional virtual aids to navigation for arctic maritime transits","2017","Vast expanses of the Arctic are opening to exploration, natural resource acquisition and even tourism as the sea ice recedes. The setting for this research is between Alaska in the United States and Russia that has been the subject of a recent Port Access Route Study of the Bering Sea, Bering Strait and Chukchi Sea performed by the United States Coast Guard. Few, if any hydrographic surveys to modern standards have been performed in these areas other than along this specific route that was recently surveyed by the National Oceanic and Atmospheric Administration. Due to the large geographic areas involved and a lack of national assets, aids to navigation in the form of buoys, lights and other physical aids do not exist. This paper describes the creation of navigation infrastructure through a new concept for Virtual Aids to Navigation that enhances safety of navigation, requires no physical infrastructure and can be placed and maintained in remote marine environments hostile to physical and AIS radio-based aids to navigation.","VAtoN,Chukchi Sea,virtual aid to navigation,AIS radio-based aids,marine navigation,electronic AtoN,Arctic maritime transits,Radio navigation,buoy,Sonar navigation,sea ice,physical AtoN,hydrographic surveys,Russia,light,4D virtual aids,National Oceanic and Atmospheric Administration,Port Access Route Study,Artificial intelligence,Alaska,oceanographic regions,AIS radio-based aids to navigation,natural resource acquisition,Arctic,beacon,Hazards,Bering Strait,United States Coast Guard,Bering Sea,Global navigation satellite system,oceanographic techniques,"
"localization of an underwater beacon in task2 of maritime robotx","2019","This paper provides a method to localize an underwater beacon in real-time and overcome the challenge of SNR due to ambient noise and multiple reflections. The signal of beacon is a 4-ms pulse per 0.5 second, 1 second or 2 seconds, and the frequency is 25 to 40 kHz in 0.5 kHz increment. Details of this information is not disclosed until the day of the competition, which adds to the challenges. The algorithm for calculating direction where target signal is coming from is time difference of arrival(TDOA). In order to receive the time difference, we use two hydrophones at two different positions. After getting the time difference, incident angle can be calculated consequently, thus the direction which the target signal is from can be determined.","time-of-arrival estimation,Localization of Underwater Acoustic Source,time 0.5 s,time 2.0 s,maritime RobotX,hydrophones,frequency 25.0 kHz to 40.0 kHz,Oceans,Signal processing,Robots,Time Difference of Arrival,underwater beacon,Logic gates,frequency 0.5 kHz,ambient noise,Underwater acoustics,Sonar equipment,time difference of arrival,target signal,Task analysis,Maritime RobotX,acoustic signal processing,time 1.0 s,multiple reflections,oceanographic techniques,"
"maritime vehicle tracking using underwater gliders and particle filters","2016","A major difficulty in tracking unidentified vessels at sea is due to the need to observe large areas for long periods of time for sparsely appearing targets. A possible solution is to use a network of energy efficient underwater gliders that use buoyancy engines and are equipped with sensor array, processing, and communication hardware. Gliders, however, have a limited size and payload which limits the length of their sensor array and the capabilities of their power, processing, and communication modules. This reduces the resolution of measurements that can be collected and processed on board of gliders and be communicated to a fusion center for accurate target tracking. In this work, we propose the use of adaptive compressive sensing and processing to enable accurate target tracking while using low signal acquisition, processing, and communication rates, short sensor array lengths, and simplified sensing and processing hardware hosted on gliders. Moreover, we propose a particle filtering method to fuse data from multiple sensing nodes and process sensor array measurements with non-linear, non-Gaussian relationship to the target state. A simulation based scenario of tracking a single target by four underwater gliders is used to evaluate the effectiveness of the method.","energy efficient underwater gliders,Gaussian relationship,fusion center,Compressed sensing,adaptive compressive sensing,Gliders,underwater gliders,buoyancy engines,underwater vehicles,particle filters,target tracking,communication hardware,single target,Target tracking,particle filtering (numerical methods),maritime vehicle tracking,sensor array measurements,Radar tracking,underwater acoustic communication,Sensor arrays,Sonar equipment,Engines,short sensor array lengths,signal acquisition,communication rates,unidentified vessels,"
"video processing from electro-optical sensors for object detection and tracking in a maritime environment: a survey","2017","We present a survey on maritime object detection and tracking approaches, which are essential for the development of a navigational system for autonomous ships. The electro-optical (EO) sensor considered here is a video camera that operates in the visible or the infrared spectra, which conventionally complements radar and sonar for situational awareness at sea and has demonstrated its effectiveness over the last few years. This paper provides a comprehensive overview of various approaches of video processing for object detection and tracking in the maritime environment. We follow an approach-based taxonomy wherein the advantages and limitations of each approach are compared. The object detection system consists of the following modules: horizon detection, static background subtraction, and foreground segmentation. Each of these has been studied extensively in maritime situations and has been shown to be challenging due to the presence of background motion especially due to waves and wakes. The key processes involved in object tracking include video frame registration, dynamic background subtraction, and the object tracking algorithm itself. The challenges for robust tracking arise due to camera motion, dynamic background, and low contrast of tracked object, possibly due to environmental degradation. The survey also discusses multisensor approaches and commercial maritime systems that use EO sensors. The survey also highlights methods from computer vision research, which hold promise to perform well in maritime EO data processing. Performance of several maritime and computer vision techniques is evaluated on Singapore Maritime Dataset.","Image edge detection,electro-optical sensors,sensor fusion,infrared spectra,Cameras,Marine vehicles,Singapore maritime dataset,static background subtraction,maritime EO data processing,video frame registration,maritime object detection,multisensor approaches,computer vision techniques,object tracking,ships,EO sensor,marine engineering,maritime navigation,computer vision,autonomous automobiles,object detection,horizon detection,commercial maritime systems,Radar tracking,navigational system,taxonomy,Maritime vehicles,electro-optical devices,image registration,video signal processing,environmental degradation,video camera,maritime environment,sea situational awareness,dynamic background subtraction,Object detection,image segmentation,foreground segmentation,video processing,autonomous ships,Intelligent sensors,video cameras,"
"multisensor tracking and fusion for maritime surveillance","2007","Over the past several years, the NATO Undersea Research Centre has conducted extensive research in multisensor networks for undersea surveillance, culminating in the development of the DMHT tracker. In this paper, we discuss upgrades to this technology and its application to maritime surveillance.","Fusion,sensor fusion,DMHT tracker,Anomaly Detection,multisensor tracking,Sea measurements,multisensor fusion,SAR,Multisensor Fusion and Tracking,Synthetic aperture radar,Track,Maritime Surveillance,maritime surveillance,Target tracking,Signal processing,Imagery,undersea surveillance,Radar tracking,Identification System (AIS),Fusion power generation,Coastal Radar,Sonar equipment,marine communication,Radar imaging,Surveillance,NATO Undersea Research Centre,Automatic,Radar detection,"
"multi-platform bearings-only tracking fusion of maritime targets","2001","The estimation of target position and velocity is attempted on the basis of angular measurements only. This topic is of interest for passive radar, sonar and electronic warfare systems; in these cases. the maritime target radiates either an electromagnetic or an acoustic wave. The modified gain extended Kalman filter of single platform is used for the tracking of maritime targets, and a fusion algorithm for multi-platform bearing-only tracking is developed. Computer simulations show that the fusion algorithm has better performance than-single platform tracking.","angular measurements,Electromagnetic measurements,military radar,sensor fusion,Position measurement,Kalman filters,sonar tracking,Electromagnetic scattering,fusion algorithm,passive radar,multi-platform bearing-only tracking,target position estimation,electromagnetic wave,target tracking,Sonar measurements,electronic warfare,acoustic wave,Target tracking,performance,Radar tracking,Electronic warfare,sonar,electronic warfare systems,direction-of-arrival estimation,radar tracking,Acoustic measurements,velocity estimation,Velocity measurement,Passive radar,modified gain extended Kalman filter,maritime target,"
"observer/amar g4 passive acoustic monitoring system for autonomous maritime observation","2018","The features of a new generation of Passive Acoustic Monitoring (PAM) electronics, algorithms, and associated software are described. JASCO's â€œObserver/AMAR G4â€ is a family of components configured to deliver a wide spectrum of functionality to users and researchers. The capabilities of the Observer/AMAR family of components are described via a walkthrough of recent Observer/AMAR glider deployments and trials, with a focus on functionality, collected data, and lessons learned. The trials include an Observer-based Slocum glider (Teledyne Webb Research) deployed in the Gulf of St. Lawrence, Atlantic Canada, in search of endangered North Atlantic right whales. Installations and test deployments in Seaglider (Kongsberg) on the west coast of Norway and in SEAEXPLORER (ALSEAMAR) on the south coast of France are also described. The development and the beneficial capabilities of these novel systems are described, as well as the results from these trial deployments.","autonomous maritime observation,recording,real-time,Monitoring,endangered North Atlantic right whales,detectors,Observer/AMAR glider deployments,Observers,in-situ,glider,oceanographic equipment,autonomous underwater vehicles,Observer-based Slocum glider,Floors,Observer/AMAR G4 Passive Acoustic Monitoring System,Real-time systems,Acoustics,Clocks,Unmanned Underwater Vehicle (UUV),Sonar equipment,passive Acoustic Monitoring (PAM),Teledyne Webb Research,trial deployments,JASCO Observer/AMAR G4,test deployments,north Atlantic right whales,bioacoustics,oceanographic techniques,"
"insights from archaeological analysis and interpretation of marine data sets to inform marine cultural heritage management and planning of wave and tidal energy development for orkney waters and the pentland firth, ne scotland","2014","The Orkney archipelago has a rich heritage that includes the Heart of Neolithic Orkney World Heritage Site, Viking settlements, harbours supplying Hudson's Bay Company ships, and the wartime naval base of Scapa Flow. This rich history has left its mark on the seabed but accurate maps showing the location and character of surviving seabed archaeology do not exist to the same extent as for archaeology on land. ORCA Marine was commissioned by Historic Scotland to work with the Royal Commission on the Ancient and Historical Monuments of Scotland in interrogating marine data sets to enhance historic environment records of Orkney Waters and the Pentland Firth. These waters were prioritised for their history of maritime activity and to help guide planning and developments in an area highlighted by the Scottish Government for marine renewable energy. A variety of recent and legacy datasets, including wreck databases; sonar data gathered by public sector bodies; aerial photography; seabed cores; Admiralty charts; and local knowledge, were examined for their effectiveness in discovering and interpreting marine cultural heritage cost-effectively. A methodology was developed that enabled marine cultural heritage information to be quickly assimilated within the national and regional inventories for dissemination online. Polygonisation of records resulted in GIS-based shapefiles identifying site extents, and areas of archaeological potential in relation to wrecks, submerged prehistoric landscapes, anchorages and fishing areas. Substantial gaps in data coverage were identified and areas of the seabed have been surveyed at resolutions that are sufficient to detect large upstanding remains such as iron shipwrecks but insufficient to identify smaller archaeological features. Other geophysical datasets have been created at a resolution detailed enough to allow the recognition of smaller anomalies but in some cases processing of the data has removed small anomalies of interest to archaeologists. Intensively used marine areas often contain the most artefactual remains such as historic ports being developed to service the marine renewable industry. Zones of high wave and tidal energy favoured for renewable energy devices include navigation channels and hazards where a large number of wrecks are documented. Transmission cable routes cross deep water where 20th-century wartime losses occurred. Planning and development of infrastructure relating to renewables may also interact with significant built heritage and archaeology on the foreshore and coast edge.",""
"multiple robot operations for maritime search and rescue in eurathlon 2015 competition","2016","This paper presents results of the INESC TEC participation in the maritime environment (both at surface and underwater) integrated in the ICARUS team in the euRathlon 2015 robotics search and rescue competition. These relate to the marine robots from INESC TEC, surface (ROAZ USV) and underwater (MARES AUV) autonomous vehicles participation in multiple tasks such as situation assessment, underwater mapping, leak detection or victim localization. This participation was integrated in the ICARUS Team resulting of the EU funded project aimed to develop robotic tools for large scale disasters. The coordinated search and rescue missions were performed with an initial surface survey providing data for AUV mission planning and execution. A situation assessment bathymetry map, sidescan sonar imaging and location of structures, underwater leaks and victims were achieved, with the global ICARUS team (involving sea, air and land coordinated robots) participating in the final grand Challenge and achieving the second place.","sidescan sonar imaging,maritime search-and-rescue,Inspection,multi-robot systems,marine robots,multiple robot operations,SLAM (robots),AUV mission execution,robotic tools,AUV mission planning,ICARUS team,underwater autonomous vehicles,Vehicles,MARES AUV,leak detection,ROAZ USV,autonomous underwater vehicles,Sea surface,Sonar,INESC TEC participation,underwater mapping,rescue robots,victim localization,Robot kinematics,maritime environment,sonar imaging,Navigation,situation assessment bathymetry map,large scale disasters,surface autonomous vehicles,"
